"No.","Time","Source","Destination","Protocol","Source Port","Dest Port","Length","Info"
"1","2020-07-12 20:54:38.115614448","192.168.56.102","192.168.56.255","NBNS","137","137","92","Name query NB WORKGROUP<1d>"
"2","2020-07-12 20:54:38.115854052","192.168.56.101","192.168.56.102","NBNS","137","137","104","Name query response NB 192.168.56.101"
"3","2020-07-12 20:54:38.115905970","192.168.56.1","255.255.255.255","NBNS","54926","137","92","Name query NB WORKGROUP<1d>"
"4","2020-07-12 20:54:38.116133751","192.168.56.101","192.168.56.1","NBNS","137","54926","104","Name query response NB 192.168.56.101"
"5","2020-07-12 20:54:43.120683917","PcsCompu_ae:93:92","PcsCompu_af:7b:18","ARP","","","60","Who has 192.168.56.102? Tell 192.168.56.101"
"6","2020-07-12 20:54:43.120710417","PcsCompu_ae:93:92","0a:00:27:00:00:1a","ARP","","","60","Who has 192.168.56.1? Tell 192.168.56.101"
"7","2020-07-12 20:54:43.120711737","0a:00:27:00:00:1a","PcsCompu_ae:93:92","ARP","","","60","192.168.56.1 is at 0a:00:27:00:00:1a"
"8","2020-07-12 20:54:43.121003898","PcsCompu_af:7b:18","PcsCompu_ae:93:92","ARP","","","60","192.168.56.102 is at 08:00:27:af:7b:18"
"9","2020-07-12 20:54:51.116719776","192.168.56.102","192.168.56.101","TCP","60348","22","74","60348  >  22 [SYN] Seq=0 Win=29200 Len=0 MSS=1460 SACK_PERM=1 TSval=2059235 TSecr=0 WS=128"
"10","2020-07-12 20:54:51.116968323","192.168.56.101","192.168.56.102","TCP","22","60348","74","22  >  60348 [SYN, ACK] Seq=0 Ack=1 Win=28960 Len=0 MSS=1460 SACK_PERM=1 TSval=2059827 TSecr=2059235 WS=128"
"11","2020-07-12 20:54:51.117136487","192.168.56.102","192.168.56.101","TCP","60348","22","66","60348  >  22 [ACK] Seq=1 Ack=1 Win=29312 Len=0 TSval=2059235 TSecr=2059827"
"12","2020-07-12 20:54:51.117454455","192.168.56.102","192.168.56.101","SSHv2","60348","22","107","Client: Protocol (SSH-2.0-OpenSSH_7.2p2 Ubuntu-4ubuntu2.1)"
"13","2020-07-12 20:54:51.117678816","192.168.56.101","192.168.56.102","TCP","22","60348","66","22  >  60348 [ACK] Seq=1 Ack=42 Win=29056 Len=0 TSval=2059827 TSecr=2059236"
"14","2020-07-12 20:54:51.123372351","192.168.56.101","192.168.56.102","SSHv2","22","60348","110","Server: Protocol (SSH-2.0-OpenSSH_6.6.1p1 Ubuntu-2ubuntu2.13)"
"15","2020-07-12 20:54:51.123556914","192.168.56.102","192.168.56.101","TCP","60348","22","66","60348  >  22 [ACK] Seq=42 Ack=45 Win=29312 Len=0 TSval=2059237 TSecr=2059828"
"16","2020-07-12 20:54:51.124159221","192.168.56.102","192.168.56.101","SSHv2","60348","22","1402","Client: Key Exchange Init"
"17","2020-07-12 20:54:51.124399493","192.168.56.101","192.168.56.102","SSHv2","22","60348","1698","Server: Key Exchange Init"
"18","2020-07-12 20:54:51.124667532","192.168.56.102","192.168.56.101","TCP","60348","22","66","60348  >  22 [ACK] Seq=1378 Ack=1677 Win=32512 Len=0 TSval=2059237 TSecr=2059829"
"19","2020-07-12 20:54:51.128074943","192.168.56.102","192.168.56.101","SSHv2","60348","22","114","Client: Elliptic Curve Diffie-Hellman Key Exchange Init"
"20","2020-07-12 20:54:51.130917630","192.168.56.101","192.168.56.102","SSHv2","22","60348","346","Server: Elliptic Curve Diffie-Hellman Key Exchange Reply, New Keys"
"21","2020-07-12 20:54:51.133686738","192.168.56.102","192.168.56.101","SSHv2","60348","22","82","Client: New Keys"
"22","2020-07-12 20:54:51.172592067","192.168.56.101","192.168.56.102","TCP","22","60348","66","22  >  60348 [ACK] Seq=1957 Ack=1442 Win=31872 Len=0 TSval=2059841 TSecr=2059240"
"23","2020-07-12 20:54:51.172789155","192.168.56.102","192.168.56.101","SSHv2","60348","22","110","Client: Encrypted packet (len=44)"
"24","2020-07-12 20:54:51.172907596","192.168.56.101","192.168.56.102","TCP","22","60348","66","22  >  60348 [ACK] Seq=1957 Ack=1486 Win=31872 Len=0 TSval=2059841 TSecr=2059249"
"25","2020-07-12 20:54:51.173064740","192.168.56.101","192.168.56.102","SSHv2","22","60348","110","Server: Encrypted packet (len=44)"
"26","2020-07-12 20:54:51.173277104","192.168.56.102","192.168.56.101","SSHv2","60348","22","134","Client: Encrypted packet (len=68)"
"27","2020-07-12 20:54:51.175622590","192.168.56.101","192.168.56.102","SSHv2","22","60348","118","Server: Encrypted packet (len=52)"
"28","2020-07-12 20:54:51.213586162","192.168.56.102","192.168.56.101","TCP","60348","22","66","60348  >  22 [ACK] Seq=1554 Ack=2053 Win=35456 Len=0 TSval=2059260 TSecr=2059841"
"29","2020-07-12 20:54:59.731895347","192.168.56.102","192.168.56.101","SSHv2","60348","22","214","Client: Encrypted packet (len=148)"
"30","2020-07-12 20:54:59.739153103","192.168.56.101","192.168.56.102","SSHv2","22","60348","94","Server: Encrypted packet (len=28)"
"31","2020-07-12 20:54:59.739278172","192.168.56.102","192.168.56.101","TCP","60348","22","66","60348  >  22 [ACK] Seq=1702 Ack=2081 Win=35456 Len=0 TSval=2061391 TSecr=2061982"
"32","2020-07-12 20:54:59.739427356","192.168.56.102","192.168.56.101","SSHv2","60348","22","178","Client: Encrypted packet (len=112)"
"33","2020-07-12 20:54:59.776277273","192.168.56.101","192.168.56.102","TCP","22","60348","66","22  >  60348 [ACK] Seq=2081 Ack=1814 Win=34560 Len=0 TSval=2061992 TSecr=2061391"
"34","2020-07-12 20:55:00.105994563","192.168.56.101","192.168.56.102","SSHv2","22","60348","110","Server: Encrypted packet (len=44)"
"35","2020-07-12 20:55:00.106270405","192.168.56.102","192.168.56.101","SSHv2","60348","22","510","Client: Encrypted packet (len=444)"
"36","2020-07-12 20:55:00.106391662","192.168.56.101","192.168.56.102","TCP","22","60348","66","22  >  60348 [ACK] Seq=2125 Ack=2258 Win=37248 Len=0 TSval=2062074 TSecr=2061483"
"37","2020-07-12 20:55:00.107548553","192.168.56.101","192.168.56.102","SSHv2","22","60348","174","Server: Encrypted packet (len=108)"
"38","2020-07-12 20:55:00.109265562","192.168.56.101","192.168.56.102","SSHv2","22","60348","614","Server: Encrypted packet (len=548)"
"39","2020-07-12 20:55:00.109569337","192.168.56.102","192.168.56.101","TCP","60348","22","66","60348  >  22 [ACK] Seq=2258 Ack=2781 Win=38272 Len=0 TSval=2061484 TSecr=2062074"
"40","2020-07-12 20:55:00.193669040","192.168.56.101","192.168.56.102","SSHv2","22","60348","126","Server: Encrypted packet (len=60)"
"41","2020-07-12 20:55:00.233966416","192.168.56.102","192.168.56.101","TCP","60348","22","66","60348  >  22 [ACK] Seq=2258 Ack=2841 Win=38272 Len=0 TSval=2061515 TSecr=2062096"
"42","2020-07-12 20:55:02.411669961","192.168.56.102","192.168.56.101","SSHv2","60348","22","102","Client: Encrypted packet (len=36)"
"43","2020-07-12 20:55:02.412045634","192.168.56.101","192.168.56.102","SSHv2","22","60348","102","Server: Encrypted packet (len=36)"
"44","2020-07-12 20:55:02.412300039","192.168.56.102","192.168.56.101","TCP","60348","22","66","60348  >  22 [ACK] Seq=2294 Ack=2877 Win=38272 Len=0 TSval=2062059 TSecr=2062651"
"45","2020-07-12 20:55:02.601267197","192.168.56.102","192.168.56.101","SSHv2","60348","22","102","Client: Encrypted packet (len=36)"
"46","2020-07-12 20:55:02.601604639","192.168.56.101","192.168.56.102","SSHv2","22","60348","102","Server: Encrypted packet (len=36)"
"47","2020-07-12 20:55:02.601759862","192.168.56.102","192.168.56.101","TCP","60348","22","66","60348  >  22 [ACK] Seq=2330 Ack=2913 Win=38272 Len=0 TSval=2062107 TSecr=2062698"
"48","2020-07-12 20:55:03.131371737","192.168.56.102","192.168.56.101","SSHv2","60348","22","102","Client: Encrypted packet (len=36)"
"49","2020-07-12 20:55:03.131769016","192.168.56.101","192.168.56.102","SSHv2","22","60348","102","Server: Encrypted packet (len=36)"
"50","2020-07-12 20:55:03.131963957","192.168.56.102","192.168.56.101","TCP","60348","22","66","60348  >  22 [ACK] Seq=2366 Ack=2949 Win=38272 Len=0 TSval=2062239 TSecr=2062830"
"51","2020-07-12 20:55:03.133180304","192.168.56.101","192.168.56.102","SSHv2","22","60348","126","Server: Encrypted packet (len=60)"
"52","2020-07-12 20:55:03.133300479","192.168.56.101","192.168.56.102","SSHv2","22","60348","102","Server: Encrypted packet (len=36)"
"53","2020-07-12 20:55:03.133304145","192.168.56.102","192.168.56.101","TCP","60348","22","66","60348  >  22 [ACK] Seq=2366 Ack=3009 Win=38272 Len=0 TSval=2062240 TSecr=2062831"
"54","2020-07-12 20:55:03.133695583","192.168.56.102","192.168.56.101","TCP","60348","22","66","60348  >  22 [ACK] Seq=2366 Ack=3045 Win=38272 Len=0 TSval=2062240 TSecr=2062831"
"55","2020-07-12 20:55:03.133712325","192.168.56.101","192.168.56.102","SSHv2","22","60348","126","Server: Encrypted packet (len=60)"
"56","2020-07-12 20:55:03.133823087","192.168.56.102","192.168.56.101","TCP","60348","22","66","60348  >  22 [ACK] Seq=2366 Ack=3105 Win=38272 Len=0 TSval=2062240 TSecr=2062831"
"57","2020-07-12 20:55:05.191245541","192.168.56.102","192.168.56.101","SSHv2","60348","22","102","Client: Encrypted packet (len=36)"
"58","2020-07-12 20:55:05.191587820","192.168.56.101","192.168.56.102","SSHv2","22","60348","102","Server: Encrypted packet (len=36)"
"59","2020-07-12 20:55:05.191775713","192.168.56.102","192.168.56.101","TCP","60348","22","66","60348  >  22 [ACK] Seq=2402 Ack=3141 Win=38272 Len=0 TSval=2062754 TSecr=2063345"
"60","2020-07-12 20:55:05.441152244","192.168.56.102","192.168.56.101","SSHv2","60348","22","102","Client: Encrypted packet (len=36)"
"61","2020-07-12 20:55:05.441481400","192.168.56.101","192.168.56.102","SSHv2","22","60348","102","Server: Encrypted packet (len=36)"
"62","2020-07-12 20:55:05.441626775","192.168.56.102","192.168.56.101","TCP","60348","22","66","60348  >  22 [ACK] Seq=2438 Ack=3177 Win=38272 Len=0 TSval=2062817 TSecr=2063408"
"63","2020-07-12 20:55:05.741232730","192.168.56.102","192.168.56.101","SSHv2","60348","22","102","Client: Encrypted packet (len=36)"
"64","2020-07-12 20:55:05.741598193","192.168.56.101","192.168.56.102","SSHv2","22","60348","102","Server: Encrypted packet (len=36)"
"65","2020-07-12 20:55:05.741720373","192.168.56.102","192.168.56.101","TCP","60348","22","66","60348  >  22 [ACK] Seq=2474 Ack=3213 Win=38272 Len=0 TSval=2062892 TSecr=2063483"
"66","2020-07-12 20:55:05.971079863","192.168.56.102","192.168.56.101","SSHv2","60348","22","102","Client: Encrypted packet (len=36)"
"67","2020-07-12 20:55:05.971373718","192.168.56.101","192.168.56.102","SSHv2","22","60348","102","Server: Encrypted packet (len=36)"
"68","2020-07-12 20:55:05.971516264","192.168.56.102","192.168.56.101","TCP","60348","22","66","60348  >  22 [ACK] Seq=2510 Ack=3249 Win=38272 Len=0 TSval=2062949 TSecr=2063540"
"69","2020-07-12 20:55:06.141263966","192.168.56.102","192.168.56.101","SSHv2","60348","22","102","Client: Encrypted packet (len=36)"
"70","2020-07-12 20:55:06.141680402","192.168.56.101","192.168.56.102","SSHv2","22","60348","102","Server: Encrypted packet (len=36)"
"71","2020-07-12 20:55:06.141876673","192.168.56.102","192.168.56.101","TCP","60348","22","66","60348  >  22 [ACK] Seq=2546 Ack=3285 Win=38272 Len=0 TSval=2062992 TSecr=2063583"
"72","2020-07-12 20:55:06.262404170","192.168.56.102","192.168.56.101","SSHv2","60348","22","102","Client: Encrypted packet (len=36)"
"73","2020-07-12 20:55:06.263322501","192.168.56.101","192.168.56.102","SSHv2","22","60348","102","Server: Encrypted packet (len=36)"
"74","2020-07-12 20:55:06.263581818","192.168.56.102","192.168.56.101","TCP","60348","22","66","60348  >  22 [ACK] Seq=2582 Ack=3321 Win=38272 Len=0 TSval=2063022 TSecr=2063613"
"75","2020-07-12 20:55:06.281785278","192.168.56.102","192.168.56.101","SSHv2","60348","22","102","Client: Encrypted packet (len=36)"
"76","2020-07-12 20:55:06.282179051","192.168.56.101","192.168.56.102","SSHv2","22","60348","102","Server: Encrypted packet (len=36)"
"77","2020-07-12 20:55:06.321723134","192.168.56.102","192.168.56.101","TCP","60348","22","66","60348  >  22 [ACK] Seq=2618 Ack=3357 Win=38272 Len=0 TSval=2063037 TSecr=2063618"
"78","2020-07-12 20:55:06.394564240","192.168.56.102","192.168.56.101","SSHv2","60348","22","102","Client: Encrypted packet (len=36)"
"79","2020-07-12 20:55:06.394982361","192.168.56.101","192.168.56.102","SSHv2","22","60348","102","Server: Encrypted packet (len=36)"
"80","2020-07-12 20:55:06.395097593","192.168.56.102","192.168.56.101","TCP","60348","22","66","60348  >  22 [ACK] Seq=2654 Ack=3393 Win=38272 Len=0 TSval=2063055 TSecr=2063646"
"81","2020-07-12 20:55:06.971411234","192.168.56.102","192.168.56.101","SSHv2","60348","22","102","Client: Encrypted packet (len=36)"
"82","2020-07-12 20:55:06.971719596","192.168.56.101","192.168.56.102","SSHv2","22","60348","102","Server: Encrypted packet (len=36)"
"83","2020-07-12 20:55:06.971863922","192.168.56.102","192.168.56.101","TCP","60348","22","66","60348  >  22 [ACK] Seq=2690 Ack=3429 Win=38272 Len=0 TSval=2063199 TSecr=2063790"
"84","2020-07-12 20:55:06.972127371","192.168.56.101","192.168.56.102","SSHv2","22","60348","126","Server: Encrypted packet (len=60)"
"85","2020-07-12 20:55:06.972308511","192.168.56.102","192.168.56.101","TCP","60348","22","66","60348  >  22 [ACK] Seq=2690 Ack=3489 Win=38272 Len=0 TSval=2063199 TSecr=2063791"
"86","2020-07-12 20:55:07.921385485","192.168.56.102","192.168.56.101","SSHv2","60348","22","102","Client: Encrypted packet (len=36)"
"87","2020-07-12 20:55:07.921717818","192.168.56.101","192.168.56.102","SSHv2","22","60348","102","Server: Encrypted packet (len=36)"
"88","2020-07-12 20:55:07.921863215","192.168.56.102","192.168.56.101","TCP","60348","22","66","60348  >  22 [ACK] Seq=2726 Ack=3525 Win=38272 Len=0 TSval=2063437 TSecr=2064028"
"89","2020-07-12 20:55:08.041173751","192.168.56.102","192.168.56.101","SSHv2","60348","22","102","Client: Encrypted packet (len=36)"
"90","2020-07-12 20:55:08.041473326","192.168.56.101","192.168.56.102","SSHv2","22","60348","102","Server: Encrypted packet (len=36)"
"91","2020-07-12 20:55:08.041541918","192.168.56.102","192.168.56.101","TCP","60348","22","66","60348  >  22 [ACK] Seq=2762 Ack=3561 Win=38272 Len=0 TSval=2063467 TSecr=2064058"
"92","2020-07-12 20:55:08.631085269","192.168.56.102","192.168.56.101","SSHv2","60348","22","102","Client: Encrypted packet (len=36)"
"93","2020-07-12 20:55:08.631487643","192.168.56.101","192.168.56.102","SSHv2","22","60348","102","Server: Encrypted packet (len=36)"
"94","2020-07-12 20:55:08.631626281","192.168.56.102","192.168.56.101","TCP","60348","22","66","60348  >  22 [ACK] Seq=2798 Ack=3597 Win=38272 Len=0 TSval=2063614 TSecr=2064205"
"95","2020-07-12 20:55:08.633379879","192.168.56.101","192.168.56.102","SSHv2","22","60348","142","Server: Encrypted packet (len=76)"
"96","2020-07-12 20:55:08.633488159","192.168.56.101","192.168.56.102","SSHv2","22","60348","102","Server: Encrypted packet (len=36)"
"97","2020-07-12 20:55:08.633491715","192.168.56.102","192.168.56.101","TCP","60348","22","66","60348  >  22 [ACK] Seq=2798 Ack=3673 Win=38272 Len=0 TSval=2063615 TSecr=2064206"
"98","2020-07-12 20:55:08.633652394","192.168.56.101","192.168.56.102","SSHv2","22","60348","150","Server: Encrypted packet (len=84)"
"99","2020-07-12 20:55:08.633752159","192.168.56.101","192.168.56.102","SSHv2","22","60348","102","Server: Encrypted packet (len=36)"
"100","2020-07-12 20:55:08.633755148","192.168.56.102","192.168.56.101","TCP","60348","22","66","60348  >  22 [ACK] Seq=2798 Ack=3709 Win=38272 Len=0 TSval=2063615 TSecr=2064206"
"101","2020-07-12 20:55:08.633756821","192.168.56.102","192.168.56.101","TCP","60348","22","66","60348  >  22 [ACK] Seq=2798 Ack=3793 Win=38272 Len=0 TSval=2063615 TSecr=2064206"
"102","2020-07-12 20:55:08.633966986","192.168.56.102","192.168.56.101","TCP","60348","22","66","60348  >  22 [ACK] Seq=2798 Ack=3829 Win=38272 Len=0 TSval=2063615 TSecr=2064206"
"103","2020-07-12 20:55:08.633970038","192.168.56.101","192.168.56.102","SSHv2","22","60348","134","Server: Encrypted packet (len=68)"
"104","2020-07-12 20:55:08.633971462","192.168.56.102","192.168.56.101","TCP","60348","22","66","60348  >  22 [ACK] Seq=2798 Ack=3897 Win=38272 Len=0 TSval=2063615 TSecr=2064206"
"105","2020-07-12 20:55:08.633972798","192.168.56.101","192.168.56.102","SSHv2","22","60348","102","Server: Encrypted packet (len=36)"
"106","2020-07-12 20:55:08.634192787","192.168.56.102","192.168.56.101","TCP","60348","22","66","60348  >  22 [ACK] Seq=2798 Ack=3933 Win=38272 Len=0 TSval=2063615 TSecr=2064206"
"107","2020-07-12 20:55:08.634195692","192.168.56.101","192.168.56.102","SSHv2","22","60348","126","Server: Encrypted packet (len=60)"
"108","2020-07-12 20:55:08.634197274","192.168.56.101","192.168.56.102","SSHv2","22","60348","102","Server: Encrypted packet (len=36)"
"109","2020-07-12 20:55:08.634198535","192.168.56.102","192.168.56.101","TCP","60348","22","66","60348  >  22 [ACK] Seq=2798 Ack=3993 Win=38272 Len=0 TSval=2063615 TSecr=2064206"
"110","2020-07-12 20:55:08.634199876","192.168.56.102","192.168.56.101","TCP","60348","22","66","60348  >  22 [ACK] Seq=2798 Ack=4029 Win=38272 Len=0 TSval=2063615 TSecr=2064206"
"111","2020-07-12 20:55:08.634413149","192.168.56.101","192.168.56.102","SSHv2","22","60348","126","Server: Encrypted packet (len=60)"
"112","2020-07-12 20:55:08.634577749","192.168.56.102","192.168.56.101","TCP","60348","22","66","60348  >  22 [ACK] Seq=2798 Ack=4089 Win=38272 Len=0 TSval=2063615 TSecr=2064206"
"113","2020-07-12 20:55:08.634580213","192.168.56.101","192.168.56.102","SSHv2","22","60348","102","Server: Encrypted packet (len=36)"
"114","2020-07-12 20:55:08.634581628","192.168.56.101","192.168.56.102","SSHv2","22","60348","134","Server: Encrypted packet (len=68)"
"115","2020-07-12 20:55:08.634583170","192.168.56.102","192.168.56.101","TCP","60348","22","66","60348  >  22 [ACK] Seq=2798 Ack=4125 Win=38272 Len=0 TSval=2063615 TSecr=2064206"
"116","2020-07-12 20:55:08.634584441","192.168.56.102","192.168.56.101","TCP","60348","22","66","60348  >  22 [ACK] Seq=2798 Ack=4193 Win=38272 Len=0 TSval=2063615 TSecr=2064206"
"117","2020-07-12 20:55:08.634943534","192.168.56.101","192.168.56.102","SSHv2","22","60348","102","Server: Encrypted packet (len=36)"
"118","2020-07-12 20:55:08.634946475","192.168.56.102","192.168.56.101","TCP","60348","22","66","60348  >  22 [ACK] Seq=2798 Ack=4229 Win=38272 Len=0 TSval=2063615 TSecr=2064206"
"119","2020-07-12 20:55:08.634947889","192.168.56.101","192.168.56.102","SSHv2","22","60348","158","Server: Encrypted packet (len=92)"
"120","2020-07-12 20:55:08.634949235","192.168.56.101","192.168.56.102","SSHv2","22","60348","102","Server: Encrypted packet (len=36)"
"121","2020-07-12 20:55:08.635183068","192.168.56.101","192.168.56.102","SSHv2","22","60348","126","Server: Encrypted packet (len=60)"
"122","2020-07-12 20:55:08.635186149","192.168.56.101","192.168.56.102","SSHv2","22","60348","102","Server: Encrypted packet (len=36)"
"123","2020-07-12 20:55:08.635381617","192.168.56.101","192.168.56.102","SSHv2","22","60348","134","Server: Encrypted packet (len=68)"
"124","2020-07-12 20:55:08.635498236","192.168.56.101","192.168.56.102","SSHv2","22","60348","102","Server: Encrypted packet (len=36)"
"125","2020-07-12 20:55:08.635620952","192.168.56.101","192.168.56.102","SSHv2","22","60348","126","Server: Encrypted packet (len=60)"
"126","2020-07-12 20:55:08.635732022","192.168.56.101","192.168.56.102","SSHv2","22","60348","102","Server: Encrypted packet (len=36)"
"127","2020-07-12 20:55:08.636162601","192.168.56.101","192.168.56.102","SSHv2","22","60348","126","Server: Encrypted packet (len=60)"
"128","2020-07-12 20:55:08.636485533","192.168.56.102","192.168.56.101","TCP","60348","22","66","60348  >  22 [ACK] Seq=2798 Ack=4713 Win=38272 Len=0 TSval=2063615 TSecr=2064206"
"129","2020-07-12 20:55:16.412156621","192.168.56.102","192.168.56.101","SSHv2","60348","22","102","Client: Encrypted packet (len=36)"
"130","2020-07-12 20:55:16.412479144","192.168.56.101","192.168.56.102","SSHv2","22","60348","102","Server: Encrypted packet (len=36)"
"131","2020-07-12 20:55:16.412632670","192.168.56.102","192.168.56.101","TCP","60348","22","66","60348  >  22 [ACK] Seq=2834 Ack=4749 Win=38272 Len=0 TSval=2065559 TSecr=2066151"
"132","2020-07-12 20:55:16.512161041","192.168.56.102","192.168.56.101","SSHv2","60348","22","102","Client: Encrypted packet (len=36)"
"133","2020-07-12 20:55:16.512704420","192.168.56.101","192.168.56.102","SSHv2","22","60348","102","Server: Encrypted packet (len=36)"
"134","2020-07-12 20:55:16.512882340","192.168.56.102","192.168.56.101","TCP","60348","22","66","60348  >  22 [ACK] Seq=2870 Ack=4785 Win=38272 Len=0 TSval=2065584 TSecr=2066176"
"135","2020-07-12 20:55:16.692081765","192.168.56.102","192.168.56.101","SSHv2","60348","22","102","Client: Encrypted packet (len=36)"
"136","2020-07-12 20:55:16.692385221","192.168.56.101","192.168.56.102","SSHv2","22","60348","102","Server: Encrypted packet (len=36)"
"137","2020-07-12 20:55:16.692462429","192.168.56.102","192.168.56.101","TCP","60348","22","66","60348  >  22 [ACK] Seq=2906 Ack=4821 Win=38272 Len=0 TSval=2065629 TSecr=2066221"
"138","2020-07-12 20:55:17.532228766","192.168.56.102","192.168.56.101","SSHv2","60348","22","102","Client: Encrypted packet (len=36)"
"139","2020-07-12 20:55:17.532609974","192.168.56.101","192.168.56.102","SSHv2","22","60348","102","Server: Encrypted packet (len=36)"
"140","2020-07-12 20:55:17.532789248","192.168.56.102","192.168.56.101","TCP","60348","22","66","60348  >  22 [ACK] Seq=2942 Ack=4857 Win=38272 Len=0 TSval=2065839 TSecr=2066431"
"141","2020-07-12 20:55:17.997376128","192.168.56.102","192.168.56.100","DHCP","68","67","342","DHCP Request  - Transaction ID 0xb97ed617"
"142","2020-07-12 20:55:18.015879649","192.168.56.100","192.168.56.102","DHCP","67","68","590","DHCP ACK      - Transaction ID 0xb97ed617"
"143","2020-07-12 20:55:18.172407000","192.168.56.102","192.168.56.101","SSHv2","60348","22","102","Client: Encrypted packet (len=36)"
"144","2020-07-12 20:55:18.172730729","192.168.56.101","192.168.56.102","SSHv2","22","60348","102","Server: Encrypted packet (len=36)"
"145","2020-07-12 20:55:18.172894359","192.168.56.102","192.168.56.101","TCP","60348","22","66","60348  >  22 [ACK] Seq=2978 Ack=4893 Win=38272 Len=0 TSval=2065999 TSecr=2066591"
"146","2020-07-12 20:55:18.872265841","192.168.56.102","192.168.56.101","SSHv2","60348","22","102","Client: Encrypted packet (len=36)"
"147","2020-07-12 20:55:18.872579962","192.168.56.101","192.168.56.102","SSHv2","22","60348","110","Server: Encrypted packet (len=44)"
"148","2020-07-12 20:55:18.872775992","192.168.56.102","192.168.56.101","TCP","60348","22","66","60348  >  22 [ACK] Seq=3014 Ack=4937 Win=38272 Len=0 TSval=2066174 TSecr=2066766"
"149","2020-07-12 20:55:19.352215836","192.168.56.102","192.168.56.101","SSHv2","60348","22","102","Client: Encrypted packet (len=36)"
"150","2020-07-12 20:55:19.352730320","192.168.56.101","192.168.56.102","SSHv2","22","60348","102","Server: Encrypted packet (len=36)"
"151","2020-07-12 20:55:19.352941471","192.168.56.102","192.168.56.101","TCP","60348","22","66","60348  >  22 [ACK] Seq=3050 Ack=4973 Win=38272 Len=0 TSval=2066295 TSecr=2066886"
"152","2020-07-12 20:55:19.732845621","192.168.56.102","192.168.56.101","SSHv2","60348","22","102","Client: Encrypted packet (len=36)"
"153","2020-07-12 20:55:19.733257472","192.168.56.101","192.168.56.102","SSHv2","22","60348","102","Server: Encrypted packet (len=36)"
"154","2020-07-12 20:55:19.733419585","192.168.56.102","192.168.56.101","TCP","60348","22","66","60348  >  22 [ACK] Seq=3086 Ack=5009 Win=38272 Len=0 TSval=2066390 TSecr=2066981"
"155","2020-07-12 20:55:19.733653425","192.168.56.101","192.168.56.102","SSHv2","22","60348","126","Server: Encrypted packet (len=60)"
"156","2020-07-12 20:55:19.733834300","192.168.56.102","192.168.56.101","TCP","60348","22","66","60348  >  22 [ACK] Seq=3086 Ack=5069 Win=38272 Len=0 TSval=2066390 TSecr=2066981"
"157","2020-07-12 20:55:23.005273501","PcsCompu_af:7b:18","PcsCompu_77:ba:13","ARP","","","60","Who has 192.168.56.100? Tell 192.168.56.102"
"158","2020-07-12 20:55:23.005280976","PcsCompu_77:ba:13","PcsCompu_af:7b:18","ARP","","","60","192.168.56.100 is at 08:00:27:77:ba:13"
"159","2020-07-12 20:55:26.952489626","192.168.56.102","192.168.56.101","SSHv2","60348","22","102","Client: Encrypted packet (len=36)"
"160","2020-07-12 20:55:26.952816621","192.168.56.101","192.168.56.102","SSHv2","22","60348","102","Server: Encrypted packet (len=36)"
"161","2020-07-12 20:55:26.953015371","192.168.56.102","192.168.56.101","TCP","60348","22","66","60348  >  22 [ACK] Seq=3122 Ack=5105 Win=38272 Len=0 TSval=2068195 TSecr=2068786"
"162","2020-07-12 20:55:27.072296638","192.168.56.102","192.168.56.101","SSHv2","60348","22","102","Client: Encrypted packet (len=36)"
"163","2020-07-12 20:55:27.072564889","192.168.56.101","192.168.56.102","SSHv2","22","60348","102","Server: Encrypted packet (len=36)"
"164","2020-07-12 20:55:27.072674015","192.168.56.102","192.168.56.101","TCP","60348","22","66","60348  >  22 [ACK] Seq=3158 Ack=5141 Win=38272 Len=0 TSval=2068224 TSecr=2068816"
"165","2020-07-12 20:55:27.082934572","192.168.56.104","192.168.56.100","DHCP","68","67","342","DHCP Request  - Transaction ID 0x1e8caf0b"
"166","2020-07-12 20:55:27.123053633","192.168.56.100","192.168.56.104","DHCP","67","68","590","DHCP ACK      - Transaction ID 0x1e8caf0b"
"167","2020-07-12 20:55:27.452121333","192.168.56.102","192.168.56.101","SSHv2","60348","22","102","Client: Encrypted packet (len=36)"
"168","2020-07-12 20:55:27.452514658","192.168.56.101","192.168.56.102","SSHv2","22","60348","102","Server: Encrypted packet (len=36)"
"169","2020-07-12 20:55:27.452633439","192.168.56.102","192.168.56.101","TCP","60348","22","66","60348  >  22 [ACK] Seq=3194 Ack=5177 Win=38272 Len=0 TSval=2068319 TSecr=2068911"
"170","2020-07-12 20:55:27.602222485","192.168.56.102","192.168.56.101","SSHv2","60348","22","102","Client: Encrypted packet (len=36)"
"171","2020-07-12 20:55:27.602609738","192.168.56.101","192.168.56.102","SSHv2","22","60348","102","Server: Encrypted packet (len=36)"
"172","2020-07-12 20:55:27.602833909","192.168.56.102","192.168.56.101","TCP","60348","22","66","60348  >  22 [ACK] Seq=3230 Ack=5213 Win=38272 Len=0 TSval=2068357 TSecr=2068948"
"173","2020-07-12 20:55:28.222165583","192.168.56.102","192.168.56.101","SSHv2","60348","22","102","Client: Encrypted packet (len=36)"
"174","2020-07-12 20:55:28.222592589","192.168.56.101","192.168.56.102","SSHv2","22","60348","110","Server: Encrypted packet (len=44)"
"175","2020-07-12 20:55:28.223158611","192.168.56.102","192.168.56.101","TCP","60348","22","66","60348  >  22 [ACK] Seq=3266 Ack=5257 Win=38272 Len=0 TSval=2068512 TSecr=2069103"
"176","2020-07-12 20:55:28.432098003","192.168.56.102","192.168.56.101","SSHv2","60348","22","102","Client: Encrypted packet (len=36)"
"177","2020-07-12 20:55:28.432493780","192.168.56.101","192.168.56.102","SSHv2","22","60348","110","Server: Encrypted packet (len=44)"
"178","2020-07-12 20:55:28.432673746","192.168.56.102","192.168.56.101","TCP","60348","22","66","60348  >  22 [ACK] Seq=3302 Ack=5301 Win=38272 Len=0 TSval=2068564 TSecr=2069156"
"179","2020-07-12 20:55:28.642075783","192.168.56.102","192.168.56.101","SSHv2","60348","22","102","Client: Encrypted packet (len=36)"
"180","2020-07-12 20:55:28.642422831","192.168.56.101","192.168.56.102","SSHv2","22","60348","102","Server: Encrypted packet (len=36)"
"181","2020-07-12 20:55:28.642544972","192.168.56.102","192.168.56.101","TCP","60348","22","66","60348  >  22 [ACK] Seq=3338 Ack=5337 Win=38272 Len=0 TSval=2068617 TSecr=2069208"
"182","2020-07-12 20:55:29.222020224","192.168.56.102","192.168.56.101","SSHv2","60348","22","102","Client: Encrypted packet (len=36)"
"183","2020-07-12 20:55:29.222406045","192.168.56.101","192.168.56.102","SSHv2","22","60348","102","Server: Encrypted packet (len=36)"
"184","2020-07-12 20:55:29.222487508","192.168.56.102","192.168.56.101","TCP","60348","22","66","60348  >  22 [ACK] Seq=3374 Ack=5373 Win=38272 Len=0 TSval=2068762 TSecr=2069353"
"185","2020-07-12 20:55:29.372148699","192.168.56.102","192.168.56.101","SSHv2","60348","22","102","Client: Encrypted packet (len=36)"
"186","2020-07-12 20:55:29.372467128","192.168.56.101","192.168.56.102","SSHv2","22","60348","102","Server: Encrypted packet (len=36)"
"187","2020-07-12 20:55:29.372691080","192.168.56.102","192.168.56.101","TCP","60348","22","66","60348  >  22 [ACK] Seq=3410 Ack=5409 Win=38272 Len=0 TSval=2068799 TSecr=2069391"
"188","2020-07-12 20:55:29.592104113","192.168.56.102","192.168.56.101","SSHv2","60348","22","102","Client: Encrypted packet (len=36)"
"189","2020-07-12 20:55:29.592425874","192.168.56.101","192.168.56.102","SSHv2","22","60348","102","Server: Encrypted packet (len=36)"
"190","2020-07-12 20:55:29.592619261","192.168.56.102","192.168.56.101","TCP","60348","22","66","60348  >  22 [ACK] Seq=3446 Ack=5445 Win=38272 Len=0 TSval=2068854 TSecr=2069446"
"191","2020-07-12 20:55:29.932122380","192.168.56.102","192.168.56.101","SSHv2","60348","22","102","Client: Encrypted packet (len=36)"
"192","2020-07-12 20:55:29.932568888","192.168.56.101","192.168.56.102","SSHv2","22","60348","126","Server: Encrypted packet (len=60)"
"193","2020-07-12 20:55:29.932715015","192.168.56.102","192.168.56.101","TCP","60348","22","66","60348  >  22 [ACK] Seq=3482 Ack=5505 Win=38272 Len=0 TSval=2068939 TSecr=2069531"
"194","2020-07-12 20:55:32.095575927","PcsCompu_6c:9b:66","PcsCompu_77:ba:13","ARP","","","60","Who has 192.168.56.100? Tell 192.168.56.104"
"195","2020-07-12 20:55:32.095752778","PcsCompu_77:ba:13","PcsCompu_6c:9b:66","ARP","","","60","192.168.56.100 is at 08:00:27:77:ba:13"
"196","2020-07-12 20:55:32.741994938","192.168.56.102","192.168.56.101","SSHv2","60348","22","102","Client: Encrypted packet (len=36)"
"197","2020-07-12 20:55:32.742324939","192.168.56.101","192.168.56.102","SSHv2","22","60348","102","Server: Encrypted packet (len=36)"
"198","2020-07-12 20:55:32.742466807","192.168.56.102","192.168.56.101","TCP","60348","22","66","60348  >  22 [ACK] Seq=3518 Ack=5541 Win=38272 Len=0 TSval=2069642 TSecr=2070233"
"199","2020-07-12 20:55:32.982169473","192.168.56.102","192.168.56.101","SSHv2","60348","22","102","Client: Encrypted packet (len=36)"
"200","2020-07-12 20:55:32.982640693","192.168.56.101","192.168.56.102","SSHv2","22","60348","102","Server: Encrypted packet (len=36)"
"201","2020-07-12 20:55:32.983021045","192.168.56.102","192.168.56.101","TCP","60348","22","66","60348  >  22 [ACK] Seq=3554 Ack=5577 Win=38272 Len=0 TSval=2069702 TSecr=2070293"
"202","2020-07-12 20:55:33.152000560","192.168.56.102","192.168.56.101","SSHv2","60348","22","102","Client: Encrypted packet (len=36)"
"203","2020-07-12 20:55:33.152306174","192.168.56.101","192.168.56.102","SSHv2","22","60348","102","Server: Encrypted packet (len=36)"
"204","2020-07-12 20:55:33.152413555","192.168.56.102","192.168.56.101","TCP","60348","22","66","60348  >  22 [ACK] Seq=3590 Ack=5613 Win=38272 Len=0 TSval=2069744 TSecr=2070336"
"205","2020-07-12 20:55:33.312103007","192.168.56.102","192.168.56.101","SSHv2","60348","22","102","Client: Encrypted packet (len=36)"
"206","2020-07-12 20:55:33.312440341","192.168.56.101","192.168.56.102","SSHv2","22","60348","102","Server: Encrypted packet (len=36)"
"207","2020-07-12 20:55:33.312579551","192.168.56.102","192.168.56.101","TCP","60348","22","66","60348  >  22 [ACK] Seq=3626 Ack=5649 Win=38272 Len=0 TSval=2069784 TSecr=2070376"
"208","2020-07-12 20:55:33.391968552","192.168.56.102","192.168.56.101","SSHv2","60348","22","102","Client: Encrypted packet (len=36)"
"209","2020-07-12 20:55:33.392276645","192.168.56.101","192.168.56.102","SSHv2","22","60348","102","Server: Encrypted packet (len=36)"
"210","2020-07-12 20:55:33.392400354","192.168.56.102","192.168.56.101","TCP","60348","22","66","60348  >  22 [ACK] Seq=3662 Ack=5685 Win=38272 Len=0 TSval=2069804 TSecr=2070396"
"211","2020-07-12 20:55:33.482175062","192.168.56.102","192.168.56.101","SSHv2","60348","22","102","Client: Encrypted packet (len=36)"
"212","2020-07-12 20:55:33.482680222","192.168.56.101","192.168.56.102","SSHv2","22","60348","102","Server: Encrypted packet (len=36)"
"213","2020-07-12 20:55:33.482764051","192.168.56.102","192.168.56.101","TCP","60348","22","66","60348  >  22 [ACK] Seq=3698 Ack=5721 Win=38272 Len=0 TSval=2069827 TSecr=2070418"
"214","2020-07-12 20:55:34.302123546","192.168.56.102","192.168.56.101","SSHv2","60348","22","102","Client: Encrypted packet (len=36)"
"215","2020-07-12 20:55:34.304066601","192.168.56.101","192.168.56.102","SSHv2","22","60348","206","Server: Encrypted packet (len=140)"
"216","2020-07-12 20:55:34.304209515","192.168.56.101","192.168.56.102","SSHv2","22","60348","138","Server: Encrypted packet (len=72)"
"217","2020-07-12 20:55:34.304212659","192.168.56.102","192.168.56.101","TCP","60348","22","66","60348  >  22 [ACK] Seq=3734 Ack=5861 Win=41216 Len=0 TSval=2070032 TSecr=2070623"
"218","2020-07-12 20:55:34.304363390","192.168.56.102","192.168.56.101","TCP","60348","22","66","60348  >  22 [ACK] Seq=3734 Ack=5933 Win=41216 Len=0 TSval=2070032 TSecr=2070624"
"219","2020-07-12 20:55:34.304867999","192.168.56.102","192.168.56.101","SSHv2","60348","22","102","Client: Encrypted packet (len=36)"
"220","2020-07-12 20:55:34.304981855","192.168.56.102","192.168.56.101","SSHv2","60348","22","126","Client: Encrypted packet (len=60)"
"221","2020-07-12 20:55:34.305155492","192.168.56.101","192.168.56.102","TCP","22","60348","66","22  >  60348 [ACK] Seq=5933 Ack=3830 Win=37248 Len=0 TSval=2070624 TSecr=2070033"
"222","2020-07-12 20:55:34.305489685","192.168.56.102","192.168.56.101","TCP","60348","22","66","60348  >  22 [FIN, ACK] Seq=3830 Ack=5933 Win=41216 Len=0 TSval=2070033 TSecr=2070624"
"223","2020-07-12 20:55:34.307430060","192.168.56.101","192.168.56.102","TCP","22","60348","66","22  >  60348 [FIN, ACK] Seq=5933 Ack=3831 Win=37248 Len=0 TSval=2070624 TSecr=2070033"
"224","2020-07-12 20:55:34.307564160","192.168.56.102","192.168.56.101","TCP","60348","22","66","60348  >  22 [ACK] Seq=3831 Ack=5934 Win=41216 Len=0 TSval=2070033 TSecr=2070624"
"225","2020-07-12 20:55:55.992470373","192.168.56.104","192.168.56.101","TCP","49874","445","74","49874  >  445 [SYN] Seq=0 Win=29200 Len=0 MSS=1460 SACK_PERM=1 TSval=2076946 TSecr=0 WS=128"
"226","2020-07-12 20:55:55.992562843","192.168.56.101","192.168.56.104","TCP","445","49874","74","445  >  49874 [SYN, ACK] Seq=0 Ack=1 Win=28960 Len=0 MSS=1460 SACK_PERM=1 TSval=2076046 TSecr=2076946 WS=128"
"227","2020-07-12 20:55:55.992760556","192.168.56.104","192.168.56.101","TCP","49874","445","66","49874  >  445 [ACK] Seq=1 Ack=1 Win=29312 Len=0 TSval=2076946 TSecr=2076046"
"228","2020-07-12 20:55:55.992941772","192.168.56.104","192.168.56.101","SMB","49874","445","260","Negotiate Protocol Request"
"229","2020-07-12 20:55:55.993035237","192.168.56.101","192.168.56.104","TCP","445","49874","66","445  >  49874 [ACK] Seq=1 Ack=195 Win=30080 Len=0 TSval=2076046 TSecr=2076946"
"230","2020-07-12 20:55:55.996428060","192.168.56.101","192.168.56.104","SMB","445","49874","229","Negotiate Protocol Response"
"231","2020-07-12 20:55:55.996612293","192.168.56.104","192.168.56.101","TCP","49874","445","66","49874  >  445 [ACK] Seq=195 Ack=164 Win=30336 Len=0 TSval=2076947 TSecr=2076047"
"232","2020-07-12 20:55:55.999034172","192.168.56.104","192.168.56.101","SMB","49874","445","226","Session Setup AndX Request, NTLMSSP_NEGOTIATE"
"233","2020-07-12 20:55:55.999628459","192.168.56.101","192.168.56.104","SMB","445","49874","382","Session Setup AndX Response, NTLMSSP_CHALLENGE, Error: STATUS_MORE_PROCESSING_REQUIRED"
"234","2020-07-12 20:55:56.000038291","192.168.56.104","192.168.56.101","SMB","49874","445","606","Session Setup AndX Request, NTLMSSP_AUTH, User: WORKGROUP\\isot"
"235","2020-07-12 20:55:56.001378050","192.168.56.101","192.168.56.104","SMB","445","49874","206","Session Setup AndX Response"
"236","2020-07-12 20:55:56.002145370","192.168.56.104","192.168.56.101","SMB","49874","445","162","Tree Connect AndX Request, Path: \\\\192.168.56.101\\IPC$"
"237","2020-07-12 20:55:56.002835672","192.168.56.101","192.168.56.104","SMB","445","49874","126","Tree Connect AndX Response"
"238","2020-07-12 20:55:56.003083936","192.168.56.104","192.168.56.101","SMB","49874","445","186","Trans2 Request, GET_DFS_REFERRAL, File: \\192.168.56.101\\files"
"239","2020-07-12 20:55:56.003434564","192.168.56.101","192.168.56.104","SMB","445","49874","105","Trans2 Response, GET_DFS_REFERRAL, Error: STATUS_NOT_FOUND"
"240","2020-07-12 20:55:56.003736908","192.168.56.104","192.168.56.101","SMB","49874","445","105","Tree Disconnect Request"
"241","2020-07-12 20:55:56.004079181","192.168.56.101","192.168.56.104","SMB","445","49874","105","Tree Disconnect Response"
"242","2020-07-12 20:55:56.004393083","192.168.56.104","192.168.56.101","SMB","49874","445","166","Tree Connect AndX Request, Path: \\\\192.168.56.101\\FILES"
"243","2020-07-12 20:55:56.004882295","192.168.56.101","192.168.56.104","SMB","445","49874","132","Tree Connect AndX Response"
"244","2020-07-12 20:55:56.043249992","192.168.56.104","192.168.56.101","TCP","49874","445","66","49874  >  445 [ACK] Seq=1250 Ack=824 Win=32512 Len=0 TSval=2076959 TSecr=2076049"
"245","2020-07-12 20:55:56.105829851","192.168.56.104","192.168.56.101","SMB","49874","445","123","Echo Request"
"246","2020-07-12 20:55:56.106308439","192.168.56.101","192.168.56.104","SMB","445","49874","123","Echo Response"
"247","2020-07-12 20:55:56.106505884","192.168.56.104","192.168.56.101","TCP","49874","445","66","49874  >  445 [ACK] Seq=1307 Ack=881 Win=32512 Len=0 TSval=2076974 TSecr=2076074"
"248","2020-07-12 20:55:58.532779315","192.168.56.104","192.168.56.101","SMB","49874","445","158","Trans2 Request, FIND_FIRST2, Pattern: \\*"
"249","2020-07-12 20:55:58.533771737","192.168.56.101","192.168.56.104","SMB","445","49874","1730","Trans2 Response, FIND_FIRST2, Files: . .. create_postfix_mysql_tables.sql vsftpd-2.3.4 openssl-1.0.1f blfs-bootscripts-20140919 samba-3.5.0.tar.gz proftpd-basic_1.3.5~rc3-2.1ubuntu2.1_amd64.deb proftpd-1.3.5 proftpd-1.3.5.tar.gz samba-3.5.0 blfs-bootscripts-20140919.tar.bz2"
"250","2020-07-12 20:55:58.533926604","192.168.56.104","192.168.56.101","TCP","49874","445","66","49874  >  445 [ACK] Seq=1399 Ack=2545 Win=35840 Len=0 TSval=2077581 TSecr=2076681"
"251","2020-07-12 20:55:58.539749769","192.168.56.104","192.168.56.101","SMB","49874","445","142","Trans2 Request, QUERY_FS_INFO, Query Full FS Size Info"
"252","2020-07-12 20:55:58.540176842","192.168.56.101","192.168.56.104","SMB","445","49874","158","Trans2 Response, QUERY_FS_INFO"
"253","2020-07-12 20:55:58.579377639","192.168.56.104","192.168.56.101","TCP","49874","445","66","49874  >  445 [ACK] Seq=1475 Ack=2637 Win=35840 Len=0 TSval=2077593 TSecr=2076683"
"254","2020-07-12 20:56:00.251138564","192.168.56.104","192.168.56.101","SMB","49874","445","123","Echo Request"
"255","2020-07-12 20:56:00.251404878","192.168.56.101","192.168.56.104","SMB","445","49874","123","Echo Response"
"256","2020-07-12 20:56:00.251654150","192.168.56.104","192.168.56.101","TCP","49874","445","66","49874  >  445 [ACK] Seq=1532 Ack=2694 Win=35840 Len=0 TSval=2078011 TSecr=2077110"
"257","2020-07-12 20:56:05.073147091","192.168.56.101","192.168.56.100","DHCP","68","67","342","DHCP Request  - Transaction ID 0x677ae649"
"258","2020-07-12 20:56:05.172052005","192.168.56.100","192.168.56.101","DHCP","67","68","590","DHCP ACK      - Transaction ID 0x677ae649"
"259","2020-07-12 20:56:05.270212760","192.168.56.104","192.168.56.101","SMB","49874","445","123","Echo Request"
"260","2020-07-12 20:56:05.270518977","192.168.56.101","192.168.56.104","SMB","445","49874","123","Echo Response"
"261","2020-07-12 20:56:05.270734552","192.168.56.104","192.168.56.101","TCP","49874","445","66","49874  >  445 [ACK] Seq=1589 Ack=2751 Win=35840 Len=0 TSval=2079265 TSecr=2078365"
"262","2020-07-12 20:56:09.512410444","192.168.56.104","192.168.56.101","SMB","49874","445","105","Tree Disconnect Request"
"263","2020-07-12 20:56:09.512808682","192.168.56.101","192.168.56.104","SMB","445","49874","105","Tree Disconnect Response"
