"No.","Time","Source","Destination","Protocol","Source Port","Dest Port","Length","Info"
"1","2020-07-17 12:52:07.678706918","192.168.56.104","192.168.56.100","DHCP","68","67","342","DHCP Request  - Transaction ID 0xb92d511f"
"2","2020-07-17 12:52:07.721876847","192.168.56.100","192.168.56.104","DHCP","67","68","590","DHCP ACK      - Transaction ID 0xb92d511f"
"3","2020-07-17 12:52:12.689851437","PcsCompu_6c:9b:66","PcsCompu_b7:12:b1","ARP","","","60","Who has 192.168.56.100? Tell 192.168.56.104"
"4","2020-07-17 12:52:12.689873636","PcsCompu_b7:12:b1","PcsCompu_6c:9b:66","ARP","","","60","192.168.56.100 is at 08:00:27:b7:12:b1"
"5","2020-07-17 12:52:28.030433134","PcsCompu_74:73:8a","Broadcast","ARP","","","42","Who has 192.168.56.104? Tell 192.168.56.105"
"6","2020-07-17 12:52:28.030885491","PcsCompu_6c:9b:66","PcsCompu_74:73:8a","ARP","","","60","192.168.56.104 is at 08:00:27:6c:9b:66"
"7","2020-07-17 12:52:28.030895346","192.168.56.105","192.168.56.104","TCP","46730","80","74","46730  >  80 [SYN] Seq=0 Win=64240 Len=0 MSS=1460 SACK_PERM=1 TSval=4192438763 TSecr=0 WS=128"
"8","2020-07-17 12:52:28.031141979","192.168.56.104","192.168.56.105","TCP","80","46730","74","80  >  46730 [SYN, ACK] Seq=0 Ack=1 Win=28960 Len=0 MSS=1460 SACK_PERM=1 TSval=369663 TSecr=4192438763 WS=128"
"9","2020-07-17 12:52:28.031170521","192.168.56.105","192.168.56.104","TCP","46730","80","66","46730  >  80 [ACK] Seq=1 Ack=1 Win=64256 Len=0 TSval=4192438764 TSecr=369663"
"10","2020-07-17 12:52:28.031511783","192.168.56.105","192.168.56.104","HTTP","46730","80","380","GET / HTTP/1.1 "
"11","2020-07-17 12:52:28.031796696","192.168.56.104","192.168.56.105","TCP","80","46730","66","80  >  46730 [ACK] Seq=1 Ack=315 Win=30080 Len=0 TSval=369663 TSecr=4192438764"
"12","2020-07-17 12:52:28.528839571","192.168.56.104","192.168.56.105","HTTP","80","46730","3252","HTTP/1.1 200 OK  (text/html)"
"13","2020-07-17 12:52:28.528881942","192.168.56.105","192.168.56.104","TCP","46730","80","66","46730  >  80 [ACK] Seq=315 Ack=3187 Win=62592 Len=0 TSval=4192439262 TSecr=369788"
"14","2020-07-17 12:52:28.589987207","192.168.56.105","192.168.56.104","HTTP","46730","80","361","GET /content/css/loading.css HTTP/1.1 "
"15","2020-07-17 12:52:28.590345432","192.168.56.104","192.168.56.105","TCP","80","46730","66","80  >  46730 [ACK] Seq=3187 Ack=610 Win=31104 Len=0 TSval=369803 TSecr=4192439323"
"16","2020-07-17 12:52:28.590535765","192.168.56.105","192.168.56.104","TCP","46736","80","74","46736  >  80 [SYN] Seq=0 Win=64240 Len=0 MSS=1460 SACK_PERM=1 TSval=4192439323 TSecr=0 WS=128"
"17","2020-07-17 12:52:28.590799162","192.168.56.104","192.168.56.105","TCP","80","46736","74","80  >  46736 [SYN, ACK] Seq=0 Ack=1 Win=28960 Len=0 MSS=1460 SACK_PERM=1 TSval=369803 TSecr=4192439323 WS=128"
"18","2020-07-17 12:52:28.590814962","192.168.56.105","192.168.56.104","TCP","46736","80","66","46736  >  80 [ACK] Seq=1 Ack=1 Win=64256 Len=0 TSval=4192439324 TSecr=369803"
"19","2020-07-17 12:52:28.590866976","192.168.56.105","192.168.56.104","TCP","46738","80","74","46738  >  80 [SYN] Seq=0 Win=64240 Len=0 MSS=1460 SACK_PERM=1 TSval=4192439324 TSecr=0 WS=128"
"20","2020-07-17 12:52:28.590938918","192.168.56.105","192.168.56.104","HTTP","46736","80","378","GET /content/vendors.2217590b5cc5d0b62058.css HTTP/1.1 "
"21","2020-07-17 12:52:28.591086441","192.168.56.104","192.168.56.105","TCP","80","46738","74","80  >  46738 [SYN, ACK] Seq=0 Ack=1 Win=28960 Len=0 MSS=1460 SACK_PERM=1 TSval=369803 TSecr=4192439324 WS=128"
"22","2020-07-17 12:52:28.591105170","192.168.56.105","192.168.56.104","TCP","46738","80","66","46738  >  80 [ACK] Seq=1 Ack=1 Win=64256 Len=0 TSval=4192439324 TSecr=369803"
"23","2020-07-17 12:52:28.591121864","192.168.56.104","192.168.56.105","TCP","80","46736","66","80  >  46736 [ACK] Seq=1 Ack=313 Win=30080 Len=0 TSval=369803 TSecr=4192439324"
"24","2020-07-17 12:52:28.591223765","192.168.56.105","192.168.56.104","HTTP","46738","80","375","GET /content/main.2217590b5cc5d0b62058.css HTTP/1.1 "
"25","2020-07-17 12:52:28.591567761","192.168.56.104","192.168.56.105","TCP","80","46738","66","80  >  46738 [ACK] Seq=1 Ack=310 Win=30080 Len=0 TSval=369803 TSecr=4192439324"
"26","2020-07-17 12:52:28.591929551","192.168.56.105","192.168.56.104","TCP","46740","80","74","46740  >  80 [SYN] Seq=0 Win=64240 Len=0 MSS=1460 SACK_PERM=1 TSval=4192439325 TSecr=0 WS=128"
"27","2020-07-17 12:52:28.592199365","192.168.56.104","192.168.56.105","TCP","80","46740","74","80  >  46740 [SYN, ACK] Seq=0 Ack=1 Win=28960 Len=0 MSS=1460 SACK_PERM=1 TSval=369803 TSecr=4192439325 WS=128"
"28","2020-07-17 12:52:28.592222365","192.168.56.105","192.168.56.104","TCP","46740","80","66","46740  >  80 [ACK] Seq=1 Ack=1 Win=64256 Len=0 TSval=4192439325 TSecr=369803"
"29","2020-07-17 12:52:28.592332321","192.168.56.105","192.168.56.104","HTTP","46740","80","362","GET /app/main.2217590b5cc5d0b62058.bundle.js HTTP/1.1 "
"30","2020-07-17 12:52:28.592559260","192.168.56.104","192.168.56.105","TCP","80","46740","66","80  >  46740 [ACK] Seq=1 Ack=297 Win=30080 Len=0 TSval=369804 TSecr=4192439325"
"31","2020-07-17 12:52:28.594612653","192.168.56.105","192.168.56.104","TCP","46730","80","66","46730  >  80 [FIN, ACK] Seq=610 Ack=3187 Win=64128 Len=0 TSval=4192439328 TSecr=369803"
"32","2020-07-17 12:52:28.594917900","192.168.56.105","192.168.56.104","TCP","46736","80","66","46736  >  80 [FIN, ACK] Seq=313 Ack=1 Win=64256 Len=0 TSval=4192439328 TSecr=369803"
"33","2020-07-17 12:52:28.595599150","192.168.56.105","192.168.56.104","TCP","46738","80","66","46738  >  80 [FIN, ACK] Seq=310 Ack=1 Win=64256 Len=0 TSval=4192439329 TSecr=369803"
"34","2020-07-17 12:52:28.596731863","192.168.56.105","192.168.56.104","TCP","46740","80","66","46740  >  80 [FIN, ACK] Seq=297 Ack=1 Win=64256 Len=0 TSval=4192439330 TSecr=369804"
"35","2020-07-17 12:52:28.632633861","192.168.56.104","192.168.56.105","TCP","80","46738","66","80  >  46738 [ACK] Seq=1 Ack=311 Win=30080 Len=0 TSval=369814 TSecr=4192439329"
"36","2020-07-17 12:52:28.632670860","192.168.56.104","192.168.56.105","TCP","80","46736","66","80  >  46736 [ACK] Seq=1 Ack=314 Win=30080 Len=0 TSval=369814 TSecr=4192439328"
"37","2020-07-17 12:52:28.632677240","192.168.56.104","192.168.56.105","TCP","80","46730","66","80  >  46730 [ACK] Seq=3187 Ack=611 Win=31104 Len=0 TSval=369814 TSecr=4192439328"
"38","2020-07-17 12:52:28.637025213","192.168.56.104","192.168.56.105","TCP","80","46740","66","80  >  46740 [ACK] Seq=1 Ack=298 Win=30080 Len=0 TSval=369815 TSecr=4192439330"
"39","2020-07-17 12:52:28.648959045","192.168.56.104","192.168.56.105","HTTP","80","46730","1099","HTTP/1.1 200 OK  (text/css)"
"40","2020-07-17 12:52:28.649021182","192.168.56.105","192.168.56.104","TCP","46730","80","54","46730  >  80 [RST] Seq=611 Win=0 Len=0"
"41","2020-07-17 12:52:28.650603141","192.168.56.104","192.168.56.105","HTTP","80","46736","2175","HTTP/1.1 200 OK  (text/css)"
"42","2020-07-17 12:52:28.650620286","192.168.56.105","192.168.56.104","TCP","46736","80","54","46736  >  80 [RST] Seq=314 Win=0 Len=0"
"43","2020-07-17 12:52:28.666405495","192.168.56.105","192.168.56.104","TCP","46742","80","74","46742  >  80 [SYN] Seq=0 Win=64240 Len=0 MSS=1460 SACK_PERM=1 TSval=4192439399 TSecr=0 WS=128"
"44","2020-07-17 12:52:28.666753623","192.168.56.104","192.168.56.105","TCP","80","46742","74","80  >  46742 [SYN, ACK] Seq=0 Ack=1 Win=28960 Len=0 MSS=1460 SACK_PERM=1 TSval=369822 TSecr=4192439399 WS=128"
"45","2020-07-17 12:52:28.666800158","192.168.56.105","192.168.56.104","TCP","46742","80","66","46742  >  80 [ACK] Seq=1 Ack=1 Win=64256 Len=0 TSval=4192439400 TSecr=369822"
"46","2020-07-17 12:52:28.667220553","192.168.56.105","192.168.56.104","HTTP","46742","80","389","GET /content/images/logo-jhipster.png HTTP/1.1 "
"47","2020-07-17 12:52:28.667458078","192.168.56.104","192.168.56.105","TCP","80","46742","66","80  >  46742 [ACK] Seq=1 Ack=324 Win=30080 Len=0 TSval=369822 TSecr=4192439400"
"48","2020-07-17 12:52:28.668416057","192.168.56.105","192.168.56.104","TCP","46742","80","66","46742  >  80 [FIN, ACK] Seq=324 Ack=1 Win=64256 Len=0 TSval=4192439401 TSecr=369822"
"49","2020-07-17 12:52:28.708705403","192.168.56.104","192.168.56.105","TCP","80","46742","66","80  >  46742 [ACK] Seq=1 Ack=325 Win=30080 Len=0 TSval=369833 TSecr=4192439401"
"50","2020-07-17 12:52:28.745139474","192.168.56.104","192.168.56.105","TCP","80","46740","7306","80  >  46740 [ACK] Seq=1 Ack=298 Win=30080 Len=7240 TSval=369842 TSecr=4192439330 [TCP segment of a reassembled PDU]"
"51","2020-07-17 12:52:28.745164802","192.168.56.105","192.168.56.104","TCP","46740","80","54","46740  >  80 [RST] Seq=298 Win=0 Len=0"
"52","2020-07-17 12:52:28.745251466","192.168.56.104","192.168.56.105","TCP","80","46740","7306","HTTP/1.1 200 OK  [TCP segment of a reassembled PDU]"
"53","2020-07-17 12:52:28.745258983","192.168.56.105","192.168.56.104","TCP","46740","80","54","46740  >  80 [RST] Seq=298 Win=0 Len=0"
"54","2020-07-17 12:52:28.754808442","192.168.56.104","192.168.56.105","TCP","80","46742","14546","80  >  46742 [ACK] Seq=1 Ack=325 Win=30080 Len=14480 TSval=369844 TSecr=4192439401 [TCP segment of a reassembled PDU]"
"55","2020-07-17 12:52:28.754829502","192.168.56.105","192.168.56.104","TCP","46742","80","54","46742  >  80 [RST] Seq=325 Win=0 Len=0"
"56","2020-07-17 12:52:28.757131284","192.168.56.104","192.168.56.105","TCP","80","46738","14546","80  >  46738 [ACK] Seq=1 Ack=311 Win=30080 Len=14480 TSval=369845 TSecr=4192439329 [TCP segment of a reassembled PDU]"
"57","2020-07-17 12:52:28.757162380","192.168.56.105","192.168.56.104","TCP","46738","80","54","46738  >  80 [RST] Seq=311 Win=0 Len=0"
"58","2020-07-17 12:52:29.101984274","192.168.56.105","192.168.56.104","TCP","46744","80","74","46744  >  80 [SYN] Seq=0 Win=64240 Len=0 MSS=1460 SACK_PERM=1 TSval=4192439835 TSecr=0 WS=128"
"59","2020-07-17 12:52:29.102303907","192.168.56.104","192.168.56.105","TCP","80","46744","74","80  >  46744 [SYN, ACK] Seq=0 Ack=1 Win=28960 Len=0 MSS=1460 SACK_PERM=1 TSval=369931 TSecr=4192439835 WS=128"
"60","2020-07-17 12:52:29.102328093","192.168.56.105","192.168.56.104","TCP","46744","80","66","46744  >  80 [ACK] Seq=1 Ack=1 Win=64256 Len=0 TSval=4192439835 TSecr=369931"
"61","2020-07-17 12:52:29.102508168","192.168.56.105","192.168.56.104","HTTP","46744","80","312","GET /favicon.ico HTTP/1.1 "
"62","2020-07-17 12:52:29.102729435","192.168.56.104","192.168.56.105","TCP","80","46744","66","80  >  46744 [ACK] Seq=1 Ack=247 Win=30080 Len=0 TSval=369931 TSecr=4192439835"
"63","2020-07-17 12:52:29.117964406","192.168.56.105","192.168.56.104","TCP","46746","80","74","46746  >  80 [SYN] Seq=0 Win=64240 Len=0 MSS=1460 SACK_PERM=1 TSval=4192439851 TSecr=0 WS=128"
"64","2020-07-17 12:52:29.118246303","192.168.56.104","192.168.56.105","TCP","80","46746","74","80  >  46746 [SYN, ACK] Seq=0 Ack=1 Win=28960 Len=0 MSS=1460 SACK_PERM=1 TSval=369935 TSecr=4192439851 WS=128"
"65","2020-07-17 12:52:29.118269623","192.168.56.105","192.168.56.104","TCP","46746","80","66","46746  >  80 [ACK] Seq=1 Ack=1 Win=64256 Len=0 TSval=4192439851 TSecr=369935"
"66","2020-07-17 12:52:29.118465371","192.168.56.105","192.168.56.104","HTTP","46746","80","364","GET /api/account HTTP/1.1 "
"67","2020-07-17 12:52:29.118715304","192.168.56.104","192.168.56.105","TCP","80","46746","66","80  >  46746 [ACK] Seq=1 Ack=299 Win=30080 Len=0 TSval=369935 TSecr=4192439851"
"68","2020-07-17 12:52:29.119882750","192.168.56.105","192.168.56.104","TCP","46748","80","74","46748  >  80 [SYN] Seq=0 Win=64240 Len=0 MSS=1460 SACK_PERM=1 TSval=4192439853 TSecr=0 WS=128"
"69","2020-07-17 12:52:29.120111194","192.168.56.104","192.168.56.105","TCP","80","46748","74","80  >  46748 [SYN, ACK] Seq=0 Ack=1 Win=28960 Len=0 MSS=1460 SACK_PERM=1 TSval=369935 TSecr=4192439853 WS=128"
"70","2020-07-17 12:52:29.120129583","192.168.56.105","192.168.56.104","TCP","46748","80","66","46748  >  80 [ACK] Seq=1 Ack=1 Win=64256 Len=0 TSval=4192439853 TSecr=369935"
"71","2020-07-17 12:52:29.120233376","192.168.56.105","192.168.56.104","HTTP","46748","80","368","GET /management/info HTTP/1.1 "
"72","2020-07-17 12:52:29.120465324","192.168.56.104","192.168.56.105","TCP","80","46748","66","80  >  46748 [ACK] Seq=1 Ack=303 Win=30080 Len=0 TSval=369935 TSecr=4192439853"
"73","2020-07-17 12:52:29.245903242","192.168.56.104","192.168.56.105","HTTP","80","46744","2519","HTTP/1.1 200 OK  (PNG)"
"74","2020-07-17 12:52:29.245933476","192.168.56.105","192.168.56.104","TCP","46744","80","66","46744  >  80 [ACK] Seq=247 Ack=2454 Win=63488 Len=0 TSval=4192439979 TSecr=369967"
"75","2020-07-17 12:52:29.694526939","192.168.56.104","192.168.56.105","TCP","80","46748","1160","80  >  46748 [PSH, ACK] Seq=1 Ack=303 Win=30080 Len=1094 TSval=370079 TSecr=4192439853 [TCP segment of a reassembled PDU]"
"76","2020-07-17 12:52:29.694563206","192.168.56.105","192.168.56.104","TCP","46748","80","66","46748  >  80 [ACK] Seq=303 Ack=1095 Win=64128 Len=0 TSval=4192440427 TSecr=370079"
"77","2020-07-17 12:52:29.716040308","192.168.56.104","192.168.56.105","TCP","80","46748","82","80  >  46748 [PSH, ACK] Seq=1095 Ack=303 Win=30080 Len=16 TSval=370084 TSecr=4192440427 [TCP segment of a reassembled PDU]"
"78","2020-07-17 12:52:29.716064089","192.168.56.105","192.168.56.104","TCP","46748","80","66","46748  >  80 [ACK] Seq=303 Ack=1111 Win=64128 Len=0 TSval=4192440449 TSecr=370084"
"79","2020-07-17 12:52:29.721173550","192.168.56.104","192.168.56.105","HTTP","80","46748","71","HTTP/1.1 200 OK  (application/json)"
"80","2020-07-17 12:52:29.721193999","192.168.56.105","192.168.56.104","TCP","46748","80","66","46748  >  80 [ACK] Seq=303 Ack=1116 Win=64128 Len=0 TSval=4192440454 TSecr=370086"
"81","2020-07-17 12:52:29.744464882","192.168.56.104","192.168.56.105","TCP","80","46746","1128","80  >  46746 [PSH, ACK] Seq=1 Ack=299 Win=30080 Len=1062 TSval=370091 TSecr=4192439851 [TCP segment of a reassembled PDU]"
"82","2020-07-17 12:52:29.744486087","192.168.56.105","192.168.56.104","TCP","46746","80","66","46746  >  80 [ACK] Seq=299 Ack=1063 Win=64128 Len=0 TSval=4192440477 TSecr=370091"
"83","2020-07-17 12:52:29.748688695","192.168.56.104","192.168.56.105","HTTP","80","46746","71","HTTP/1.1 401 Unauthorized  (application/problem+json)"
"84","2020-07-17 12:52:29.748701422","192.168.56.105","192.168.56.104","TCP","46746","80","66","46746  >  80 [ACK] Seq=299 Ack=1068 Win=64128 Len=0 TSval=4192440482 TSecr=370092"
"85","2020-07-17 12:52:36.955177824","192.168.56.106","192.168.56.100","DHCP","68","67","342","DHCP Request  - Transaction ID 0x266c234d"
"86","2020-07-17 12:52:36.974663180","192.168.56.100","192.168.56.106","DHCP","67","68","590","DHCP ACK      - Transaction ID 0x266c234d"
"87","2020-07-17 12:52:38.851674589","192.168.56.105","192.168.56.104","HTTP","46744","80","515","POST /api/authenticate HTTP/1.1  (application/json)"
"88","2020-07-17 12:52:38.852158719","192.168.56.104","192.168.56.105","TCP","80","46744","66","80  >  46744 [ACK] Seq=2454 Ack=696 Win=31104 Len=0 TSval=372368 TSecr=4192449585"
"89","2020-07-17 12:52:39.743383684","192.168.56.105","192.168.56.104","TCP","46748","80","66","[TCP Keep-Alive] 46748  >  80 [ACK] Seq=302 Ack=1116 Win=64128 Len=0 TSval=4192450476 TSecr=370086"
"90","2020-07-17 12:52:39.743721671","192.168.56.104","192.168.56.105","TCP","80","46748","66","[TCP Keep-Alive ACK] 80  >  46748 [ACK] Seq=1116 Ack=303 Win=30080 Len=0 TSval=372591 TSecr=4192440454"
"91","2020-07-17 12:52:39.771622301","192.168.56.105","192.168.56.104","TCP","46746","80","66","[TCP Keep-Alive] 46746  >  80 [ACK] Seq=298 Ack=1068 Win=64128 Len=0 TSval=4192450505 TSecr=370092"
"92","2020-07-17 12:52:39.771899328","192.168.56.104","192.168.56.105","TCP","80","46746","66","[TCP Keep-Alive ACK] 80  >  46746 [ACK] Seq=1068 Ack=299 Win=30080 Len=0 TSval=372598 TSecr=4192440482"
"93","2020-07-17 12:52:40.016287192","192.168.56.104","192.168.56.105","TCP","80","46744","1317","80  >  46744 [PSH, ACK] Seq=2454 Ack=696 Win=31104 Len=1251 TSval=372659 TSecr=4192449585 [TCP segment of a reassembled PDU]"
"94","2020-07-17 12:52:40.016322641","192.168.56.105","192.168.56.104","TCP","46744","80","66","46744  >  80 [ACK] Seq=696 Ack=3705 Win=64128 Len=0 TSval=4192450749 TSecr=372659"
"95","2020-07-17 12:52:40.023620680","192.168.56.104","192.168.56.105","TCP","80","46744","82","80  >  46744 [PSH, ACK] Seq=3705 Ack=696 Win=31104 Len=16 TSval=372661 TSecr=4192450749 [TCP segment of a reassembled PDU]"
"96","2020-07-17 12:52:40.023642541","192.168.56.105","192.168.56.104","TCP","46744","80","66","46744  >  80 [ACK] Seq=696 Ack=3721 Win=64128 Len=0 TSval=4192450757 TSecr=372661"
"97","2020-07-17 12:52:40.023753898","192.168.56.104","192.168.56.105","HTTP","80","46744","71","HTTP/1.1 200 OK  (application/json)"
"98","2020-07-17 12:52:40.023760760","192.168.56.105","192.168.56.104","TCP","46744","80","66","46744  >  80 [ACK] Seq=696 Ack=3726 Win=64128 Len=0 TSval=4192450757 TSecr=372661"
"99","2020-07-17 12:52:40.081500034","192.168.56.105","192.168.56.104","HTTP","46744","80","568","GET /api/account HTTP/1.1 "
"100","2020-07-17 12:52:40.081889140","192.168.56.104","192.168.56.105","TCP","80","46744","66","80  >  46744 [ACK] Seq=3726 Ack=1198 Win=32256 Len=0 TSval=372676 TSecr=4192450814"
"101","2020-07-17 12:52:40.329754392","192.168.56.104","192.168.56.105","TCP","80","46744","1124","80  >  46744 [PSH, ACK] Seq=3726 Ack=1198 Win=32256 Len=1058 TSval=372738 TSecr=4192450814 [TCP segment of a reassembled PDU]"
"102","2020-07-17 12:52:40.329776417","192.168.56.105","192.168.56.104","TCP","46744","80","66","46744  >  80 [ACK] Seq=1198 Ack=4784 Win=64128 Len=0 TSval=4192451063 TSecr=372738"
"103","2020-07-17 12:52:40.337068946","192.168.56.104","192.168.56.105","TCP","80","46744","82","80  >  46744 [PSH, ACK] Seq=4784 Ack=1198 Win=32256 Len=16 TSval=372740 TSecr=4192451063 [TCP segment of a reassembled PDU]"
"104","2020-07-17 12:52:40.337088984","192.168.56.105","192.168.56.104","TCP","46744","80","66","46744  >  80 [ACK] Seq=1198 Ack=4800 Win=64128 Len=0 TSval=4192451070 TSecr=372740"
"105","2020-07-17 12:52:40.337110688","192.168.56.104","192.168.56.105","HTTP","80","46744","71","HTTP/1.1 200 OK  (application/json)"
"106","2020-07-17 12:52:40.337113708","192.168.56.105","192.168.56.104","TCP","46744","80","66","46744  >  80 [ACK] Seq=1198 Ack=4805 Win=64128 Len=0 TSval=4192451070 TSecr=372740"
"107","2020-07-17 12:52:42.132024337","PcsCompu_93:e0:ab","PcsCompu_b7:12:b1","ARP","","","60","Who has 192.168.56.100? Tell 192.168.56.106"
"108","2020-07-17 12:52:42.132052791","PcsCompu_b7:12:b1","PcsCompu_93:e0:ab","ARP","","","60","192.168.56.100 is at 08:00:27:b7:12:b1"
"109","2020-07-17 12:52:44.889109252","192.168.56.105","192.168.56.104","HTTP","46744","80","632","GET /api/customer?page=0&size=20&sort=id,asc&cacheBuster=1595011964875 HTTP/1.1 "
"110","2020-07-17 12:52:44.889746675","192.168.56.104","192.168.56.105","TCP","80","46744","66","80  >  46744 [ACK] Seq=4805 Ack=1764 Win=33408 Len=0 TSval=373878 TSecr=4192455622"
"111","2020-07-17 12:52:44.892480082","192.168.56.105","192.168.56.104","HTTP","46748","80","578","GET /api/account HTTP/1.1 "
"112","2020-07-17 12:52:44.892773044","192.168.56.104","192.168.56.105","TCP","80","46748","66","80  >  46748 [ACK] Seq=1116 Ack=815 Win=31104 Len=0 TSval=373879 TSecr=4192455625"
"113","2020-07-17 12:52:44.957584830","192.168.56.104","192.168.56.105","TCP","80","46748","1124","80  >  46748 [PSH, ACK] Seq=1116 Ack=815 Win=31104 Len=1058 TSval=373895 TSecr=4192455625 [TCP segment of a reassembled PDU]"
"114","2020-07-17 12:52:44.957604190","192.168.56.105","192.168.56.104","TCP","46748","80","66","46748  >  80 [ACK] Seq=815 Ack=2174 Win=64128 Len=0 TSval=4192455691 TSecr=373895"
"115","2020-07-17 12:52:44.965032826","192.168.56.104","192.168.56.105","TCP","80","46748","82","80  >  46748 [PSH, ACK] Seq=2174 Ack=815 Win=31104 Len=16 TSval=373897 TSecr=4192455691 [TCP segment of a reassembled PDU]"
"116","2020-07-17 12:52:44.965061829","192.168.56.105","192.168.56.104","TCP","46748","80","66","46748  >  80 [ACK] Seq=815 Ack=2190 Win=64128 Len=0 TSval=4192455698 TSecr=373897"
"117","2020-07-17 12:52:44.965086279","192.168.56.104","192.168.56.105","HTTP","80","46748","71","HTTP/1.1 200 OK  (application/json)"
"118","2020-07-17 12:52:44.965089280","192.168.56.105","192.168.56.104","TCP","46748","80","66","46748  >  80 [ACK] Seq=815 Ack=2195 Win=64128 Len=0 TSval=4192455698 TSecr=373897"
"119","2020-07-17 12:52:45.182401047","192.168.56.104","192.168.56.105","TCP","80","46744","1323","80  >  46744 [PSH, ACK] Seq=4805 Ack=1764 Win=33408 Len=1257 TSval=373951 TSecr=4192455622 [TCP segment of a reassembled PDU]"
"120","2020-07-17 12:52:45.182428709","192.168.56.105","192.168.56.104","TCP","46744","80","66","46744  >  80 [ACK] Seq=1764 Ack=6062 Win=64128 Len=0 TSval=4192455915 TSecr=373951"
"121","2020-07-17 12:52:45.193296763","192.168.56.104","192.168.56.105","TCP","80","46744","82","80  >  46744 [PSH, ACK] Seq=6062 Ack=1764 Win=33408 Len=16 TSval=373954 TSecr=4192455915 [TCP segment of a reassembled PDU]"
"122","2020-07-17 12:52:45.193318497","192.168.56.105","192.168.56.104","TCP","46744","80","66","46744  >  80 [ACK] Seq=1764 Ack=6078 Win=64128 Len=0 TSval=4192455926 TSecr=373954"
"123","2020-07-17 12:52:45.193338348","192.168.56.104","192.168.56.105","HTTP","80","46744","71","HTTP/1.1 200 OK  (application/json)"
"124","2020-07-17 12:52:45.193341314","192.168.56.105","192.168.56.104","TCP","46744","80","66","46744  >  80 [ACK] Seq=1764 Ack=6083 Win=64128 Len=0 TSval=4192455926 TSecr=373954"
"125","2020-07-17 12:52:49.883703008","192.168.56.105","192.168.56.104","TCP","46746","80","66","[TCP Keep-Alive] 46746  >  80 [ACK] Seq=298 Ack=1068 Win=64128 Len=0 TSval=4192460617 TSecr=372598"
"126","2020-07-17 12:52:49.884083661","192.168.56.104","192.168.56.105","TCP","80","46746","66","[TCP Keep-Alive ACK] 80  >  46746 [ACK] Seq=1068 Ack=299 Win=30080 Len=0 TSval=375126 TSecr=4192440482"
"127","2020-07-17 12:52:51.467911883","192.168.56.105","192.168.56.104","HTTP","46744","80","578","GET /api/account HTTP/1.1 "
"128","2020-07-17 12:52:51.468374855","192.168.56.104","192.168.56.105","TCP","80","46744","66","80  >  46744 [ACK] Seq=6083 Ack=2276 Win=34560 Len=0 TSval=375522 TSecr=4192462201"
"129","2020-07-17 12:52:51.469379478","192.168.56.105","192.168.56.104","HTTP","46748","80","632","GET /api/accounts?page=0&size=20&sort=id,asc&cacheBuster=1595011971456 HTTP/1.1 "
"130","2020-07-17 12:52:51.469831514","192.168.56.104","192.168.56.105","TCP","80","46748","66","80  >  46748 [ACK] Seq=2195 Ack=1381 Win=32256 Len=0 TSval=375523 TSecr=4192462202"
"131","2020-07-17 12:52:51.507898379","192.168.56.104","192.168.56.105","TCP","80","46744","1124","80  >  46744 [PSH, ACK] Seq=6083 Ack=2276 Win=34560 Len=1058 TSval=375532 TSecr=4192462201 [TCP segment of a reassembled PDU]"
"132","2020-07-17 12:52:51.507923404","192.168.56.105","192.168.56.104","TCP","46744","80","66","46744  >  80 [ACK] Seq=2276 Ack=7141 Win=64128 Len=0 TSval=4192462241 TSecr=375532"
"133","2020-07-17 12:52:51.517700648","192.168.56.104","192.168.56.105","TCP","80","46744","82","80  >  46744 [PSH, ACK] Seq=7141 Ack=2276 Win=34560 Len=16 TSval=375535 TSecr=4192462241 [TCP segment of a reassembled PDU]"
"134","2020-07-17 12:52:51.517725543","192.168.56.105","192.168.56.104","TCP","46744","80","66","46744  >  80 [ACK] Seq=2276 Ack=7157 Win=64128 Len=0 TSval=4192462251 TSecr=375535"
"135","2020-07-17 12:52:51.517846041","192.168.56.104","192.168.56.105","HTTP","80","46744","71","HTTP/1.1 200 OK  (application/json)"
"136","2020-07-17 12:52:51.517853374","192.168.56.105","192.168.56.104","TCP","46744","80","66","46744  >  80 [ACK] Seq=2276 Ack=7162 Win=64128 Len=0 TSval=4192462251 TSecr=375535"
"137","2020-07-17 12:52:51.651230929","192.168.56.104","192.168.56.105","TCP","80","46748","1309","80  >  46748 [PSH, ACK] Seq=2195 Ack=1381 Win=32256 Len=1243 TSval=375568 TSecr=4192462202 [TCP segment of a reassembled PDU]"
"138","2020-07-17 12:52:51.651248778","192.168.56.105","192.168.56.104","TCP","46748","80","66","46748  >  80 [ACK] Seq=1381 Ack=3438 Win=64128 Len=0 TSval=4192462384 TSecr=375568"
"139","2020-07-17 12:52:51.658067042","192.168.56.104","192.168.56.105","TCP","80","46748","82","80  >  46748 [PSH, ACK] Seq=3438 Ack=1381 Win=32256 Len=16 TSval=375570 TSecr=4192462384 [TCP segment of a reassembled PDU]"
"140","2020-07-17 12:52:51.658124456","192.168.56.105","192.168.56.104","TCP","46748","80","66","46748  >  80 [ACK] Seq=1381 Ack=3454 Win=64128 Len=0 TSval=4192462391 TSecr=375570"
"141","2020-07-17 12:52:51.658179799","192.168.56.104","192.168.56.105","HTTP","80","46748","71","HTTP/1.1 200 OK  (application/json)"
"142","2020-07-17 12:52:51.658186442","192.168.56.105","192.168.56.104","TCP","46748","80","66","46748  >  80 [ACK] Seq=1381 Ack=3459 Win=64128 Len=0 TSval=4192462391 TSecr=375570"
"143","2020-07-17 12:52:58.227853418","192.168.56.105","192.168.56.104","HTTP","46744","80","639","GET /api/transactions?page=0&size=20&sort=id,asc&cacheBuster=1595011978202 HTTP/1.1 "
"144","2020-07-17 12:52:58.228322998","192.168.56.104","192.168.56.105","TCP","80","46744","66","80  >  46744 [ACK] Seq=7162 Ack=2849 Win=35712 Len=0 TSval=377212 TSecr=4192468961"
"145","2020-07-17 12:52:58.393110051","192.168.56.104","192.168.56.105","TCP","80","46744","1286","80  >  46744 [PSH, ACK] Seq=7162 Ack=2849 Win=35712 Len=1220 TSval=377254 TSecr=4192468961 [TCP segment of a reassembled PDU]"
"146","2020-07-17 12:52:58.393130365","192.168.56.105","192.168.56.104","TCP","46744","80","66","46744  >  80 [ACK] Seq=2849 Ack=8382 Win=64128 Len=0 TSval=4192469126 TSecr=377254"
"147","2020-07-17 12:52:58.396129226","192.168.56.104","192.168.56.105","TCP","80","46744","82","80  >  46744 [PSH, ACK] Seq=8382 Ack=2849 Win=35712 Len=16 TSval=377254 TSecr=4192469126 [TCP segment of a reassembled PDU]"
"148","2020-07-17 12:52:58.396149257","192.168.56.105","192.168.56.104","TCP","46744","80","66","46744  >  80 [ACK] Seq=2849 Ack=8398 Win=64128 Len=0 TSval=4192469129 TSecr=377254"
"149","2020-07-17 12:52:58.396170769","192.168.56.104","192.168.56.105","HTTP","80","46744","71","HTTP/1.1 200 OK  (application/json)"
"150","2020-07-17 12:52:58.396174309","192.168.56.105","192.168.56.104","TCP","46744","80","66","46744  >  80 [ACK] Seq=2849 Ack=8403 Win=64128 Len=0 TSval=4192469129 TSecr=377254"
"151","2020-07-17 12:53:00.125011962","192.168.56.105","192.168.56.104","TCP","46746","80","66","[TCP Keep-Alive] 46746  >  80 [ACK] Seq=298 Ack=1068 Win=64128 Len=0 TSval=4192470858 TSecr=375126"
"152","2020-07-17 12:53:00.125891902","192.168.56.104","192.168.56.105","TCP","80","46746","66","[TCP Keep-Alive ACK] 80  >  46746 [ACK] Seq=1068 Ack=299 Win=30080 Len=0 TSval=377687 TSecr=4192440482"
"153","2020-07-17 12:53:01.659777999","192.168.56.105","192.168.56.104","TCP","46748","80","66","[TCP Keep-Alive] 46748  >  80 [ACK] Seq=1380 Ack=3459 Win=64128 Len=0 TSval=4192472393 TSecr=375570"
"154","2020-07-17 12:53:01.660892545","192.168.56.104","192.168.56.105","TCP","80","46748","66","[TCP Keep-Alive ACK] 80  >  46748 [ACK] Seq=3459 Ack=1381 Win=32256 Len=0 TSval=378070 TSecr=4192462391"
"155","2020-07-17 12:53:02.767331249","192.168.56.102","192.168.56.100","DHCP","68","67","342","DHCP Request  - Transaction ID 0x99818152"
"156","2020-07-17 12:53:02.806718696","192.168.56.100","192.168.56.102","DHCP","67","68","590","DHCP ACK      - Transaction ID 0x99818152"
"157","2020-07-17 12:53:04.410839884","192.168.56.105","192.168.56.104","HTTP","46744","80","612","GET /api/accounts?cacheBuster=1595011984356 HTTP/1.1 "
"158","2020-07-17 12:53:04.411153222","192.168.56.104","192.168.56.105","TCP","80","46744","66","80  >  46744 [ACK] Seq=8403 Ack=3395 Win=36736 Len=0 TSval=378758 TSecr=4192475144"
"159","2020-07-17 12:53:04.412239946","192.168.56.105","192.168.56.104","HTTP","46748","80","609","GET /api/payee?cacheBuster=1595011984356 HTTP/1.1 "
"160","2020-07-17 12:53:04.412455806","192.168.56.104","192.168.56.105","TCP","80","46748","66","80  >  46748 [ACK] Seq=3459 Ack=1924 Win=33408 Len=0 TSval=378758 TSecr=4192475145"
"161","2020-07-17 12:53:04.498741501","192.168.56.104","192.168.56.105","TCP","80","46744","1281","80  >  46744 [PSH, ACK] Seq=8403 Ack=3395 Win=36736 Len=1215 TSval=378780 TSecr=4192475144 [TCP segment of a reassembled PDU]"
"162","2020-07-17 12:53:04.498764592","192.168.56.105","192.168.56.104","TCP","46744","80","66","46744  >  80 [ACK] Seq=3395 Ack=9618 Win=64128 Len=0 TSval=4192475232 TSecr=378780"
"163","2020-07-17 12:53:04.511790050","192.168.56.104","192.168.56.105","TCP","80","46744","82","80  >  46744 [PSH, ACK] Seq=9618 Ack=3395 Win=36736 Len=16 TSval=378783 TSecr=4192475232 [TCP segment of a reassembled PDU]"
"164","2020-07-17 12:53:04.511815080","192.168.56.105","192.168.56.104","TCP","46744","80","66","46744  >  80 [ACK] Seq=3395 Ack=9634 Win=64128 Len=0 TSval=4192475245 TSecr=378783"
"165","2020-07-17 12:53:04.511840558","192.168.56.104","192.168.56.105","HTTP","80","46744","71","HTTP/1.1 200 OK  (application/json)"
"166","2020-07-17 12:53:04.511864870","192.168.56.105","192.168.56.104","TCP","46744","80","66","46744  >  80 [ACK] Seq=3395 Ack=9639 Win=64128 Len=0 TSval=4192475245 TSecr=378783"
"167","2020-07-17 12:53:04.539597216","192.168.56.104","192.168.56.105","TCP","80","46748","1150","80  >  46748 [PSH, ACK] Seq=3459 Ack=1924 Win=33408 Len=1084 TSval=378790 TSecr=4192475145 [TCP segment of a reassembled PDU]"
"168","2020-07-17 12:53:04.539620093","192.168.56.105","192.168.56.104","TCP","46748","80","66","46748  >  80 [ACK] Seq=1924 Ack=4543 Win=64128 Len=0 TSval=4192475273 TSecr=378790"
"169","2020-07-17 12:53:04.546052195","192.168.56.104","192.168.56.105","TCP","80","46748","82","80  >  46748 [PSH, ACK] Seq=4543 Ack=1924 Win=33408 Len=16 TSval=378792 TSecr=4192475273 [TCP segment of a reassembled PDU]"
"170","2020-07-17 12:53:04.546078075","192.168.56.105","192.168.56.104","TCP","46748","80","66","46748  >  80 [ACK] Seq=1924 Ack=4559 Win=64128 Len=0 TSval=4192475279 TSecr=378792"
"171","2020-07-17 12:53:04.546177939","192.168.56.104","192.168.56.105","HTTP","80","46748","71","HTTP/1.1 200 OK  (application/json)"
"172","2020-07-17 12:53:04.546185445","192.168.56.105","192.168.56.104","TCP","46748","80","66","46748  >  80 [ACK] Seq=1924 Ack=4564 Win=64128 Len=0 TSval=4192475279 TSecr=378792"
"173","2020-07-17 12:53:07.772133712","PcsCompu_af:7b:18","PcsCompu_b7:12:b1","ARP","","","60","Who has 192.168.56.100? Tell 192.168.56.102"
"174","2020-07-17 12:53:07.772140019","PcsCompu_b7:12:b1","PcsCompu_af:7b:18","ARP","","","60","192.168.56.100 is at 08:00:27:b7:12:b1"
"175","2020-07-17 12:53:10.363319202","192.168.56.105","192.168.56.104","TCP","46746","80","66","[TCP Keep-Alive] 46746  >  80 [ACK] Seq=298 Ack=1068 Win=64128 Len=0 TSval=4192481096 TSecr=377687"
"176","2020-07-17 12:53:10.364499224","192.168.56.104","192.168.56.105","TCP","80","46746","66","[TCP Keep-Alive ACK] 80  >  46746 [ACK] Seq=1068 Ack=299 Win=30080 Len=0 TSval=380246 TSecr=4192440482"
"177","2020-07-17 12:53:14.303563101","192.168.56.105","192.168.56.104","HTTP","46744","80","639","GET /api/transactions?page=0&size=20&sort=id,asc&cacheBuster=1595011994290 HTTP/1.1 "
"178","2020-07-17 12:53:14.304157045","192.168.56.104","192.168.56.105","TCP","80","46744","66","80  >  46744 [ACK] Seq=9639 Ack=3968 Win=37888 Len=0 TSval=381231 TSecr=4192485036"
"179","2020-07-17 12:53:14.367200104","192.168.56.104","192.168.56.105","TCP","80","46744","1286","80  >  46744 [PSH, ACK] Seq=9639 Ack=3968 Win=37888 Len=1220 TSval=381247 TSecr=4192485036 [TCP segment of a reassembled PDU]"
"180","2020-07-17 12:53:14.367228077","192.168.56.105","192.168.56.104","TCP","46744","80","66","46744  >  80 [ACK] Seq=3968 Ack=10859 Win=64128 Len=0 TSval=4192485100 TSecr=381247"
"181","2020-07-17 12:53:14.369786862","192.168.56.104","192.168.56.105","TCP","80","46744","82","80  >  46744 [PSH, ACK] Seq=10859 Ack=3968 Win=37888 Len=16 TSval=381248 TSecr=4192485100 [TCP segment of a reassembled PDU]"
"182","2020-07-17 12:53:14.369801603","192.168.56.105","192.168.56.104","TCP","46744","80","66","46744  >  80 [ACK] Seq=3968 Ack=10875 Win=64128 Len=0 TSval=4192485103 TSecr=381248"
"183","2020-07-17 12:53:14.369818103","192.168.56.104","192.168.56.105","HTTP","80","46744","71","HTTP/1.1 200 OK  (application/json)"
"184","2020-07-17 12:53:14.369820697","192.168.56.105","192.168.56.104","TCP","46744","80","66","46744  >  80 [ACK] Seq=3968 Ack=10880 Win=64128 Len=0 TSval=4192485103 TSecr=381248"
"185","2020-07-17 12:53:14.715532479","192.168.56.105","192.168.56.104","TCP","46748","80","66","[TCP Keep-Alive] 46748  >  80 [ACK] Seq=1923 Ack=4564 Win=64128 Len=0 TSval=4192485448 TSecr=378792"
"186","2020-07-17 12:53:14.715974154","192.168.56.104","192.168.56.105","TCP","80","46748","66","[TCP Keep-Alive ACK] 80  >  46748 [ACK] Seq=4564 Ack=1924 Win=33408 Len=0 TSval=381334 TSecr=4192475279"
"187","2020-07-17 12:53:20.618010732","192.168.56.105","192.168.56.104","TCP","46746","80","66","[TCP Keep-Alive] 46746  >  80 [ACK] Seq=298 Ack=1068 Win=64128 Len=0 TSval=4192491351 TSecr=380246"
"188","2020-07-17 12:53:20.619171447","192.168.56.104","192.168.56.105","TCP","80","46746","66","[TCP Keep-Alive ACK] 80  >  46746 [ACK] Seq=1068 Ack=299 Win=30080 Len=0 TSval=382810 TSecr=4192440482"
"189","2020-07-17 12:53:24.444001300","192.168.56.105","192.168.56.104","TCP","46744","80","66","[TCP Keep-Alive] 46744  >  80 [ACK] Seq=3967 Ack=10880 Win=64128 Len=0 TSval=4192495177 TSecr=381248"
"190","2020-07-17 12:53:24.445206105","192.168.56.104","192.168.56.105","TCP","80","46744","66","[TCP Keep-Alive ACK] 80  >  46744 [ACK] Seq=10880 Ack=3968 Win=37888 Len=0 TSval=383767 TSecr=4192485103"
"191","2020-07-17 12:53:24.955700415","192.168.56.105","192.168.56.104","TCP","46748","80","66","[TCP Keep-Alive] 46748  >  80 [ACK] Seq=1923 Ack=4564 Win=64128 Len=0 TSval=4192495689 TSecr=381334"
"192","2020-07-17 12:53:24.956756378","192.168.56.104","192.168.56.105","TCP","80","46748","66","[TCP Keep-Alive ACK] 80  >  46748 [ACK] Seq=4564 Ack=1924 Win=33408 Len=0 TSval=383894 TSecr=4192475279"
"193","2020-07-17 12:53:29.805379748","192.168.56.104","192.168.56.105","TCP","80","46746","66","80  >  46746 [FIN, ACK] Seq=1068 Ack=299 Win=30080 Len=0 TSval=385107 TSecr=4192440482"
"194","2020-07-17 12:53:29.805923353","192.168.56.105","192.168.56.104","TCP","46746","80","66","46746  >  80 [FIN, ACK] Seq=299 Ack=1069 Win=64128 Len=0 TSval=4192500539 TSecr=385107"
"195","2020-07-17 12:53:29.806868607","192.168.56.104","192.168.56.105","TCP","80","46746","66","80  >  46746 [ACK] Seq=1069 Ack=300 Win=30080 Len=0 TSval=385107 TSecr=4192500539"
"196","2020-07-17 12:53:34.683335711","192.168.56.105","192.168.56.104","TCP","46744","80","66","[TCP Keep-Alive] 46744  >  80 [ACK] Seq=3967 Ack=10880 Win=64128 Len=0 TSval=4192505416 TSecr=383767"
"197","2020-07-17 12:53:34.684446512","192.168.56.104","192.168.56.105","TCP","80","46744","66","[TCP Keep-Alive ACK] 80  >  46744 [ACK] Seq=10880 Ack=3968 Win=37888 Len=0 TSval=386326 TSecr=4192485103"
"198","2020-07-17 12:53:35.196366642","192.168.56.105","192.168.56.104","TCP","46748","80","66","[TCP Keep-Alive] 46748  >  80 [ACK] Seq=1923 Ack=4564 Win=64128 Len=0 TSval=4192505929 TSecr=383894"
"199","2020-07-17 12:53:35.196925396","192.168.56.104","192.168.56.105","TCP","80","46748","66","[TCP Keep-Alive ACK] 80  >  46748 [ACK] Seq=4564 Ack=1924 Win=33408 Len=0 TSval=386455 TSecr=4192475279"
"200","2020-07-17 12:53:38.070468201","192.168.56.105","192.168.56.104","HTTP","46744","80","968","POST /api/mediaFiles HTTP/1.1  (text/plain)"
"201","2020-07-17 12:53:38.070930955","192.168.56.104","192.168.56.105","TCP","80","46744","66","80  >  46744 [ACK] Seq=10880 Ack=4870 Win=39808 Len=0 TSval=387173 TSecr=4192508803"
"202","2020-07-17 12:53:38.187923389","192.168.56.104","192.168.56.105","TCP","80","46744","1161","80  >  46744 [PSH, ACK] Seq=10880 Ack=4870 Win=39808 Len=1095 TSval=387202 TSecr=4192508803 [TCP segment of a reassembled PDU]"
"203","2020-07-17 12:53:38.187946878","192.168.56.105","192.168.56.104","TCP","46744","80","66","46744  >  80 [ACK] Seq=4870 Ack=11975 Win=64128 Len=0 TSval=4192508921 TSecr=387202"
"204","2020-07-17 12:53:38.198118274","192.168.56.104","192.168.56.105","HTTP","80","46744","71","HTTP/1.1 500 Internal Server Error  (application/problem+json)"
"205","2020-07-17 12:53:38.198137680","192.168.56.105","192.168.56.104","TCP","46744","80","66","46744  >  80 [ACK] Seq=4870 Ack=11980 Win=64128 Len=0 TSval=4192508931 TSecr=387205"
"206","2020-07-17 12:53:45.102352777","192.168.56.102","192.168.56.255","NBNS","137","137","92","Name query NB WORKGROUP<1d>"
"207","2020-07-17 12:53:45.102416135","192.168.56.1","255.255.255.255","NBNS","56901","137","92","Name query NB WORKGROUP<1d>"
"208","2020-07-17 12:53:45.102637114","192.168.56.101","192.168.56.102","NBNS","137","137","104","Name query response NB 192.168.56.101"
"209","2020-07-17 12:53:45.102771399","192.168.56.101","192.168.56.1","NBNS","137","56901","104","Name query response NB 192.168.56.101"
"210","2020-07-17 12:53:45.440664319","192.168.56.105","192.168.56.104","TCP","46748","80","66","[TCP Keep-Alive] 46748  >  80 [ACK] Seq=1923 Ack=4564 Win=64128 Len=0 TSval=4192516174 TSecr=386455"
"211","2020-07-17 12:53:45.441005194","192.168.56.104","192.168.56.105","TCP","80","46748","66","[TCP Keep-Alive ACK] 80  >  46748 [ACK] Seq=4564 Ack=1924 Win=33408 Len=0 TSval=389016 TSecr=4192475279"
"212","2020-07-17 12:53:46.605340312","192.168.56.105","192.168.56.100","DHCP","68","67","342","DHCP Request  - Transaction ID 0x77c49f72"
"213","2020-07-17 12:53:46.635637159","192.168.56.100","192.168.56.105","DHCP","67","68","590","DHCP ACK      - Transaction ID 0x77c49f72"
"214","2020-07-17 12:53:47.454590745","192.168.56.105","192.168.56.104","HTTP","46744","80","380","GET /app/account.2217590b5cc5d0b62058.chunk.js HTTP/1.1 "
"215","2020-07-17 12:53:47.454955482","192.168.56.104","192.168.56.105","TCP","80","46744","66","80  >  46744 [ACK] Seq=11980 Ack=5184 Win=41600 Len=0 TSval=389519 TSecr=4192518188"
"216","2020-07-17 12:53:47.471715659","192.168.56.104","192.168.56.105","HTTP","80","46744","1361","HTTP/1.1 200 OK  (application/javascript)"
"217","2020-07-17 12:53:47.471736337","192.168.56.105","192.168.56.104","TCP","46744","80","66","46744  >  80 [ACK] Seq=5184 Ack=13275 Win=64128 Len=0 TSval=4192518205 TSecr=389523"
"218","2020-07-17 12:53:47.499125068","192.168.56.105","192.168.56.104","HTTP","46744","80","579","GET /api/account HTTP/1.1 "
"219","2020-07-17 12:53:47.521572648","192.168.56.104","192.168.56.105","TCP","80","46744","1124","80  >  46744 [PSH, ACK] Seq=13275 Ack=5697 Win=43392 Len=1058 TSval=389536 TSecr=4192518232 [TCP segment of a reassembled PDU]"
"220","2020-07-17 12:53:47.521607136","192.168.56.105","192.168.56.104","TCP","46744","80","66","46744  >  80 [ACK] Seq=5697 Ack=14333 Win=64128 Len=0 TSval=4192518255 TSecr=389536"
"221","2020-07-17 12:53:47.528531390","192.168.56.104","192.168.56.105","TCP","80","46744","82","80  >  46744 [PSH, ACK] Seq=14333 Ack=5697 Win=43392 Len=16 TSval=389537 TSecr=4192518255 [TCP segment of a reassembled PDU]"
"222","2020-07-17 12:53:47.528555323","192.168.56.105","192.168.56.104","TCP","46744","80","66","46744  >  80 [ACK] Seq=5697 Ack=14349 Win=64128 Len=0 TSval=4192518261 TSecr=389537"
"223","2020-07-17 12:53:47.528575579","192.168.56.104","192.168.56.105","HTTP","80","46744","71","HTTP/1.1 200 OK  (application/json)"
"224","2020-07-17 12:53:47.528578402","192.168.56.105","192.168.56.104","TCP","46744","80","66","46744  >  80 [ACK] Seq=5697 Ack=14354 Win=64128 Len=0 TSval=4192518262 TSecr=389538"
"225","2020-07-17 12:53:50.105493178","PcsCompu_ae:93:92","PcsCompu_af:7b:18","ARP","","","60","Who has 192.168.56.102? Tell 192.168.56.101"
"226","2020-07-17 12:53:50.105516095","PcsCompu_ae:93:92","0a:00:27:00:00:1a","ARP","","","60","Who has 192.168.56.1? Tell 192.168.56.101"
