"No.","Time","Source","Destination","Protocol","Length","Info","Source Port","Dest Port"
"1","1594608878.115614448","192.168.56.102","192.168.56.255","NBNS","92","Name query NB WORKGROUP<1d>","137","137"
"2","1594608878.115854052","192.168.56.101","192.168.56.102","NBNS","104","Name query response NB 192.168.56.101","137","137"
"3","1594608878.115905970","192.168.56.1","255.255.255.255","NBNS","92","Name query NB WORKGROUP<1d>","54926","137"
"4","1594608878.116133751","192.168.56.101","192.168.56.1","NBNS","104","Name query response NB 192.168.56.101","137","54926"
"5","1594608883.120683917","PcsCompu_ae:93:92","PcsCompu_af:7b:18","ARP","60","Who has 192.168.56.102? Tell 192.168.56.101","",""
"6","1594608883.120710417","PcsCompu_ae:93:92","0a:00:27:00:00:1a","ARP","60","Who has 192.168.56.1? Tell 192.168.56.101","",""
"7","1594608883.120711737","0a:00:27:00:00:1a","PcsCompu_ae:93:92","ARP","60","192.168.56.1 is at 0a:00:27:00:00:1a","",""
"8","1594608883.121003898","PcsCompu_af:7b:18","PcsCompu_ae:93:92","ARP","60","192.168.56.102 is at 08:00:27:af:7b:18","",""
"9","1594608891.116719776","192.168.56.102","192.168.56.101","TCP","74","60348  >  22 [SYN] Seq=0 Win=29200 Len=0 MSS=1460 SACK_PERM=1 TSval=2059235 TSecr=0 WS=128","60348","22"
"10","1594608891.116968323","192.168.56.101","192.168.56.102","TCP","74","22  >  60348 [SYN, ACK] Seq=0 Ack=1 Win=28960 Len=0 MSS=1460 SACK_PERM=1 TSval=2059827 TSecr=2059235 WS=128","22","60348"
"11","1594608891.117136487","192.168.56.102","192.168.56.101","TCP","66","60348  >  22 [ACK] Seq=1 Ack=1 Win=29312 Len=0 TSval=2059235 TSecr=2059827","60348","22"
"12","1594608891.117454455","192.168.56.102","192.168.56.101","SSHv2","107","Client: Protocol (SSH-2.0-OpenSSH_7.2p2 Ubuntu-4ubuntu2.1)","60348","22"
"13","1594608891.117678816","192.168.56.101","192.168.56.102","TCP","66","22  >  60348 [ACK] Seq=1 Ack=42 Win=29056 Len=0 TSval=2059827 TSecr=2059236","22","60348"
"14","1594608891.123372351","192.168.56.101","192.168.56.102","SSHv2","110","Server: Protocol (SSH-2.0-OpenSSH_6.6.1p1 Ubuntu-2ubuntu2.13)","22","60348"
"15","1594608891.123556914","192.168.56.102","192.168.56.101","TCP","66","60348  >  22 [ACK] Seq=42 Ack=45 Win=29312 Len=0 TSval=2059237 TSecr=2059828","60348","22"
"16","1594608891.124159221","192.168.56.102","192.168.56.101","SSHv2","1402","Client: Key Exchange Init","60348","22"
"17","1594608891.124399493","192.168.56.101","192.168.56.102","SSHv2","1698","Server: Key Exchange Init","22","60348"
"18","1594608891.124667532","192.168.56.102","192.168.56.101","TCP","66","60348  >  22 [ACK] Seq=1378 Ack=1677 Win=32512 Len=0 TSval=2059237 TSecr=2059829","60348","22"
"19","1594608891.128074943","192.168.56.102","192.168.56.101","SSHv2","114","Client: Elliptic Curve Diffie-Hellman Key Exchange Init","60348","22"
"20","1594608891.130917630","192.168.56.101","192.168.56.102","SSHv2","346","Server: Elliptic Curve Diffie-Hellman Key Exchange Reply, New Keys","22","60348"
"21","1594608891.133686738","192.168.56.102","192.168.56.101","SSHv2","82","Client: New Keys","60348","22"
"22","1594608891.172592067","192.168.56.101","192.168.56.102","TCP","66","22  >  60348 [ACK] Seq=1957 Ack=1442 Win=31872 Len=0 TSval=2059841 TSecr=2059240","22","60348"
"23","1594608891.172789155","192.168.56.102","192.168.56.101","SSHv2","110","Client: Encrypted packet (len=44)","60348","22"
"24","1594608891.172907596","192.168.56.101","192.168.56.102","TCP","66","22  >  60348 [ACK] Seq=1957 Ack=1486 Win=31872 Len=0 TSval=2059841 TSecr=2059249","22","60348"
"25","1594608891.173064740","192.168.56.101","192.168.56.102","SSHv2","110","Server: Encrypted packet (len=44)","22","60348"
"26","1594608891.173277104","192.168.56.102","192.168.56.101","SSHv2","134","Client: Encrypted packet (len=68)","60348","22"
"27","1594608891.175622590","192.168.56.101","192.168.56.102","SSHv2","118","Server: Encrypted packet (len=52)","22","60348"
"28","1594608891.213586162","192.168.56.102","192.168.56.101","TCP","66","60348  >  22 [ACK] Seq=1554 Ack=2053 Win=35456 Len=0 TSval=2059260 TSecr=2059841","60348","22"
"29","1594608899.731895347","192.168.56.102","192.168.56.101","SSHv2","214","Client: Encrypted packet (len=148)","60348","22"
"30","1594608899.739153103","192.168.56.101","192.168.56.102","SSHv2","94","Server: Encrypted packet (len=28)","22","60348"
"31","1594608899.739278172","192.168.56.102","192.168.56.101","TCP","66","60348  >  22 [ACK] Seq=1702 Ack=2081 Win=35456 Len=0 TSval=2061391 TSecr=2061982","60348","22"
"32","1594608899.739427356","192.168.56.102","192.168.56.101","SSHv2","178","Client: Encrypted packet (len=112)","60348","22"
"33","1594608899.776277273","192.168.56.101","192.168.56.102","TCP","66","22  >  60348 [ACK] Seq=2081 Ack=1814 Win=34560 Len=0 TSval=2061992 TSecr=2061391","22","60348"
"34","1594608900.105994563","192.168.56.101","192.168.56.102","SSHv2","110","Server: Encrypted packet (len=44)","22","60348"
"35","1594608900.106270405","192.168.56.102","192.168.56.101","SSHv2","510","Client: Encrypted packet (len=444)","60348","22"
"36","1594608900.106391662","192.168.56.101","192.168.56.102","TCP","66","22  >  60348 [ACK] Seq=2125 Ack=2258 Win=37248 Len=0 TSval=2062074 TSecr=2061483","22","60348"
"37","1594608900.107548553","192.168.56.101","192.168.56.102","SSHv2","174","Server: Encrypted packet (len=108)","22","60348"
"38","1594608900.109265562","192.168.56.101","192.168.56.102","SSHv2","614","Server: Encrypted packet (len=548)","22","60348"
"39","1594608900.109569337","192.168.56.102","192.168.56.101","TCP","66","60348  >  22 [ACK] Seq=2258 Ack=2781 Win=38272 Len=0 TSval=2061484 TSecr=2062074","60348","22"
"40","1594608900.193669040","192.168.56.101","192.168.56.102","SSHv2","126","Server: Encrypted packet (len=60)","22","60348"
"41","1594608900.233966416","192.168.56.102","192.168.56.101","TCP","66","60348  >  22 [ACK] Seq=2258 Ack=2841 Win=38272 Len=0 TSval=2061515 TSecr=2062096","60348","22"
"42","1594608902.411669961","192.168.56.102","192.168.56.101","SSHv2","102","Client: Encrypted packet (len=36)","60348","22"
"43","1594608902.412045634","192.168.56.101","192.168.56.102","SSHv2","102","Server: Encrypted packet (len=36)","22","60348"
"44","1594608902.412300039","192.168.56.102","192.168.56.101","TCP","66","60348  >  22 [ACK] Seq=2294 Ack=2877 Win=38272 Len=0 TSval=2062059 TSecr=2062651","60348","22"
"45","1594608902.601267197","192.168.56.102","192.168.56.101","SSHv2","102","Client: Encrypted packet (len=36)","60348","22"
"46","1594608902.601604639","192.168.56.101","192.168.56.102","SSHv2","102","Server: Encrypted packet (len=36)","22","60348"
"47","1594608902.601759862","192.168.56.102","192.168.56.101","TCP","66","60348  >  22 [ACK] Seq=2330 Ack=2913 Win=38272 Len=0 TSval=2062107 TSecr=2062698","60348","22"
"48","1594608903.131371737","192.168.56.102","192.168.56.101","SSHv2","102","Client: Encrypted packet (len=36)","60348","22"
"49","1594608903.131769016","192.168.56.101","192.168.56.102","SSHv2","102","Server: Encrypted packet (len=36)","22","60348"
"50","1594608903.131963957","192.168.56.102","192.168.56.101","TCP","66","60348  >  22 [ACK] Seq=2366 Ack=2949 Win=38272 Len=0 TSval=2062239 TSecr=2062830","60348","22"
"51","1594608903.133180304","192.168.56.101","192.168.56.102","SSHv2","126","Server: Encrypted packet (len=60)","22","60348"
"52","1594608903.133300479","192.168.56.101","192.168.56.102","SSHv2","102","Server: Encrypted packet (len=36)","22","60348"
"53","1594608903.133304145","192.168.56.102","192.168.56.101","TCP","66","60348  >  22 [ACK] Seq=2366 Ack=3009 Win=38272 Len=0 TSval=2062240 TSecr=2062831","60348","22"
"54","1594608903.133695583","192.168.56.102","192.168.56.101","TCP","66","60348  >  22 [ACK] Seq=2366 Ack=3045 Win=38272 Len=0 TSval=2062240 TSecr=2062831","60348","22"
"55","1594608903.133712325","192.168.56.101","192.168.56.102","SSHv2","126","Server: Encrypted packet (len=60)","22","60348"
"56","1594608903.133823087","192.168.56.102","192.168.56.101","TCP","66","60348  >  22 [ACK] Seq=2366 Ack=3105 Win=38272 Len=0 TSval=2062240 TSecr=2062831","60348","22"
"57","1594608905.191245541","192.168.56.102","192.168.56.101","SSHv2","102","Client: Encrypted packet (len=36)","60348","22"
"58","1594608905.191587820","192.168.56.101","192.168.56.102","SSHv2","102","Server: Encrypted packet (len=36)","22","60348"
"59","1594608905.191775713","192.168.56.102","192.168.56.101","TCP","66","60348  >  22 [ACK] Seq=2402 Ack=3141 Win=38272 Len=0 TSval=2062754 TSecr=2063345","60348","22"
"60","1594608905.441152244","192.168.56.102","192.168.56.101","SSHv2","102","Client: Encrypted packet (len=36)","60348","22"
"61","1594608905.441481400","192.168.56.101","192.168.56.102","SSHv2","102","Server: Encrypted packet (len=36)","22","60348"
"62","1594608905.441626775","192.168.56.102","192.168.56.101","TCP","66","60348  >  22 [ACK] Seq=2438 Ack=3177 Win=38272 Len=0 TSval=2062817 TSecr=2063408","60348","22"
"63","1594608905.741232730","192.168.56.102","192.168.56.101","SSHv2","102","Client: Encrypted packet (len=36)","60348","22"
"64","1594608905.741598193","192.168.56.101","192.168.56.102","SSHv2","102","Server: Encrypted packet (len=36)","22","60348"
"65","1594608905.741720373","192.168.56.102","192.168.56.101","TCP","66","60348  >  22 [ACK] Seq=2474 Ack=3213 Win=38272 Len=0 TSval=2062892 TSecr=2063483","60348","22"
"66","1594608905.971079863","192.168.56.102","192.168.56.101","SSHv2","102","Client: Encrypted packet (len=36)","60348","22"
"67","1594608905.971373718","192.168.56.101","192.168.56.102","SSHv2","102","Server: Encrypted packet (len=36)","22","60348"
"68","1594608905.971516264","192.168.56.102","192.168.56.101","TCP","66","60348  >  22 [ACK] Seq=2510 Ack=3249 Win=38272 Len=0 TSval=2062949 TSecr=2063540","60348","22"
"69","1594608906.141263966","192.168.56.102","192.168.56.101","SSHv2","102","Client: Encrypted packet (len=36)","60348","22"
"70","1594608906.141680402","192.168.56.101","192.168.56.102","SSHv2","102","Server: Encrypted packet (len=36)","22","60348"
"71","1594608906.141876673","192.168.56.102","192.168.56.101","TCP","66","60348  >  22 [ACK] Seq=2546 Ack=3285 Win=38272 Len=0 TSval=2062992 TSecr=2063583","60348","22"
"72","1594608906.262404170","192.168.56.102","192.168.56.101","SSHv2","102","Client: Encrypted packet (len=36)","60348","22"
"73","1594608906.263322501","192.168.56.101","192.168.56.102","SSHv2","102","Server: Encrypted packet (len=36)","22","60348"
"74","1594608906.263581818","192.168.56.102","192.168.56.101","TCP","66","60348  >  22 [ACK] Seq=2582 Ack=3321 Win=38272 Len=0 TSval=2063022 TSecr=2063613","60348","22"
"75","1594608906.281785278","192.168.56.102","192.168.56.101","SSHv2","102","Client: Encrypted packet (len=36)","60348","22"
"76","1594608906.282179051","192.168.56.101","192.168.56.102","SSHv2","102","Server: Encrypted packet (len=36)","22","60348"
"77","1594608906.321723134","192.168.56.102","192.168.56.101","TCP","66","60348  >  22 [ACK] Seq=2618 Ack=3357 Win=38272 Len=0 TSval=2063037 TSecr=2063618","60348","22"
"78","1594608906.394564240","192.168.56.102","192.168.56.101","SSHv2","102","Client: Encrypted packet (len=36)","60348","22"
"79","1594608906.394982361","192.168.56.101","192.168.56.102","SSHv2","102","Server: Encrypted packet (len=36)","22","60348"
"80","1594608906.395097593","192.168.56.102","192.168.56.101","TCP","66","60348  >  22 [ACK] Seq=2654 Ack=3393 Win=38272 Len=0 TSval=2063055 TSecr=2063646","60348","22"
"81","1594608906.971411234","192.168.56.102","192.168.56.101","SSHv2","102","Client: Encrypted packet (len=36)","60348","22"
"82","1594608906.971719596","192.168.56.101","192.168.56.102","SSHv2","102","Server: Encrypted packet (len=36)","22","60348"
"83","1594608906.971863922","192.168.56.102","192.168.56.101","TCP","66","60348  >  22 [ACK] Seq=2690 Ack=3429 Win=38272 Len=0 TSval=2063199 TSecr=2063790","60348","22"
"84","1594608906.972127371","192.168.56.101","192.168.56.102","SSHv2","126","Server: Encrypted packet (len=60)","22","60348"
"85","1594608906.972308511","192.168.56.102","192.168.56.101","TCP","66","60348  >  22 [ACK] Seq=2690 Ack=3489 Win=38272 Len=0 TSval=2063199 TSecr=2063791","60348","22"
"86","1594608907.921385485","192.168.56.102","192.168.56.101","SSHv2","102","Client: Encrypted packet (len=36)","60348","22"
"87","1594608907.921717818","192.168.56.101","192.168.56.102","SSHv2","102","Server: Encrypted packet (len=36)","22","60348"
"88","1594608907.921863215","192.168.56.102","192.168.56.101","TCP","66","60348  >  22 [ACK] Seq=2726 Ack=3525 Win=38272 Len=0 TSval=2063437 TSecr=2064028","60348","22"
"89","1594608908.041173751","192.168.56.102","192.168.56.101","SSHv2","102","Client: Encrypted packet (len=36)","60348","22"
"90","1594608908.041473326","192.168.56.101","192.168.56.102","SSHv2","102","Server: Encrypted packet (len=36)","22","60348"
"91","1594608908.041541918","192.168.56.102","192.168.56.101","TCP","66","60348  >  22 [ACK] Seq=2762 Ack=3561 Win=38272 Len=0 TSval=2063467 TSecr=2064058","60348","22"
"92","1594608908.631085269","192.168.56.102","192.168.56.101","SSHv2","102","Client: Encrypted packet (len=36)","60348","22"
"93","1594608908.631487643","192.168.56.101","192.168.56.102","SSHv2","102","Server: Encrypted packet (len=36)","22","60348"
"94","1594608908.631626281","192.168.56.102","192.168.56.101","TCP","66","60348  >  22 [ACK] Seq=2798 Ack=3597 Win=38272 Len=0 TSval=2063614 TSecr=2064205","60348","22"
"95","1594608908.633379879","192.168.56.101","192.168.56.102","SSHv2","142","Server: Encrypted packet (len=76)","22","60348"
"96","1594608908.633488159","192.168.56.101","192.168.56.102","SSHv2","102","Server: Encrypted packet (len=36)","22","60348"
"97","1594608908.633491715","192.168.56.102","192.168.56.101","TCP","66","60348  >  22 [ACK] Seq=2798 Ack=3673 Win=38272 Len=0 TSval=2063615 TSecr=2064206","60348","22"
"98","1594608908.633652394","192.168.56.101","192.168.56.102","SSHv2","150","Server: Encrypted packet (len=84)","22","60348"
"99","1594608908.633752159","192.168.56.101","192.168.56.102","SSHv2","102","Server: Encrypted packet (len=36)","22","60348"
"100","1594608908.633755148","192.168.56.102","192.168.56.101","TCP","66","60348  >  22 [ACK] Seq=2798 Ack=3709 Win=38272 Len=0 TSval=2063615 TSecr=2064206","60348","22"
"101","1594608908.633756821","192.168.56.102","192.168.56.101","TCP","66","60348  >  22 [ACK] Seq=2798 Ack=3793 Win=38272 Len=0 TSval=2063615 TSecr=2064206","60348","22"
"102","1594608908.633966986","192.168.56.102","192.168.56.101","TCP","66","60348  >  22 [ACK] Seq=2798 Ack=3829 Win=38272 Len=0 TSval=2063615 TSecr=2064206","60348","22"
"103","1594608908.633970038","192.168.56.101","192.168.56.102","SSHv2","134","Server: Encrypted packet (len=68)","22","60348"
"104","1594608908.633971462","192.168.56.102","192.168.56.101","TCP","66","60348  >  22 [ACK] Seq=2798 Ack=3897 Win=38272 Len=0 TSval=2063615 TSecr=2064206","60348","22"
"105","1594608908.633972798","192.168.56.101","192.168.56.102","SSHv2","102","Server: Encrypted packet (len=36)","22","60348"
"106","1594608908.634192787","192.168.56.102","192.168.56.101","TCP","66","60348  >  22 [ACK] Seq=2798 Ack=3933 Win=38272 Len=0 TSval=2063615 TSecr=2064206","60348","22"
"107","1594608908.634195692","192.168.56.101","192.168.56.102","SSHv2","126","Server: Encrypted packet (len=60)","22","60348"
"108","1594608908.634197274","192.168.56.101","192.168.56.102","SSHv2","102","Server: Encrypted packet (len=36)","22","60348"
"109","1594608908.634198535","192.168.56.102","192.168.56.101","TCP","66","60348  >  22 [ACK] Seq=2798 Ack=3993 Win=38272 Len=0 TSval=2063615 TSecr=2064206","60348","22"
"110","1594608908.634199876","192.168.56.102","192.168.56.101","TCP","66","60348  >  22 [ACK] Seq=2798 Ack=4029 Win=38272 Len=0 TSval=2063615 TSecr=2064206","60348","22"
"111","1594608908.634413149","192.168.56.101","192.168.56.102","SSHv2","126","Server: Encrypted packet (len=60)","22","60348"
"112","1594608908.634577749","192.168.56.102","192.168.56.101","TCP","66","60348  >  22 [ACK] Seq=2798 Ack=4089 Win=38272 Len=0 TSval=2063615 TSecr=2064206","60348","22"
"113","1594608908.634580213","192.168.56.101","192.168.56.102","SSHv2","102","Server: Encrypted packet (len=36)","22","60348"
"114","1594608908.634581628","192.168.56.101","192.168.56.102","SSHv2","134","Server: Encrypted packet (len=68)","22","60348"
"115","1594608908.634583170","192.168.56.102","192.168.56.101","TCP","66","60348  >  22 [ACK] Seq=2798 Ack=4125 Win=38272 Len=0 TSval=2063615 TSecr=2064206","60348","22"
"116","1594608908.634584441","192.168.56.102","192.168.56.101","TCP","66","60348  >  22 [ACK] Seq=2798 Ack=4193 Win=38272 Len=0 TSval=2063615 TSecr=2064206","60348","22"
"117","1594608908.634943534","192.168.56.101","192.168.56.102","SSHv2","102","Server: Encrypted packet (len=36)","22","60348"
"118","1594608908.634946475","192.168.56.102","192.168.56.101","TCP","66","60348  >  22 [ACK] Seq=2798 Ack=4229 Win=38272 Len=0 TSval=2063615 TSecr=2064206","60348","22"
"119","1594608908.634947889","192.168.56.101","192.168.56.102","SSHv2","158","Server: Encrypted packet (len=92)","22","60348"
"120","1594608908.634949235","192.168.56.101","192.168.56.102","SSHv2","102","Server: Encrypted packet (len=36)","22","60348"
"121","1594608908.635183068","192.168.56.101","192.168.56.102","SSHv2","126","Server: Encrypted packet (len=60)","22","60348"
"122","1594608908.635186149","192.168.56.101","192.168.56.102","SSHv2","102","Server: Encrypted packet (len=36)","22","60348"
"123","1594608908.635381617","192.168.56.101","192.168.56.102","SSHv2","134","Server: Encrypted packet (len=68)","22","60348"
"124","1594608908.635498236","192.168.56.101","192.168.56.102","SSHv2","102","Server: Encrypted packet (len=36)","22","60348"
"125","1594608908.635620952","192.168.56.101","192.168.56.102","SSHv2","126","Server: Encrypted packet (len=60)","22","60348"
"126","1594608908.635732022","192.168.56.101","192.168.56.102","SSHv2","102","Server: Encrypted packet (len=36)","22","60348"
"127","1594608908.636162601","192.168.56.101","192.168.56.102","SSHv2","126","Server: Encrypted packet (len=60)","22","60348"
"128","1594608908.636485533","192.168.56.102","192.168.56.101","TCP","66","60348  >  22 [ACK] Seq=2798 Ack=4713 Win=38272 Len=0 TSval=2063615 TSecr=2064206","60348","22"
"129","1594608916.412156621","192.168.56.102","192.168.56.101","SSHv2","102","Client: Encrypted packet (len=36)","60348","22"
"130","1594608916.412479144","192.168.56.101","192.168.56.102","SSHv2","102","Server: Encrypted packet (len=36)","22","60348"
"131","1594608916.412632670","192.168.56.102","192.168.56.101","TCP","66","60348  >  22 [ACK] Seq=2834 Ack=4749 Win=38272 Len=0 TSval=2065559 TSecr=2066151","60348","22"
"132","1594608916.512161041","192.168.56.102","192.168.56.101","SSHv2","102","Client: Encrypted packet (len=36)","60348","22"
"133","1594608916.512704420","192.168.56.101","192.168.56.102","SSHv2","102","Server: Encrypted packet (len=36)","22","60348"
"134","1594608916.512882340","192.168.56.102","192.168.56.101","TCP","66","60348  >  22 [ACK] Seq=2870 Ack=4785 Win=38272 Len=0 TSval=2065584 TSecr=2066176","60348","22"
"135","1594608916.692081765","192.168.56.102","192.168.56.101","SSHv2","102","Client: Encrypted packet (len=36)","60348","22"
"136","1594608916.692385221","192.168.56.101","192.168.56.102","SSHv2","102","Server: Encrypted packet (len=36)","22","60348"
"137","1594608916.692462429","192.168.56.102","192.168.56.101","TCP","66","60348  >  22 [ACK] Seq=2906 Ack=4821 Win=38272 Len=0 TSval=2065629 TSecr=2066221","60348","22"
"138","1594608917.532228766","192.168.56.102","192.168.56.101","SSHv2","102","Client: Encrypted packet (len=36)","60348","22"
"139","1594608917.532609974","192.168.56.101","192.168.56.102","SSHv2","102","Server: Encrypted packet (len=36)","22","60348"
"140","1594608917.532789248","192.168.56.102","192.168.56.101","TCP","66","60348  >  22 [ACK] Seq=2942 Ack=4857 Win=38272 Len=0 TSval=2065839 TSecr=2066431","60348","22"
"141","1594608917.997376128","192.168.56.102","192.168.56.100","DHCP","342","DHCP Request  - Transaction ID 0xb97ed617","68","67"
"142","1594608918.015879649","192.168.56.100","192.168.56.102","DHCP","590","DHCP ACK      - Transaction ID 0xb97ed617","67","68"
"143","1594608918.172407000","192.168.56.102","192.168.56.101","SSHv2","102","Client: Encrypted packet (len=36)","60348","22"
"144","1594608918.172730729","192.168.56.101","192.168.56.102","SSHv2","102","Server: Encrypted packet (len=36)","22","60348"
"145","1594608918.172894359","192.168.56.102","192.168.56.101","TCP","66","60348  >  22 [ACK] Seq=2978 Ack=4893 Win=38272 Len=0 TSval=2065999 TSecr=2066591","60348","22"
"146","1594608918.872265841","192.168.56.102","192.168.56.101","SSHv2","102","Client: Encrypted packet (len=36)","60348","22"
"147","1594608918.872579962","192.168.56.101","192.168.56.102","SSHv2","110","Server: Encrypted packet (len=44)","22","60348"
"148","1594608918.872775992","192.168.56.102","192.168.56.101","TCP","66","60348  >  22 [ACK] Seq=3014 Ack=4937 Win=38272 Len=0 TSval=2066174 TSecr=2066766","60348","22"
"149","1594608919.352215836","192.168.56.102","192.168.56.101","SSHv2","102","Client: Encrypted packet (len=36)","60348","22"
"150","1594608919.352730320","192.168.56.101","192.168.56.102","SSHv2","102","Server: Encrypted packet (len=36)","22","60348"
"151","1594608919.352941471","192.168.56.102","192.168.56.101","TCP","66","60348  >  22 [ACK] Seq=3050 Ack=4973 Win=38272 Len=0 TSval=2066295 TSecr=2066886","60348","22"
"152","1594608919.732845621","192.168.56.102","192.168.56.101","SSHv2","102","Client: Encrypted packet (len=36)","60348","22"
"153","1594608919.733257472","192.168.56.101","192.168.56.102","SSHv2","102","Server: Encrypted packet (len=36)","22","60348"
"154","1594608919.733419585","192.168.56.102","192.168.56.101","TCP","66","60348  >  22 [ACK] Seq=3086 Ack=5009 Win=38272 Len=0 TSval=2066390 TSecr=2066981","60348","22"
"155","1594608919.733653425","192.168.56.101","192.168.56.102","SSHv2","126","Server: Encrypted packet (len=60)","22","60348"
"156","1594608919.733834300","192.168.56.102","192.168.56.101","TCP","66","60348  >  22 [ACK] Seq=3086 Ack=5069 Win=38272 Len=0 TSval=2066390 TSecr=2066981","60348","22"
"157","1594608923.005273501","PcsCompu_af:7b:18","PcsCompu_77:ba:13","ARP","60","Who has 192.168.56.100? Tell 192.168.56.102","",""
"158","1594608923.005280976","PcsCompu_77:ba:13","PcsCompu_af:7b:18","ARP","60","192.168.56.100 is at 08:00:27:77:ba:13","",""
"159","1594608926.952489626","192.168.56.102","192.168.56.101","SSHv2","102","Client: Encrypted packet (len=36)","60348","22"
"160","1594608926.952816621","192.168.56.101","192.168.56.102","SSHv2","102","Server: Encrypted packet (len=36)","22","60348"
"161","1594608926.953015371","192.168.56.102","192.168.56.101","TCP","66","60348  >  22 [ACK] Seq=3122 Ack=5105 Win=38272 Len=0 TSval=2068195 TSecr=2068786","60348","22"
"162","1594608927.072296638","192.168.56.102","192.168.56.101","SSHv2","102","Client: Encrypted packet (len=36)","60348","22"
"163","1594608927.072564889","192.168.56.101","192.168.56.102","SSHv2","102","Server: Encrypted packet (len=36)","22","60348"
"164","1594608927.072674015","192.168.56.102","192.168.56.101","TCP","66","60348  >  22 [ACK] Seq=3158 Ack=5141 Win=38272 Len=0 TSval=2068224 TSecr=2068816","60348","22"
"165","1594608927.082934572","192.168.56.104","192.168.56.100","DHCP","342","DHCP Request  - Transaction ID 0x1e8caf0b","68","67"
"166","1594608927.123053633","192.168.56.100","192.168.56.104","DHCP","590","DHCP ACK      - Transaction ID 0x1e8caf0b","67","68"
"167","1594608927.452121333","192.168.56.102","192.168.56.101","SSHv2","102","Client: Encrypted packet (len=36)","60348","22"
"168","1594608927.452514658","192.168.56.101","192.168.56.102","SSHv2","102","Server: Encrypted packet (len=36)","22","60348"
"169","1594608927.452633439","192.168.56.102","192.168.56.101","TCP","66","60348  >  22 [ACK] Seq=3194 Ack=5177 Win=38272 Len=0 TSval=2068319 TSecr=2068911","60348","22"
"170","1594608927.602222485","192.168.56.102","192.168.56.101","SSHv2","102","Client: Encrypted packet (len=36)","60348","22"
"171","1594608927.602609738","192.168.56.101","192.168.56.102","SSHv2","102","Server: Encrypted packet (len=36)","22","60348"
"172","1594608927.602833909","192.168.56.102","192.168.56.101","TCP","66","60348  >  22 [ACK] Seq=3230 Ack=5213 Win=38272 Len=0 TSval=2068357 TSecr=2068948","60348","22"
"173","1594608928.222165583","192.168.56.102","192.168.56.101","SSHv2","102","Client: Encrypted packet (len=36)","60348","22"
"174","1594608928.222592589","192.168.56.101","192.168.56.102","SSHv2","110","Server: Encrypted packet (len=44)","22","60348"
"175","1594608928.223158611","192.168.56.102","192.168.56.101","TCP","66","60348  >  22 [ACK] Seq=3266 Ack=5257 Win=38272 Len=0 TSval=2068512 TSecr=2069103","60348","22"
"176","1594608928.432098003","192.168.56.102","192.168.56.101","SSHv2","102","Client: Encrypted packet (len=36)","60348","22"
"177","1594608928.432493780","192.168.56.101","192.168.56.102","SSHv2","110","Server: Encrypted packet (len=44)","22","60348"
"178","1594608928.432673746","192.168.56.102","192.168.56.101","TCP","66","60348  >  22 [ACK] Seq=3302 Ack=5301 Win=38272 Len=0 TSval=2068564 TSecr=2069156","60348","22"
"179","1594608928.642075783","192.168.56.102","192.168.56.101","SSHv2","102","Client: Encrypted packet (len=36)","60348","22"
"180","1594608928.642422831","192.168.56.101","192.168.56.102","SSHv2","102","Server: Encrypted packet (len=36)","22","60348"
"181","1594608928.642544972","192.168.56.102","192.168.56.101","TCP","66","60348  >  22 [ACK] Seq=3338 Ack=5337 Win=38272 Len=0 TSval=2068617 TSecr=2069208","60348","22"
"182","1594608929.222020224","192.168.56.102","192.168.56.101","SSHv2","102","Client: Encrypted packet (len=36)","60348","22"
"183","1594608929.222406045","192.168.56.101","192.168.56.102","SSHv2","102","Server: Encrypted packet (len=36)","22","60348"
"184","1594608929.222487508","192.168.56.102","192.168.56.101","TCP","66","60348  >  22 [ACK] Seq=3374 Ack=5373 Win=38272 Len=0 TSval=2068762 TSecr=2069353","60348","22"
"185","1594608929.372148699","192.168.56.102","192.168.56.101","SSHv2","102","Client: Encrypted packet (len=36)","60348","22"
"186","1594608929.372467128","192.168.56.101","192.168.56.102","SSHv2","102","Server: Encrypted packet (len=36)","22","60348"
"187","1594608929.372691080","192.168.56.102","192.168.56.101","TCP","66","60348  >  22 [ACK] Seq=3410 Ack=5409 Win=38272 Len=0 TSval=2068799 TSecr=2069391","60348","22"
"188","1594608929.592104113","192.168.56.102","192.168.56.101","SSHv2","102","Client: Encrypted packet (len=36)","60348","22"
"189","1594608929.592425874","192.168.56.101","192.168.56.102","SSHv2","102","Server: Encrypted packet (len=36)","22","60348"
"190","1594608929.592619261","192.168.56.102","192.168.56.101","TCP","66","60348  >  22 [ACK] Seq=3446 Ack=5445 Win=38272 Len=0 TSval=2068854 TSecr=2069446","60348","22"
"191","1594608929.932122380","192.168.56.102","192.168.56.101","SSHv2","102","Client: Encrypted packet (len=36)","60348","22"
"192","1594608929.932568888","192.168.56.101","192.168.56.102","SSHv2","126","Server: Encrypted packet (len=60)","22","60348"
"193","1594608929.932715015","192.168.56.102","192.168.56.101","TCP","66","60348  >  22 [ACK] Seq=3482 Ack=5505 Win=38272 Len=0 TSval=2068939 TSecr=2069531","60348","22"
"194","1594608932.095575927","PcsCompu_6c:9b:66","PcsCompu_77:ba:13","ARP","60","Who has 192.168.56.100? Tell 192.168.56.104","",""
"195","1594608932.095752778","PcsCompu_77:ba:13","PcsCompu_6c:9b:66","ARP","60","192.168.56.100 is at 08:00:27:77:ba:13","",""
"196","1594608932.741994938","192.168.56.102","192.168.56.101","SSHv2","102","Client: Encrypted packet (len=36)","60348","22"
"197","1594608932.742324939","192.168.56.101","192.168.56.102","SSHv2","102","Server: Encrypted packet (len=36)","22","60348"
"198","1594608932.742466807","192.168.56.102","192.168.56.101","TCP","66","60348  >  22 [ACK] Seq=3518 Ack=5541 Win=38272 Len=0 TSval=2069642 TSecr=2070233","60348","22"
"199","1594608932.982169473","192.168.56.102","192.168.56.101","SSHv2","102","Client: Encrypted packet (len=36)","60348","22"
"200","1594608932.982640693","192.168.56.101","192.168.56.102","SSHv2","102","Server: Encrypted packet (len=36)","22","60348"
"201","1594608932.983021045","192.168.56.102","192.168.56.101","TCP","66","60348  >  22 [ACK] Seq=3554 Ack=5577 Win=38272 Len=0 TSval=2069702 TSecr=2070293","60348","22"
"202","1594608933.152000560","192.168.56.102","192.168.56.101","SSHv2","102","Client: Encrypted packet (len=36)","60348","22"
"203","1594608933.152306174","192.168.56.101","192.168.56.102","SSHv2","102","Server: Encrypted packet (len=36)","22","60348"
"204","1594608933.152413555","192.168.56.102","192.168.56.101","TCP","66","60348  >  22 [ACK] Seq=3590 Ack=5613 Win=38272 Len=0 TSval=2069744 TSecr=2070336","60348","22"
"205","1594608933.312103007","192.168.56.102","192.168.56.101","SSHv2","102","Client: Encrypted packet (len=36)","60348","22"
"206","1594608933.312440341","192.168.56.101","192.168.56.102","SSHv2","102","Server: Encrypted packet (len=36)","22","60348"
"207","1594608933.312579551","192.168.56.102","192.168.56.101","TCP","66","60348  >  22 [ACK] Seq=3626 Ack=5649 Win=38272 Len=0 TSval=2069784 TSecr=2070376","60348","22"
"208","1594608933.391968552","192.168.56.102","192.168.56.101","SSHv2","102","Client: Encrypted packet (len=36)","60348","22"
"209","1594608933.392276645","192.168.56.101","192.168.56.102","SSHv2","102","Server: Encrypted packet (len=36)","22","60348"
"210","1594608933.392400354","192.168.56.102","192.168.56.101","TCP","66","60348  >  22 [ACK] Seq=3662 Ack=5685 Win=38272 Len=0 TSval=2069804 TSecr=2070396","60348","22"
"211","1594608933.482175062","192.168.56.102","192.168.56.101","SSHv2","102","Client: Encrypted packet (len=36)","60348","22"
"212","1594608933.482680222","192.168.56.101","192.168.56.102","SSHv2","102","Server: Encrypted packet (len=36)","22","60348"
"213","1594608933.482764051","192.168.56.102","192.168.56.101","TCP","66","60348  >  22 [ACK] Seq=3698 Ack=5721 Win=38272 Len=0 TSval=2069827 TSecr=2070418","60348","22"
"214","1594608934.302123546","192.168.56.102","192.168.56.101","SSHv2","102","Client: Encrypted packet (len=36)","60348","22"
"215","1594608934.304066601","192.168.56.101","192.168.56.102","SSHv2","206","Server: Encrypted packet (len=140)","22","60348"
"216","1594608934.304209515","192.168.56.101","192.168.56.102","SSHv2","138","Server: Encrypted packet (len=72)","22","60348"
"217","1594608934.304212659","192.168.56.102","192.168.56.101","TCP","66","60348  >  22 [ACK] Seq=3734 Ack=5861 Win=41216 Len=0 TSval=2070032 TSecr=2070623","60348","22"
"218","1594608934.304363390","192.168.56.102","192.168.56.101","TCP","66","60348  >  22 [ACK] Seq=3734 Ack=5933 Win=41216 Len=0 TSval=2070032 TSecr=2070624","60348","22"
"219","1594608934.304867999","192.168.56.102","192.168.56.101","SSHv2","102","Client: Encrypted packet (len=36)","60348","22"
"220","1594608934.304981855","192.168.56.102","192.168.56.101","SSHv2","126","Client: Encrypted packet (len=60)","60348","22"
"221","1594608934.305155492","192.168.56.101","192.168.56.102","TCP","66","22  >  60348 [ACK] Seq=5933 Ack=3830 Win=37248 Len=0 TSval=2070624 TSecr=2070033","22","60348"
"222","1594608934.305489685","192.168.56.102","192.168.56.101","TCP","66","60348  >  22 [FIN, ACK] Seq=3830 Ack=5933 Win=41216 Len=0 TSval=2070033 TSecr=2070624","60348","22"
"223","1594608934.307430060","192.168.56.101","192.168.56.102","TCP","66","22  >  60348 [FIN, ACK] Seq=5933 Ack=3831 Win=37248 Len=0 TSval=2070624 TSecr=2070033","22","60348"
"224","1594608934.307564160","192.168.56.102","192.168.56.101","TCP","66","60348  >  22 [ACK] Seq=3831 Ack=5934 Win=41216 Len=0 TSval=2070033 TSecr=2070624","60348","22"
"225","1594608955.992470373","192.168.56.104","192.168.56.101","TCP","74","49874  >  445 [SYN] Seq=0 Win=29200 Len=0 MSS=1460 SACK_PERM=1 TSval=2076946 TSecr=0 WS=128","49874","445"
"226","1594608955.992562843","192.168.56.101","192.168.56.104","TCP","74","445  >  49874 [SYN, ACK] Seq=0 Ack=1 Win=28960 Len=0 MSS=1460 SACK_PERM=1 TSval=2076046 TSecr=2076946 WS=128","445","49874"
"227","1594608955.992760556","192.168.56.104","192.168.56.101","TCP","66","49874  >  445 [ACK] Seq=1 Ack=1 Win=29312 Len=0 TSval=2076946 TSecr=2076046","49874","445"
"228","1594608955.992941772","192.168.56.104","192.168.56.101","SMB","260","Negotiate Protocol Request","49874","445"
"229","1594608955.993035237","192.168.56.101","192.168.56.104","TCP","66","445  >  49874 [ACK] Seq=1 Ack=195 Win=30080 Len=0 TSval=2076046 TSecr=2076946","445","49874"
"230","1594608955.996428060","192.168.56.101","192.168.56.104","SMB","229","Negotiate Protocol Response","445","49874"
"231","1594608955.996612293","192.168.56.104","192.168.56.101","TCP","66","49874  >  445 [ACK] Seq=195 Ack=164 Win=30336 Len=0 TSval=2076947 TSecr=2076047","49874","445"
"232","1594608955.999034172","192.168.56.104","192.168.56.101","SMB","226","Session Setup AndX Request, NTLMSSP_NEGOTIATE","49874","445"
"233","1594608955.999628459","192.168.56.101","192.168.56.104","SMB","382","Session Setup AndX Response, NTLMSSP_CHALLENGE, Error: STATUS_MORE_PROCESSING_REQUIRED","445","49874"
"234","1594608956.000038291","192.168.56.104","192.168.56.101","SMB","606","Session Setup AndX Request, NTLMSSP_AUTH, User: WORKGROUP\\isot","49874","445"
"235","1594608956.001378050","192.168.56.101","192.168.56.104","SMB","206","Session Setup AndX Response","445","49874"
"236","1594608956.002145370","192.168.56.104","192.168.56.101","SMB","162","Tree Connect AndX Request, Path: \\\\192.168.56.101\\IPC$","49874","445"
"237","1594608956.002835672","192.168.56.101","192.168.56.104","SMB","126","Tree Connect AndX Response","445","49874"
"238","1594608956.003083936","192.168.56.104","192.168.56.101","SMB","186","Trans2 Request, GET_DFS_REFERRAL, File: \\192.168.56.101\\files","49874","445"
"239","1594608956.003434564","192.168.56.101","192.168.56.104","SMB","105","Trans2 Response, GET_DFS_REFERRAL, Error: STATUS_NOT_FOUND","445","49874"
"240","1594608956.003736908","192.168.56.104","192.168.56.101","SMB","105","Tree Disconnect Request","49874","445"
"241","1594608956.004079181","192.168.56.101","192.168.56.104","SMB","105","Tree Disconnect Response","445","49874"
"242","1594608956.004393083","192.168.56.104","192.168.56.101","SMB","166","Tree Connect AndX Request, Path: \\\\192.168.56.101\\FILES","49874","445"
"243","1594608956.004882295","192.168.56.101","192.168.56.104","SMB","132","Tree Connect AndX Response","445","49874"
"244","1594608956.043249992","192.168.56.104","192.168.56.101","TCP","66","49874  >  445 [ACK] Seq=1250 Ack=824 Win=32512 Len=0 TSval=2076959 TSecr=2076049","49874","445"
"245","1594608956.105829851","192.168.56.104","192.168.56.101","SMB","123","Echo Request","49874","445"
"246","1594608956.106308439","192.168.56.101","192.168.56.104","SMB","123","Echo Response","445","49874"
"247","1594608956.106505884","192.168.56.104","192.168.56.101","TCP","66","49874  >  445 [ACK] Seq=1307 Ack=881 Win=32512 Len=0 TSval=2076974 TSecr=2076074","49874","445"
"248","1594608958.532779315","192.168.56.104","192.168.56.101","SMB","158","Trans2 Request, FIND_FIRST2, Pattern: \\*","49874","445"
"249","1594608958.533771737","192.168.56.101","192.168.56.104","SMB","1730","Trans2 Response, FIND_FIRST2, Files: . .. create_postfix_mysql_tables.sql vsftpd-2.3.4 openssl-1.0.1f blfs-bootscripts-20140919 samba-3.5.0.tar.gz proftpd-basic_1.3.5~rc3-2.1ubuntu2.1_amd64.deb proftpd-1.3.5 proftpd-1.3.5.tar.gz samba-3.5.0 blfs-bootscripts-20140919.tar.bz2","445","49874"
"250","1594608958.533926604","192.168.56.104","192.168.56.101","TCP","66","49874  >  445 [ACK] Seq=1399 Ack=2545 Win=35840 Len=0 TSval=2077581 TSecr=2076681","49874","445"
"251","1594608958.539749769","192.168.56.104","192.168.56.101","SMB","142","Trans2 Request, QUERY_FS_INFO, Query Full FS Size Info","49874","445"
"252","1594608958.540176842","192.168.56.101","192.168.56.104","SMB","158","Trans2 Response, QUERY_FS_INFO","445","49874"
"253","1594608958.579377639","192.168.56.104","192.168.56.101","TCP","66","49874  >  445 [ACK] Seq=1475 Ack=2637 Win=35840 Len=0 TSval=2077593 TSecr=2076683","49874","445"
"254","1594608960.251138564","192.168.56.104","192.168.56.101","SMB","123","Echo Request","49874","445"
"255","1594608960.251404878","192.168.56.101","192.168.56.104","SMB","123","Echo Response","445","49874"
"256","1594608960.251654150","192.168.56.104","192.168.56.101","TCP","66","49874  >  445 [ACK] Seq=1532 Ack=2694 Win=35840 Len=0 TSval=2078011 TSecr=2077110","49874","445"
"257","1594608965.073147091","192.168.56.101","192.168.56.100","DHCP","342","DHCP Request  - Transaction ID 0x677ae649","68","67"
"258","1594608965.172052005","192.168.56.100","192.168.56.101","DHCP","590","DHCP ACK      - Transaction ID 0x677ae649","67","68"
"259","1594608965.270212760","192.168.56.104","192.168.56.101","SMB","123","Echo Request","49874","445"
"260","1594608965.270518977","192.168.56.101","192.168.56.104","SMB","123","Echo Response","445","49874"
"261","1594608965.270734552","192.168.56.104","192.168.56.101","TCP","66","49874  >  445 [ACK] Seq=1589 Ack=2751 Win=35840 Len=0 TSval=2079265 TSecr=2078365","49874","445"
"262","1594608969.512410444","192.168.56.104","192.168.56.101","SMB","105","Tree Disconnect Request","49874","445"
"263","1594608969.512808682","192.168.56.101","192.168.56.104","SMB","105","Tree Disconnect Response","445","49874"
"264","1594608969.512994127","192.168.56.104","192.168.56.101","TCP","66","49874  >  445 [ACK] Seq=1628 Ack=2790 Win=35840 Len=0 TSval=2080326 TSecr=2079426","49874","445"
"265","1594608969.513159649","192.168.56.104","192.168.56.101","TCP","66","49874  >  445 [FIN, ACK] Seq=1628 Ack=2790 Win=35840 Len=0 TSval=2080326 TSecr=2079426","49874","445"
"266","1594608969.518811287","192.168.56.101","192.168.56.104","TCP","66","445  >  49874 [FIN, ACK] Seq=2790 Ack=1629 Win=32256 Len=0 TSval=2079427 TSecr=2080326","445","49874"
"267","1594608969.519025338","192.168.56.104","192.168.56.101","TCP","66","49874  >  445 [ACK] Seq=1629 Ack=2791 Win=35840 Len=0 TSval=2080328 TSecr=2079427","49874","445"
"268","1594608970.082899222","PcsCompu_ae:93:92","PcsCompu_77:ba:13","ARP","60","Who has 192.168.56.100? Tell 192.168.56.101","",""
"269","1594608970.082905568","PcsCompu_77:ba:13","PcsCompu_ae:93:92","ARP","60","192.168.56.100 is at 08:00:27:77:ba:13","",""
"270","1594608988.718815038","192.168.56.106","192.168.56.100","DHCP","342","DHCP Request  - Transaction ID 0x6a5c2f58","68","67"
"271","1594608988.731883584","192.168.56.100","192.168.56.106","DHCP","590","DHCP ACK      - Transaction ID 0x6a5c2f58","67","68"
"272","1594608993.731937129","PcsCompu_93:e0:ab","PcsCompu_77:ba:13","ARP","60","Who has 192.168.56.100? Tell 192.168.56.106","",""
"273","1594608993.731943516","PcsCompu_77:ba:13","PcsCompu_93:e0:ab","ARP","60","192.168.56.100 is at 08:00:27:77:ba:13","",""
"274","1594609014.659027740","192.168.56.106","192.168.56.104","TCP","74","58976  >  80 [SYN] Seq=0 Win=29200 Len=0 MSS=1460 SACK_PERM=1 TSval=827506 TSecr=0 WS=128","58976","80"
"275","1594609014.659159257","192.168.56.104","192.168.56.106","TCP","74","80  >  58976 [SYN, ACK] Seq=0 Ack=1 Win=28960 Len=0 MSS=1460 SACK_PERM=1 TSval=2091613 TSecr=827506 WS=128","80","58976"
"276","1594609014.659284805","192.168.56.106","192.168.56.104","TCP","66","58976  >  80 [ACK] Seq=1 Ack=1 Win=29312 Len=0 TSval=827506 TSecr=2091613","58976","80"
"277","1594609014.659479768","192.168.56.106","192.168.56.104","HTTP","386","GET / HTTP/1.1 ","58976","80"
"278","1594609014.659561687","192.168.56.104","192.168.56.106","TCP","66","80  >  58976 [ACK] Seq=1 Ack=321 Win=30080 Len=0 TSval=2091613 TSecr=827506","80","58976"
"279","1594609014.665770366","192.168.56.104","192.168.56.106","HTTP","3252","HTTP/1.1 200 OK  (text/html)","80","58976"
