"No.","Time","Source","Destination","Protocol","Length","Info","Source Port","Dest Port"
"1","1595011927.678","192.168.56.104","192.168.56.100","DHCP","342","DHCP Request  - Transaction ID 0xb92d511f","68","67"
"2","1595011927.721","192.168.56.100","192.168.56.104","DHCP","590","DHCP ACK      - Transaction ID 0xb92d511f","67","68"
"3","1595011932.689","PcsCompu_6c:9b:66","PcsCompu_b7:12:b1","ARP","60","Who has 192.168.56.100? Tell 192.168.56.104","",""
"4","1595011932.689","PcsCompu_b7:12:b1","PcsCompu_6c:9b:66","ARP","60","192.168.56.100 is at 08:00:27:b7:12:b1","",""
"5","1595011948.030","PcsCompu_74:73:8a","Broadcast","ARP","42","Who has 192.168.56.104? Tell 192.168.56.105","",""
"6","1595011948.030","PcsCompu_6c:9b:66","PcsCompu_74:73:8a","ARP","60","192.168.56.104 is at 08:00:27:6c:9b:66","",""
"7","1595011948.030","192.168.56.105","192.168.56.104","TCP","74","46730  >  80 [SYN] Seq=0 Win=64240 Len=0 MSS=1460 SACK_PERM=1 TSval=4192438763 TSecr=0 WS=128","46730","80"
"8","1595011948.031","192.168.56.104","192.168.56.105","TCP","74","80  >  46730 [SYN, ACK] Seq=0 Ack=1 Win=28960 Len=0 MSS=1460 SACK_PERM=1 TSval=369663 TSecr=4192438763 WS=128","80","46730"
"9","1595011948.031","192.168.56.105","192.168.56.104","TCP","66","46730  >  80 [ACK] Seq=1 Ack=1 Win=64256 Len=0 TSval=4192438764 TSecr=369663","46730","80"
"10","1595011948.031","192.168.56.105","192.168.56.104","HTTP","380","GET / HTTP/1.1 ","46730","80"
"11","1595011948.031","192.168.56.104","192.168.56.105","TCP","66","80  >  46730 [ACK] Seq=1 Ack=315 Win=30080 Len=0 TSval=369663 TSecr=4192438764","80","46730"
"12","1595011948.528","192.168.56.104","192.168.56.105","HTTP","3252","HTTP/1.1 200 OK  (text/html)","80","46730"
"13","1595011948.528","192.168.56.105","192.168.56.104","TCP","66","46730  >  80 [ACK] Seq=315 Ack=3187 Win=62592 Len=0 TSval=4192439262 TSecr=369788","46730","80"
"14","1595011948.589","192.168.56.105","192.168.56.104","HTTP","361","GET /content/css/loading.css HTTP/1.1 ","46730","80"
"15","1595011948.590","192.168.56.104","192.168.56.105","TCP","66","80  >  46730 [ACK] Seq=3187 Ack=610 Win=31104 Len=0 TSval=369803 TSecr=4192439323","80","46730"
"16","1595011948.590","192.168.56.105","192.168.56.104","TCP","74","46736  >  80 [SYN] Seq=0 Win=64240 Len=0 MSS=1460 SACK_PERM=1 TSval=4192439323 TSecr=0 WS=128","46736","80"
"17","1595011948.590","192.168.56.104","192.168.56.105","TCP","74","80  >  46736 [SYN, ACK] Seq=0 Ack=1 Win=28960 Len=0 MSS=1460 SACK_PERM=1 TSval=369803 TSecr=4192439323 WS=128","80","46736"
"18","1595011948.590","192.168.56.105","192.168.56.104","TCP","66","46736  >  80 [ACK] Seq=1 Ack=1 Win=64256 Len=0 TSval=4192439324 TSecr=369803","46736","80"
"19","1595011948.590","192.168.56.105","192.168.56.104","TCP","74","46738  >  80 [SYN] Seq=0 Win=64240 Len=0 MSS=1460 SACK_PERM=1 TSval=4192439324 TSecr=0 WS=128","46738","80"
"20","1595011948.590","192.168.56.105","192.168.56.104","HTTP","378","GET /content/vendors.2217590b5cc5d0b62058.css HTTP/1.1 ","46736","80"
"21","1595011948.591","192.168.56.104","192.168.56.105","TCP","74","80  >  46738 [SYN, ACK] Seq=0 Ack=1 Win=28960 Len=0 MSS=1460 SACK_PERM=1 TSval=369803 TSecr=4192439324 WS=128","80","46738"
"22","1595011948.591","192.168.56.105","192.168.56.104","TCP","66","46738  >  80 [ACK] Seq=1 Ack=1 Win=64256 Len=0 TSval=4192439324 TSecr=369803","46738","80"
"23","1595011948.591","192.168.56.104","192.168.56.105","TCP","66","80  >  46736 [ACK] Seq=1 Ack=313 Win=30080 Len=0 TSval=369803 TSecr=4192439324","80","46736"
"24","1595011948.591","192.168.56.105","192.168.56.104","HTTP","375","GET /content/main.2217590b5cc5d0b62058.css HTTP/1.1 ","46738","80"
"25","1595011948.591","192.168.56.104","192.168.56.105","TCP","66","80  >  46738 [ACK] Seq=1 Ack=310 Win=30080 Len=0 TSval=369803 TSecr=4192439324","80","46738"
"26","1595011948.591","192.168.56.105","192.168.56.104","TCP","74","46740  >  80 [SYN] Seq=0 Win=64240 Len=0 MSS=1460 SACK_PERM=1 TSval=4192439325 TSecr=0 WS=128","46740","80"
"27","1595011948.592","192.168.56.104","192.168.56.105","TCP","74","80  >  46740 [SYN, ACK] Seq=0 Ack=1 Win=28960 Len=0 MSS=1460 SACK_PERM=1 TSval=369803 TSecr=4192439325 WS=128","80","46740"
"28","1595011948.592","192.168.56.105","192.168.56.104","TCP","66","46740  >  80 [ACK] Seq=1 Ack=1 Win=64256 Len=0 TSval=4192439325 TSecr=369803","46740","80"
"29","1595011948.592","192.168.56.105","192.168.56.104","HTTP","362","GET /app/main.2217590b5cc5d0b62058.bundle.js HTTP/1.1 ","46740","80"
"30","1595011948.592","192.168.56.104","192.168.56.105","TCP","66","80  >  46740 [ACK] Seq=1 Ack=297 Win=30080 Len=0 TSval=369804 TSecr=4192439325","80","46740"
"31","1595011948.594","192.168.56.105","192.168.56.104","TCP","66","46730  >  80 [FIN, ACK] Seq=610 Ack=3187 Win=64128 Len=0 TSval=4192439328 TSecr=369803","46730","80"
"32","1595011948.594","192.168.56.105","192.168.56.104","TCP","66","46736  >  80 [FIN, ACK] Seq=313 Ack=1 Win=64256 Len=0 TSval=4192439328 TSecr=369803","46736","80"
"33","1595011948.595","192.168.56.105","192.168.56.104","TCP","66","46738  >  80 [FIN, ACK] Seq=310 Ack=1 Win=64256 Len=0 TSval=4192439329 TSecr=369803","46738","80"
"34","1595011948.596","192.168.56.105","192.168.56.104","TCP","66","46740  >  80 [FIN, ACK] Seq=297 Ack=1 Win=64256 Len=0 TSval=4192439330 TSecr=369804","46740","80"
"35","1595011948.632","192.168.56.104","192.168.56.105","TCP","66","80  >  46738 [ACK] Seq=1 Ack=311 Win=30080 Len=0 TSval=369814 TSecr=4192439329","80","46738"
"36","1595011948.632","192.168.56.104","192.168.56.105","TCP","66","80  >  46736 [ACK] Seq=1 Ack=314 Win=30080 Len=0 TSval=369814 TSecr=4192439328","80","46736"
"37","1595011948.632","192.168.56.104","192.168.56.105","TCP","66","80  >  46730 [ACK] Seq=3187 Ack=611 Win=31104 Len=0 TSval=369814 TSecr=4192439328","80","46730"
"38","1595011948.637","192.168.56.104","192.168.56.105","TCP","66","80  >  46740 [ACK] Seq=1 Ack=298 Win=30080 Len=0 TSval=369815 TSecr=4192439330","80","46740"
"39","1595011948.648","192.168.56.104","192.168.56.105","HTTP","1099","HTTP/1.1 200 OK  (text/css)","80","46730"
"40","1595011948.649","192.168.56.105","192.168.56.104","TCP","54","46730  >  80 [RST] Seq=611 Win=0 Len=0","46730","80"
"41","1595011948.650","192.168.56.104","192.168.56.105","HTTP","2175","HTTP/1.1 200 OK  (text/css)","80","46736"
"42","1595011948.650","192.168.56.105","192.168.56.104","TCP","54","46736  >  80 [RST] Seq=314 Win=0 Len=0","46736","80"
"43","1595011948.666","192.168.56.105","192.168.56.104","TCP","74","46742  >  80 [SYN] Seq=0 Win=64240 Len=0 MSS=1460 SACK_PERM=1 TSval=4192439399 TSecr=0 WS=128","46742","80"
"44","1595011948.666","192.168.56.104","192.168.56.105","TCP","74","80  >  46742 [SYN, ACK] Seq=0 Ack=1 Win=28960 Len=0 MSS=1460 SACK_PERM=1 TSval=369822 TSecr=4192439399 WS=128","80","46742"
"45","1595011948.666","192.168.56.105","192.168.56.104","TCP","66","46742  >  80 [ACK] Seq=1 Ack=1 Win=64256 Len=0 TSval=4192439400 TSecr=369822","46742","80"
"46","1595011948.667","192.168.56.105","192.168.56.104","HTTP","389","GET /content/images/logo-jhipster.png HTTP/1.1 ","46742","80"
"47","1595011948.667","192.168.56.104","192.168.56.105","TCP","66","80  >  46742 [ACK] Seq=1 Ack=324 Win=30080 Len=0 TSval=369822 TSecr=4192439400","80","46742"
"48","1595011948.668","192.168.56.105","192.168.56.104","TCP","66","46742  >  80 [FIN, ACK] Seq=324 Ack=1 Win=64256 Len=0 TSval=4192439401 TSecr=369822","46742","80"
"49","1595011948.708","192.168.56.104","192.168.56.105","TCP","66","80  >  46742 [ACK] Seq=1 Ack=325 Win=30080 Len=0 TSval=369833 TSecr=4192439401","80","46742"
"50","1595011948.745","192.168.56.104","192.168.56.105","TCP","7306","80  >  46740 [ACK] Seq=1 Ack=298 Win=30080 Len=7240 TSval=369842 TSecr=4192439330 [TCP segment of a reassembled PDU]","80","46740"
"51","1595011948.745","192.168.56.105","192.168.56.104","TCP","54","46740  >  80 [RST] Seq=298 Win=0 Len=0","46740","80"
"52","1595011948.745","192.168.56.104","192.168.56.105","TCP","7306","HTTP/1.1 200 OK  [TCP segment of a reassembled PDU]","80","46740"
"53","1595011948.745","192.168.56.105","192.168.56.104","TCP","54","46740  >  80 [RST] Seq=298 Win=0 Len=0","46740","80"
"54","1595011948.754","192.168.56.104","192.168.56.105","TCP","14546","80  >  46742 [ACK] Seq=1 Ack=325 Win=30080 Len=14480 TSval=369844 TSecr=4192439401 [TCP segment of a reassembled PDU]","80","46742"
"55","1595011948.754","192.168.56.105","192.168.56.104","TCP","54","46742  >  80 [RST] Seq=325 Win=0 Len=0","46742","80"
"56","1595011948.757","192.168.56.104","192.168.56.105","TCP","14546","80  >  46738 [ACK] Seq=1 Ack=311 Win=30080 Len=14480 TSval=369845 TSecr=4192439329 [TCP segment of a reassembled PDU]","80","46738"
"57","1595011948.757","192.168.56.105","192.168.56.104","TCP","54","46738  >  80 [RST] Seq=311 Win=0 Len=0","46738","80"
"58","1595011949.101","192.168.56.105","192.168.56.104","TCP","74","46744  >  80 [SYN] Seq=0 Win=64240 Len=0 MSS=1460 SACK_PERM=1 TSval=4192439835 TSecr=0 WS=128","46744","80"
"59","1595011949.102","192.168.56.104","192.168.56.105","TCP","74","80  >  46744 [SYN, ACK] Seq=0 Ack=1 Win=28960 Len=0 MSS=1460 SACK_PERM=1 TSval=369931 TSecr=4192439835 WS=128","80","46744"
"60","1595011949.102","192.168.56.105","192.168.56.104","TCP","66","46744  >  80 [ACK] Seq=1 Ack=1 Win=64256 Len=0 TSval=4192439835 TSecr=369931","46744","80"
"61","1595011949.102","192.168.56.105","192.168.56.104","HTTP","312","GET /favicon.ico HTTP/1.1 ","46744","80"
"62","1595011949.102","192.168.56.104","192.168.56.105","TCP","66","80  >  46744 [ACK] Seq=1 Ack=247 Win=30080 Len=0 TSval=369931 TSecr=4192439835","80","46744"
"63","1595011949.117","192.168.56.105","192.168.56.104","TCP","74","46746  >  80 [SYN] Seq=0 Win=64240 Len=0 MSS=1460 SACK_PERM=1 TSval=4192439851 TSecr=0 WS=128","46746","80"
"64","1595011949.118","192.168.56.104","192.168.56.105","TCP","74","80  >  46746 [SYN, ACK] Seq=0 Ack=1 Win=28960 Len=0 MSS=1460 SACK_PERM=1 TSval=369935 TSecr=4192439851 WS=128","80","46746"
"65","1595011949.118","192.168.56.105","192.168.56.104","TCP","66","46746  >  80 [ACK] Seq=1 Ack=1 Win=64256 Len=0 TSval=4192439851 TSecr=369935","46746","80"
"66","1595011949.118","192.168.56.105","192.168.56.104","HTTP","364","GET /api/account HTTP/1.1 ","46746","80"
"67","1595011949.118","192.168.56.104","192.168.56.105","TCP","66","80  >  46746 [ACK] Seq=1 Ack=299 Win=30080 Len=0 TSval=369935 TSecr=4192439851","80","46746"
"68","1595011949.119","192.168.56.105","192.168.56.104","TCP","74","46748  >  80 [SYN] Seq=0 Win=64240 Len=0 MSS=1460 SACK_PERM=1 TSval=4192439853 TSecr=0 WS=128","46748","80"
"69","1595011949.120","192.168.56.104","192.168.56.105","TCP","74","80  >  46748 [SYN, ACK] Seq=0 Ack=1 Win=28960 Len=0 MSS=1460 SACK_PERM=1 TSval=369935 TSecr=4192439853 WS=128","80","46748"
"70","1595011949.120","192.168.56.105","192.168.56.104","TCP","66","46748  >  80 [ACK] Seq=1 Ack=1 Win=64256 Len=0 TSval=4192439853 TSecr=369935","46748","80"
"71","1595011949.120","192.168.56.105","192.168.56.104","HTTP","368","GET /management/info HTTP/1.1 ","46748","80"
"72","1595011949.120","192.168.56.104","192.168.56.105","TCP","66","80  >  46748 [ACK] Seq=1 Ack=303 Win=30080 Len=0 TSval=369935 TSecr=4192439853","80","46748"
"73","1595011949.245","192.168.56.104","192.168.56.105","HTTP","2519","HTTP/1.1 200 OK  (PNG)","80","46744"
"74","1595011949.245","192.168.56.105","192.168.56.104","TCP","66","46744  >  80 [ACK] Seq=247 Ack=2454 Win=63488 Len=0 TSval=4192439979 TSecr=369967","46744","80"
"75","1595011949.694","192.168.56.104","192.168.56.105","TCP","1160","80  >  46748 [PSH, ACK] Seq=1 Ack=303 Win=30080 Len=1094 TSval=370079 TSecr=4192439853 [TCP segment of a reassembled PDU]","80","46748"
"76","1595011949.694","192.168.56.105","192.168.56.104","TCP","66","46748  >  80 [ACK] Seq=303 Ack=1095 Win=64128 Len=0 TSval=4192440427 TSecr=370079","46748","80"
"77","1595011949.716","192.168.56.104","192.168.56.105","TCP","82","80  >  46748 [PSH, ACK] Seq=1095 Ack=303 Win=30080 Len=16 TSval=370084 TSecr=4192440427 [TCP segment of a reassembled PDU]","80","46748"
"78","1595011949.716","192.168.56.105","192.168.56.104","TCP","66","46748  >  80 [ACK] Seq=303 Ack=1111 Win=64128 Len=0 TSval=4192440449 TSecr=370084","46748","80"
"79","1595011949.721","192.168.56.104","192.168.56.105","HTTP","71","HTTP/1.1 200 OK  (application/json)","80","46748"
"80","1595011949.721","192.168.56.105","192.168.56.104","TCP","66","46748  >  80 [ACK] Seq=303 Ack=1116 Win=64128 Len=0 TSval=4192440454 TSecr=370086","46748","80"
"81","1595011949.744","192.168.56.104","192.168.56.105","TCP","1128","80  >  46746 [PSH, ACK] Seq=1 Ack=299 Win=30080 Len=1062 TSval=370091 TSecr=4192439851 [TCP segment of a reassembled PDU]","80","46746"
"82","1595011949.744","192.168.56.105","192.168.56.104","TCP","66","46746  >  80 [ACK] Seq=299 Ack=1063 Win=64128 Len=0 TSval=4192440477 TSecr=370091","46746","80"
"83","1595011949.748","192.168.56.104","192.168.56.105","HTTP","71","HTTP/1.1 401 Unauthorized  (application/problem+json)","80","46746"
"84","1595011949.748","192.168.56.105","192.168.56.104","TCP","66","46746  >  80 [ACK] Seq=299 Ack=1068 Win=64128 Len=0 TSval=4192440482 TSecr=370092","46746","80"
"85","1595011956.955","192.168.56.106","192.168.56.100","DHCP","342","DHCP Request  - Transaction ID 0x266c234d","68","67"
"86","1595011956.974","192.168.56.100","192.168.56.106","DHCP","590","DHCP ACK      - Transaction ID 0x266c234d","67","68"
"87","1595011958.851","192.168.56.105","192.168.56.104","HTTP","515","POST /api/authenticate HTTP/1.1  (application/json)","46744","80"
"88","1595011958.852","192.168.56.104","192.168.56.105","TCP","66","80  >  46744 [ACK] Seq=2454 Ack=696 Win=31104 Len=0 TSval=372368 TSecr=4192449585","80","46744"
"89","1595011959.743","192.168.56.105","192.168.56.104","TCP","66","[TCP Keep-Alive] 46748  >  80 [ACK] Seq=302 Ack=1116 Win=64128 Len=0 TSval=4192450476 TSecr=370086","46748","80"
"90","1595011959.743","192.168.56.104","192.168.56.105","TCP","66","[TCP Keep-Alive ACK] 80  >  46748 [ACK] Seq=1116 Ack=303 Win=30080 Len=0 TSval=372591 TSecr=4192440454","80","46748"
"91","1595011959.771","192.168.56.105","192.168.56.104","TCP","66","[TCP Keep-Alive] 46746  >  80 [ACK] Seq=298 Ack=1068 Win=64128 Len=0 TSval=4192450505 TSecr=370092","46746","80"
"92","1595011959.771","192.168.56.104","192.168.56.105","TCP","66","[TCP Keep-Alive ACK] 80  >  46746 [ACK] Seq=1068 Ack=299 Win=30080 Len=0 TSval=372598 TSecr=4192440482","80","46746"
"93","1595011960.016","192.168.56.104","192.168.56.105","TCP","1317","80  >  46744 [PSH, ACK] Seq=2454 Ack=696 Win=31104 Len=1251 TSval=372659 TSecr=4192449585 [TCP segment of a reassembled PDU]","80","46744"
"94","1595011960.016","192.168.56.105","192.168.56.104","TCP","66","46744  >  80 [ACK] Seq=696 Ack=3705 Win=64128 Len=0 TSval=4192450749 TSecr=372659","46744","80"
"95","1595011960.023","192.168.56.104","192.168.56.105","TCP","82","80  >  46744 [PSH, ACK] Seq=3705 Ack=696 Win=31104 Len=16 TSval=372661 TSecr=4192450749 [TCP segment of a reassembled PDU]","80","46744"
"96","1595011960.023","192.168.56.105","192.168.56.104","TCP","66","46744  >  80 [ACK] Seq=696 Ack=3721 Win=64128 Len=0 TSval=4192450757 TSecr=372661","46744","80"
"97","1595011960.023","192.168.56.104","192.168.56.105","HTTP","71","HTTP/1.1 200 OK  (application/json)","80","46744"
"98","1595011960.023","192.168.56.105","192.168.56.104","TCP","66","46744  >  80 [ACK] Seq=696 Ack=3726 Win=64128 Len=0 TSval=4192450757 TSecr=372661","46744","80"
"99","1595011960.081","192.168.56.105","192.168.56.104","HTTP","568","GET /api/account HTTP/1.1 ","46744","80"
"100","1595011960.081","192.168.56.104","192.168.56.105","TCP","66","80  >  46744 [ACK] Seq=3726 Ack=1198 Win=32256 Len=0 TSval=372676 TSecr=4192450814","80","46744"
"101","1595011960.329","192.168.56.104","192.168.56.105","TCP","1124","80  >  46744 [PSH, ACK] Seq=3726 Ack=1198 Win=32256 Len=1058 TSval=372738 TSecr=4192450814 [TCP segment of a reassembled PDU]","80","46744"
"102","1595011960.329","192.168.56.105","192.168.56.104","TCP","66","46744  >  80 [ACK] Seq=1198 Ack=4784 Win=64128 Len=0 TSval=4192451063 TSecr=372738","46744","80"
"103","1595011960.337","192.168.56.104","192.168.56.105","TCP","82","80  >  46744 [PSH, ACK] Seq=4784 Ack=1198 Win=32256 Len=16 TSval=372740 TSecr=4192451063 [TCP segment of a reassembled PDU]","80","46744"
"104","1595011960.337","192.168.56.105","192.168.56.104","TCP","66","46744  >  80 [ACK] Seq=1198 Ack=4800 Win=64128 Len=0 TSval=4192451070 TSecr=372740","46744","80"
"105","1595011960.337","192.168.56.104","192.168.56.105","HTTP","71","HTTP/1.1 200 OK  (application/json)","80","46744"
"106","1595011960.337","192.168.56.105","192.168.56.104","TCP","66","46744  >  80 [ACK] Seq=1198 Ack=4805 Win=64128 Len=0 TSval=4192451070 TSecr=372740","46744","80"
"107","1595011962.132","PcsCompu_93:e0:ab","PcsCompu_b7:12:b1","ARP","60","Who has 192.168.56.100? Tell 192.168.56.106","",""
"108","1595011962.132","PcsCompu_b7:12:b1","PcsCompu_93:e0:ab","ARP","60","192.168.56.100 is at 08:00:27:b7:12:b1","",""
"109","1595011964.889","192.168.56.105","192.168.56.104","HTTP","632","GET /api/customer?page=0&size=20&sort=id,asc&cacheBuster=1595011964875 HTTP/1.1 ","46744","80"
"110","1595011964.889","192.168.56.104","192.168.56.105","TCP","66","80  >  46744 [ACK] Seq=4805 Ack=1764 Win=33408 Len=0 TSval=373878 TSecr=4192455622","80","46744"
"111","1595011964.892","192.168.56.105","192.168.56.104","HTTP","578","GET /api/account HTTP/1.1 ","46748","80"
"112","1595011964.892","192.168.56.104","192.168.56.105","TCP","66","80  >  46748 [ACK] Seq=1116 Ack=815 Win=31104 Len=0 TSval=373879 TSecr=4192455625","80","46748"
"113","1595011964.957","192.168.56.104","192.168.56.105","TCP","1124","80  >  46748 [PSH, ACK] Seq=1116 Ack=815 Win=31104 Len=1058 TSval=373895 TSecr=4192455625 [TCP segment of a reassembled PDU]","80","46748"
"114","1595011964.957","192.168.56.105","192.168.56.104","TCP","66","46748  >  80 [ACK] Seq=815 Ack=2174 Win=64128 Len=0 TSval=4192455691 TSecr=373895","46748","80"
"115","1595011964.965","192.168.56.104","192.168.56.105","TCP","82","80  >  46748 [PSH, ACK] Seq=2174 Ack=815 Win=31104 Len=16 TSval=373897 TSecr=4192455691 [TCP segment of a reassembled PDU]","80","46748"
"116","1595011964.965","192.168.56.105","192.168.56.104","TCP","66","46748  >  80 [ACK] Seq=815 Ack=2190 Win=64128 Len=0 TSval=4192455698 TSecr=373897","46748","80"
"117","1595011964.965","192.168.56.104","192.168.56.105","HTTP","71","HTTP/1.1 200 OK  (application/json)","80","46748"
"118","1595011964.965","192.168.56.105","192.168.56.104","TCP","66","46748  >  80 [ACK] Seq=815 Ack=2195 Win=64128 Len=0 TSval=4192455698 TSecr=373897","46748","80"
"119","1595011965.182","192.168.56.104","192.168.56.105","TCP","1323","80  >  46744 [PSH, ACK] Seq=4805 Ack=1764 Win=33408 Len=1257 TSval=373951 TSecr=4192455622 [TCP segment of a reassembled PDU]","80","46744"
"120","1595011965.182","192.168.56.105","192.168.56.104","TCP","66","46744  >  80 [ACK] Seq=1764 Ack=6062 Win=64128 Len=0 TSval=4192455915 TSecr=373951","46744","80"
"121","1595011965.193","192.168.56.104","192.168.56.105","TCP","82","80  >  46744 [PSH, ACK] Seq=6062 Ack=1764 Win=33408 Len=16 TSval=373954 TSecr=4192455915 [TCP segment of a reassembled PDU]","80","46744"
"122","1595011965.193","192.168.56.105","192.168.56.104","TCP","66","46744  >  80 [ACK] Seq=1764 Ack=6078 Win=64128 Len=0 TSval=4192455926 TSecr=373954","46744","80"
"123","1595011965.193","192.168.56.104","192.168.56.105","HTTP","71","HTTP/1.1 200 OK  (application/json)","80","46744"
"124","1595011965.193","192.168.56.105","192.168.56.104","TCP","66","46744  >  80 [ACK] Seq=1764 Ack=6083 Win=64128 Len=0 TSval=4192455926 TSecr=373954","46744","80"
"125","1595011969.883","192.168.56.105","192.168.56.104","TCP","66","[TCP Keep-Alive] 46746  >  80 [ACK] Seq=298 Ack=1068 Win=64128 Len=0 TSval=4192460617 TSecr=372598","46746","80"
"126","1595011969.884","192.168.56.104","192.168.56.105","TCP","66","[TCP Keep-Alive ACK] 80  >  46746 [ACK] Seq=1068 Ack=299 Win=30080 Len=0 TSval=375126 TSecr=4192440482","80","46746"
"127","1595011971.467","192.168.56.105","192.168.56.104","HTTP","578","GET /api/account HTTP/1.1 ","46744","80"
"128","1595011971.468","192.168.56.104","192.168.56.105","TCP","66","80  >  46744 [ACK] Seq=6083 Ack=2276 Win=34560 Len=0 TSval=375522 TSecr=4192462201","80","46744"
"129","1595011971.469","192.168.56.105","192.168.56.104","HTTP","632","GET /api/accounts?page=0&size=20&sort=id,asc&cacheBuster=1595011971456 HTTP/1.1 ","46748","80"
"130","1595011971.469","192.168.56.104","192.168.56.105","TCP","66","80  >  46748 [ACK] Seq=2195 Ack=1381 Win=32256 Len=0 TSval=375523 TSecr=4192462202","80","46748"
"131","1595011971.507","192.168.56.104","192.168.56.105","TCP","1124","80  >  46744 [PSH, ACK] Seq=6083 Ack=2276 Win=34560 Len=1058 TSval=375532 TSecr=4192462201 [TCP segment of a reassembled PDU]","80","46744"
"132","1595011971.507","192.168.56.105","192.168.56.104","TCP","66","46744  >  80 [ACK] Seq=2276 Ack=7141 Win=64128 Len=0 TSval=4192462241 TSecr=375532","46744","80"
"133","1595011971.517","192.168.56.104","192.168.56.105","TCP","82","80  >  46744 [PSH, ACK] Seq=7141 Ack=2276 Win=34560 Len=16 TSval=375535 TSecr=4192462241 [TCP segment of a reassembled PDU]","80","46744"
"134","1595011971.517","192.168.56.105","192.168.56.104","TCP","66","46744  >  80 [ACK] Seq=2276 Ack=7157 Win=64128 Len=0 TSval=4192462251 TSecr=375535","46744","80"
"135","1595011971.517","192.168.56.104","192.168.56.105","HTTP","71","HTTP/1.1 200 OK  (application/json)","80","46744"
"136","1595011971.517","192.168.56.105","192.168.56.104","TCP","66","46744  >  80 [ACK] Seq=2276 Ack=7162 Win=64128 Len=0 TSval=4192462251 TSecr=375535","46744","80"
"137","1595011971.651","192.168.56.104","192.168.56.105","TCP","1309","80  >  46748 [PSH, ACK] Seq=2195 Ack=1381 Win=32256 Len=1243 TSval=375568 TSecr=4192462202 [TCP segment of a reassembled PDU]","80","46748"
"138","1595011971.651","192.168.56.105","192.168.56.104","TCP","66","46748  >  80 [ACK] Seq=1381 Ack=3438 Win=64128 Len=0 TSval=4192462384 TSecr=375568","46748","80"
"139","1595011971.658","192.168.56.104","192.168.56.105","TCP","82","80  >  46748 [PSH, ACK] Seq=3438 Ack=1381 Win=32256 Len=16 TSval=375570 TSecr=4192462384 [TCP segment of a reassembled PDU]","80","46748"
"140","1595011971.658","192.168.56.105","192.168.56.104","TCP","66","46748  >  80 [ACK] Seq=1381 Ack=3454 Win=64128 Len=0 TSval=4192462391 TSecr=375570","46748","80"
"141","1595011971.658","192.168.56.104","192.168.56.105","HTTP","71","HTTP/1.1 200 OK  (application/json)","80","46748"
"142","1595011971.658","192.168.56.105","192.168.56.104","TCP","66","46748  >  80 [ACK] Seq=1381 Ack=3459 Win=64128 Len=0 TSval=4192462391 TSecr=375570","46748","80"
"143","1595011978.227","192.168.56.105","192.168.56.104","HTTP","639","GET /api/transactions?page=0&size=20&sort=id,asc&cacheBuster=1595011978202 HTTP/1.1 ","46744","80"
"144","1595011978.228","192.168.56.104","192.168.56.105","TCP","66","80  >  46744 [ACK] Seq=7162 Ack=2849 Win=35712 Len=0 TSval=377212 TSecr=4192468961","80","46744"
"145","1595011978.393","192.168.56.104","192.168.56.105","TCP","1286","80  >  46744 [PSH, ACK] Seq=7162 Ack=2849 Win=35712 Len=1220 TSval=377254 TSecr=4192468961 [TCP segment of a reassembled PDU]","80","46744"
"146","1595011978.393","192.168.56.105","192.168.56.104","TCP","66","46744  >  80 [ACK] Seq=2849 Ack=8382 Win=64128 Len=0 TSval=4192469126 TSecr=377254","46744","80"
"147","1595011978.396","192.168.56.104","192.168.56.105","TCP","82","80  >  46744 [PSH, ACK] Seq=8382 Ack=2849 Win=35712 Len=16 TSval=377254 TSecr=4192469126 [TCP segment of a reassembled PDU]","80","46744"
"148","1595011978.396","192.168.56.105","192.168.56.104","TCP","66","46744  >  80 [ACK] Seq=2849 Ack=8398 Win=64128 Len=0 TSval=4192469129 TSecr=377254","46744","80"
"149","1595011978.396","192.168.56.104","192.168.56.105","HTTP","71","HTTP/1.1 200 OK  (application/json)","80","46744"
"150","1595011978.396","192.168.56.105","192.168.56.104","TCP","66","46744  >  80 [ACK] Seq=2849 Ack=8403 Win=64128 Len=0 TSval=4192469129 TSecr=377254","46744","80"
"151","1595011980.125","192.168.56.105","192.168.56.104","TCP","66","[TCP Keep-Alive] 46746  >  80 [ACK] Seq=298 Ack=1068 Win=64128 Len=0 TSval=4192470858 TSecr=375126","46746","80"
"152","1595011980.125","192.168.56.104","192.168.56.105","TCP","66","[TCP Keep-Alive ACK] 80  >  46746 [ACK] Seq=1068 Ack=299 Win=30080 Len=0 TSval=377687 TSecr=4192440482","80","46746"
"153","1595011981.659","192.168.56.105","192.168.56.104","TCP","66","[TCP Keep-Alive] 46748  >  80 [ACK] Seq=1380 Ack=3459 Win=64128 Len=0 TSval=4192472393 TSecr=375570","46748","80"
"154","1595011981.660","192.168.56.104","192.168.56.105","TCP","66","[TCP Keep-Alive ACK] 80  >  46748 [ACK] Seq=3459 Ack=1381 Win=32256 Len=0 TSval=378070 TSecr=4192462391","80","46748"
"155","1595011982.767","192.168.56.102","192.168.56.100","DHCP","342","DHCP Request  - Transaction ID 0x99818152","68","67"
"156","1595011982.806","192.168.56.100","192.168.56.102","DHCP","590","DHCP ACK      - Transaction ID 0x99818152","67","68"
"157","1595011984.410","192.168.56.105","192.168.56.104","HTTP","612","GET /api/accounts?cacheBuster=1595011984356 HTTP/1.1 ","46744","80"
"158","1595011984.411","192.168.56.104","192.168.56.105","TCP","66","80  >  46744 [ACK] Seq=8403 Ack=3395 Win=36736 Len=0 TSval=378758 TSecr=4192475144","80","46744"
"159","1595011984.412","192.168.56.105","192.168.56.104","HTTP","609","GET /api/payee?cacheBuster=1595011984356 HTTP/1.1 ","46748","80"
"160","1595011984.412","192.168.56.104","192.168.56.105","TCP","66","80  >  46748 [ACK] Seq=3459 Ack=1924 Win=33408 Len=0 TSval=378758 TSecr=4192475145","80","46748"
"161","1595011984.498","192.168.56.104","192.168.56.105","TCP","1281","80  >  46744 [PSH, ACK] Seq=8403 Ack=3395 Win=36736 Len=1215 TSval=378780 TSecr=4192475144 [TCP segment of a reassembled PDU]","80","46744"
"162","1595011984.498","192.168.56.105","192.168.56.104","TCP","66","46744  >  80 [ACK] Seq=3395 Ack=9618 Win=64128 Len=0 TSval=4192475232 TSecr=378780","46744","80"
"163","1595011984.511","192.168.56.104","192.168.56.105","TCP","82","80  >  46744 [PSH, ACK] Seq=9618 Ack=3395 Win=36736 Len=16 TSval=378783 TSecr=4192475232 [TCP segment of a reassembled PDU]","80","46744"
"164","1595011984.511","192.168.56.105","192.168.56.104","TCP","66","46744  >  80 [ACK] Seq=3395 Ack=9634 Win=64128 Len=0 TSval=4192475245 TSecr=378783","46744","80"
"165","1595011984.511","192.168.56.104","192.168.56.105","HTTP","71","HTTP/1.1 200 OK  (application/json)","80","46744"
"166","1595011984.511","192.168.56.105","192.168.56.104","TCP","66","46744  >  80 [ACK] Seq=3395 Ack=9639 Win=64128 Len=0 TSval=4192475245 TSecr=378783","46744","80"
"167","1595011984.539","192.168.56.104","192.168.56.105","TCP","1150","80  >  46748 [PSH, ACK] Seq=3459 Ack=1924 Win=33408 Len=1084 TSval=378790 TSecr=4192475145 [TCP segment of a reassembled PDU]","80","46748"
"168","1595011984.539","192.168.56.105","192.168.56.104","TCP","66","46748  >  80 [ACK] Seq=1924 Ack=4543 Win=64128 Len=0 TSval=4192475273 TSecr=378790","46748","80"
"169","1595011984.546","192.168.56.104","192.168.56.105","TCP","82","80  >  46748 [PSH, ACK] Seq=4543 Ack=1924 Win=33408 Len=16 TSval=378792 TSecr=4192475273 [TCP segment of a reassembled PDU]","80","46748"
"170","1595011984.546","192.168.56.105","192.168.56.104","TCP","66","46748  >  80 [ACK] Seq=1924 Ack=4559 Win=64128 Len=0 TSval=4192475279 TSecr=378792","46748","80"
"171","1595011984.546","192.168.56.104","192.168.56.105","HTTP","71","HTTP/1.1 200 OK  (application/json)","80","46748"
"172","1595011984.546","192.168.56.105","192.168.56.104","TCP","66","46748  >  80 [ACK] Seq=1924 Ack=4564 Win=64128 Len=0 TSval=4192475279 TSecr=378792","46748","80"
"173","1595011987.772","PcsCompu_af:7b:18","PcsCompu_b7:12:b1","ARP","60","Who has 192.168.56.100? Tell 192.168.56.102","",""
"174","1595011987.772","PcsCompu_b7:12:b1","PcsCompu_af:7b:18","ARP","60","192.168.56.100 is at 08:00:27:b7:12:b1","",""
"175","1595011990.363","192.168.56.105","192.168.56.104","TCP","66","[TCP Keep-Alive] 46746  >  80 [ACK] Seq=298 Ack=1068 Win=64128 Len=0 TSval=4192481096 TSecr=377687","46746","80"
"176","1595011990.364","192.168.56.104","192.168.56.105","TCP","66","[TCP Keep-Alive ACK] 80  >  46746 [ACK] Seq=1068 Ack=299 Win=30080 Len=0 TSval=380246 TSecr=4192440482","80","46746"
"177","1595011994.303","192.168.56.105","192.168.56.104","HTTP","639","GET /api/transactions?page=0&size=20&sort=id,asc&cacheBuster=1595011994290 HTTP/1.1 ","46744","80"
"178","1595011994.304","192.168.56.104","192.168.56.105","TCP","66","80  >  46744 [ACK] Seq=9639 Ack=3968 Win=37888 Len=0 TSval=381231 TSecr=4192485036","80","46744"
"179","1595011994.367","192.168.56.104","192.168.56.105","TCP","1286","80  >  46744 [PSH, ACK] Seq=9639 Ack=3968 Win=37888 Len=1220 TSval=381247 TSecr=4192485036 [TCP segment of a reassembled PDU]","80","46744"
"180","1595011994.367","192.168.56.105","192.168.56.104","TCP","66","46744  >  80 [ACK] Seq=3968 Ack=10859 Win=64128 Len=0 TSval=4192485100 TSecr=381247","46744","80"
"181","1595011994.369","192.168.56.104","192.168.56.105","TCP","82","80  >  46744 [PSH, ACK] Seq=10859 Ack=3968 Win=37888 Len=16 TSval=381248 TSecr=4192485100 [TCP segment of a reassembled PDU]","80","46744"
"182","1595011994.369","192.168.56.105","192.168.56.104","TCP","66","46744  >  80 [ACK] Seq=3968 Ack=10875 Win=64128 Len=0 TSval=4192485103 TSecr=381248","46744","80"
"183","1595011994.369","192.168.56.104","192.168.56.105","HTTP","71","HTTP/1.1 200 OK  (application/json)","80","46744"
"184","1595011994.369","192.168.56.105","192.168.56.104","TCP","66","46744  >  80 [ACK] Seq=3968 Ack=10880 Win=64128 Len=0 TSval=4192485103 TSecr=381248","46744","80"
"185","1595011994.715","192.168.56.105","192.168.56.104","TCP","66","[TCP Keep-Alive] 46748  >  80 [ACK] Seq=1923 Ack=4564 Win=64128 Len=0 TSval=4192485448 TSecr=378792","46748","80"
"186","1595011994.715","192.168.56.104","192.168.56.105","TCP","66","[TCP Keep-Alive ACK] 80  >  46748 [ACK] Seq=4564 Ack=1924 Win=33408 Len=0 TSval=381334 TSecr=4192475279","80","46748"
"187","1595012000.618","192.168.56.105","192.168.56.104","TCP","66","[TCP Keep-Alive] 46746  >  80 [ACK] Seq=298 Ack=1068 Win=64128 Len=0 TSval=4192491351 TSecr=380246","46746","80"
"188","1595012000.619","192.168.56.104","192.168.56.105","TCP","66","[TCP Keep-Alive ACK] 80  >  46746 [ACK] Seq=1068 Ack=299 Win=30080 Len=0 TSval=382810 TSecr=4192440482","80","46746"
"189","1595012004.444","192.168.56.105","192.168.56.104","TCP","66","[TCP Keep-Alive] 46744  >  80 [ACK] Seq=3967 Ack=10880 Win=64128 Len=0 TSval=4192495177 TSecr=381248","46744","80"
"190","1595012004.445","192.168.56.104","192.168.56.105","TCP","66","[TCP Keep-Alive ACK] 80  >  46744 [ACK] Seq=10880 Ack=3968 Win=37888 Len=0 TSval=383767 TSecr=4192485103","80","46744"
"191","1595012004.955","192.168.56.105","192.168.56.104","TCP","66","[TCP Keep-Alive] 46748  >  80 [ACK] Seq=1923 Ack=4564 Win=64128 Len=0 TSval=4192495689 TSecr=381334","46748","80"
"192","1595012004.956","192.168.56.104","192.168.56.105","TCP","66","[TCP Keep-Alive ACK] 80  >  46748 [ACK] Seq=4564 Ack=1924 Win=33408 Len=0 TSval=383894 TSecr=4192475279","80","46748"
"193","1595012009.805","192.168.56.104","192.168.56.105","TCP","66","80  >  46746 [FIN, ACK] Seq=1068 Ack=299 Win=30080 Len=0 TSval=385107 TSecr=4192440482","80","46746"
"194","1595012009.805","192.168.56.105","192.168.56.104","TCP","66","46746  >  80 [FIN, ACK] Seq=299 Ack=1069 Win=64128 Len=0 TSval=4192500539 TSecr=385107","46746","80"
"195","1595012009.806","192.168.56.104","192.168.56.105","TCP","66","80  >  46746 [ACK] Seq=1069 Ack=300 Win=30080 Len=0 TSval=385107 TSecr=4192500539","80","46746"
"196","1595012014.683","192.168.56.105","192.168.56.104","TCP","66","[TCP Keep-Alive] 46744  >  80 [ACK] Seq=3967 Ack=10880 Win=64128 Len=0 TSval=4192505416 TSecr=383767","46744","80"
"197","1595012014.684","192.168.56.104","192.168.56.105","TCP","66","[TCP Keep-Alive ACK] 80  >  46744 [ACK] Seq=10880 Ack=3968 Win=37888 Len=0 TSval=386326 TSecr=4192485103","80","46744"
"198","1595012015.196","192.168.56.105","192.168.56.104","TCP","66","[TCP Keep-Alive] 46748  >  80 [ACK] Seq=1923 Ack=4564 Win=64128 Len=0 TSval=4192505929 TSecr=383894","46748","80"
"199","1595012015.196","192.168.56.104","192.168.56.105","TCP","66","[TCP Keep-Alive ACK] 80  >  46748 [ACK] Seq=4564 Ack=1924 Win=33408 Len=0 TSval=386455 TSecr=4192475279","80","46748"
"200","1595012018.070","192.168.56.105","192.168.56.104","HTTP","968","POST /api/mediaFiles HTTP/1.1  (text/plain)","46744","80"
"201","1595012018.070","192.168.56.104","192.168.56.105","TCP","66","80  >  46744 [ACK] Seq=10880 Ack=4870 Win=39808 Len=0 TSval=387173 TSecr=4192508803","80","46744"
"202","1595012018.187","192.168.56.104","192.168.56.105","TCP","1161","80  >  46744 [PSH, ACK] Seq=10880 Ack=4870 Win=39808 Len=1095 TSval=387202 TSecr=4192508803 [TCP segment of a reassembled PDU]","80","46744"
"203","1595012018.187","192.168.56.105","192.168.56.104","TCP","66","46744  >  80 [ACK] Seq=4870 Ack=11975 Win=64128 Len=0 TSval=4192508921 TSecr=387202","46744","80"
"204","1595012018.198","192.168.56.104","192.168.56.105","HTTP","71","HTTP/1.1 500 Internal Server Error  (application/problem+json)","80","46744"
"205","1595012018.198","192.168.56.105","192.168.56.104","TCP","66","46744  >  80 [ACK] Seq=4870 Ack=11980 Win=64128 Len=0 TSval=4192508931 TSecr=387205","46744","80"
"206","1595012025.102","192.168.56.102","192.168.56.255","NBNS","92","Name query NB WORKGROUP<1d>","137","137"
"207","1595012025.102","192.168.56.1","255.255.255.255","NBNS","92","Name query NB WORKGROUP<1d>","56901","137"
"208","1595012025.102","192.168.56.101","192.168.56.102","NBNS","104","Name query response NB 192.168.56.101","137","137"
"209","1595012025.102","192.168.56.101","192.168.56.1","NBNS","104","Name query response NB 192.168.56.101","137","56901"
"210","1595012025.440","192.168.56.105","192.168.56.104","TCP","66","[TCP Keep-Alive] 46748  >  80 [ACK] Seq=1923 Ack=4564 Win=64128 Len=0 TSval=4192516174 TSecr=386455","46748","80"
"211","1595012025.441","192.168.56.104","192.168.56.105","TCP","66","[TCP Keep-Alive ACK] 80  >  46748 [ACK] Seq=4564 Ack=1924 Win=33408 Len=0 TSval=389016 TSecr=4192475279","80","46748"
"212","1595012026.605","192.168.56.105","192.168.56.100","DHCP","342","DHCP Request  - Transaction ID 0x77c49f72","68","67"
"213","1595012026.635","192.168.56.100","192.168.56.105","DHCP","590","DHCP ACK      - Transaction ID 0x77c49f72","67","68"
"214","1595012027.454","192.168.56.105","192.168.56.104","HTTP","380","GET /app/account.2217590b5cc5d0b62058.chunk.js HTTP/1.1 ","46744","80"
"215","1595012027.454","192.168.56.104","192.168.56.105","TCP","66","80  >  46744 [ACK] Seq=11980 Ack=5184 Win=41600 Len=0 TSval=389519 TSecr=4192518188","80","46744"
"216","1595012027.471","192.168.56.104","192.168.56.105","HTTP","1361","HTTP/1.1 200 OK  (application/javascript)","80","46744"
"217","1595012027.471","192.168.56.105","192.168.56.104","TCP","66","46744  >  80 [ACK] Seq=5184 Ack=13275 Win=64128 Len=0 TSval=4192518205 TSecr=389523","46744","80"
"218","1595012027.499","192.168.56.105","192.168.56.104","HTTP","579","GET /api/account HTTP/1.1 ","46744","80"
"219","1595012027.521","192.168.56.104","192.168.56.105","TCP","1124","80  >  46744 [PSH, ACK] Seq=13275 Ack=5697 Win=43392 Len=1058 TSval=389536 TSecr=4192518232 [TCP segment of a reassembled PDU]","80","46744"
"220","1595012027.521","192.168.56.105","192.168.56.104","TCP","66","46744  >  80 [ACK] Seq=5697 Ack=14333 Win=64128 Len=0 TSval=4192518255 TSecr=389536","46744","80"
"221","1595012027.528","192.168.56.104","192.168.56.105","TCP","82","80  >  46744 [PSH, ACK] Seq=14333 Ack=5697 Win=43392 Len=16 TSval=389537 TSecr=4192518255 [TCP segment of a reassembled PDU]","80","46744"
"222","1595012027.528","192.168.56.105","192.168.56.104","TCP","66","46744  >  80 [ACK] Seq=5697 Ack=14349 Win=64128 Len=0 TSval=4192518261 TSecr=389537","46744","80"
"223","1595012027.528","192.168.56.104","192.168.56.105","HTTP","71","HTTP/1.1 200 OK  (application/json)","80","46744"
"224","1595012027.528","192.168.56.105","192.168.56.104","TCP","66","46744  >  80 [ACK] Seq=5697 Ack=14354 Win=64128 Len=0 TSval=4192518262 TSecr=389538","46744","80"
"225","1595012030.105","PcsCompu_ae:93:92","PcsCompu_af:7b:18","ARP","60","Who has 192.168.56.102? Tell 192.168.56.101","",""
"226","1595012030.105","PcsCompu_ae:93:92","0a:00:27:00:00:1a","ARP","60","Who has 192.168.56.1? Tell 192.168.56.101","",""
"227","1595012030.105","0a:00:27:00:00:1a","PcsCompu_ae:93:92","ARP","60","192.168.56.1 is at 0a:00:27:00:00:1a","",""
"228","1595012030.106","PcsCompu_af:7b:18","PcsCompu_ae:93:92","ARP","60","192.168.56.102 is at 08:00:27:af:7b:18","",""
"229","1595012031.835","PcsCompu_74:73:8a","PcsCompu_b7:12:b1","ARP","42","Who has 192.168.56.100? Tell 192.168.56.105","",""
"230","1595012031.835","PcsCompu_b7:12:b1","PcsCompu_74:73:8a","ARP","60","192.168.56.100 is at 08:00:27:b7:12:b1","",""
"231","1595012035.675","192.168.56.105","192.168.56.104","TCP","66","[TCP Keep-Alive] 46748  >  80 [ACK] Seq=1923 Ack=4564 Win=64128 Len=0 TSval=4192526408 TSecr=389016","46748","80"
"232","1595012035.675","192.168.56.104","192.168.56.105","TCP","66","[TCP Keep-Alive ACK] 80  >  46748 [ACK] Seq=4564 Ack=1924 Win=33408 Len=0 TSval=391574 TSecr=4192475279","80","46748"
"233","1595012037.723","192.168.56.105","192.168.56.104","TCP","66","[TCP Keep-Alive] 46744  >  80 [ACK] Seq=5696 Ack=14354 Win=64128 Len=0 TSval=4192528457 TSecr=389538","46744","80"
"234","1595012037.724","192.168.56.104","192.168.56.105","TCP","66","[TCP Keep-Alive ACK] 80  >  46744 [ACK] Seq=14354 Ack=5697 Win=43392 Len=0 TSval=392086 TSecr=4192518262","80","46744"
"235","1595012038.130","192.168.56.105","192.168.56.104","TCP","66","46748  >  80 [FIN, ACK] Seq=1924 Ack=4564 Win=64128 Len=0 TSval=4192528863 TSecr=391574","46748","80"
"236","1595012038.130","192.168.56.105","192.168.56.104","TCP","66","46744  >  80 [FIN, ACK] Seq=5697 Ack=14354 Win=64128 Len=0 TSval=4192528864 TSecr=392086","46744","80"
"237","1595012038.131","192.168.56.104","192.168.56.105","TCP","66","80  >  46748 [FIN, ACK] Seq=4564 Ack=1925 Win=33408 Len=0 TSval=392188 TSecr=4192528863","80","46748"
"238","1595012038.131","192.168.56.105","192.168.56.104","TCP","66","46748  >  80 [ACK] Seq=1925 Ack=4565 Win=64128 Len=0 TSval=4192528864 TSecr=392188","46748","80"
"239","1595012038.131","192.168.56.104","192.168.56.105","TCP","66","80  >  46744 [FIN, ACK] Seq=14354 Ack=5698 Win=43392 Len=0 TSval=392188 TSecr=4192528864","80","46744"
"240","1595012038.131","192.168.56.105","192.168.56.104","TCP","66","46744  >  80 [ACK] Seq=5698 Ack=14355 Win=64128 Len=0 TSval=4192528865 TSecr=392188","46744","80"
"241","1595012053.078","PcsCompu_93:e0:ab","Broadcast","ARP","60","Who has 192.168.56.104? Tell 192.168.56.106","",""
"242","1595012053.078","PcsCompu_6c:9b:66","PcsCompu_93:e0:ab","ARP","60","192.168.56.104 is at 08:00:27:6c:9b:66","",""
"243","1595012053.079","192.168.56.106","192.168.56.104","TCP","74","40624  >  80 [SYN] Seq=0 Win=29200 Len=0 MSS=1460 SACK_PERM=1 TSval=401488 TSecr=0 WS=128","40624","80"
"244","1595012053.079","192.168.56.104","192.168.56.106","TCP","74","80  >  40624 [SYN, ACK] Seq=0 Ack=1 Win=28960 Len=0 MSS=1460 SACK_PERM=1 TSval=395925 TSecr=401488 WS=128","80","40624"
"245","1595012053.079","192.168.56.106","192.168.56.104","TCP","66","40624  >  80 [ACK] Seq=1 Ack=1 Win=29312 Len=0 TSval=401489 TSecr=395925","40624","80"
"246","1595012053.079","192.168.56.106","192.168.56.104","HTTP","429","GET / HTTP/1.1 ","40624","80"
"247","1595012053.079","192.168.56.104","192.168.56.106","TCP","66","80  >  40624 [ACK] Seq=1 Ack=364 Win=30080 Len=0 TSval=395925 TSecr=401489","80","40624"
"248","1595012053.106","192.168.56.104","192.168.56.106","HTTP","3252","HTTP/1.1 200 OK  (text/html)","80","40624"
